datePublished,ratingValue,bestRating,header,author,reviewBody,recommended,stats
2024-03-31,3,10,"""poorly planned annex wing"" ",J Devito,"Not Verified |   I'm not sure what ultimate plan is for gates C4- C11 is, but in its current state, its awful. I have never walked as much as I have in an airport as I have here. The shuttle bus process is really bad. Driving in a fully loaded bus with NO air is un excusable. The two tiny windows that were letting a tiny bit of air were not enough. We ended up sitting on the bus for a good 4 or 5 minutes while we waited for 3 Southwest planes to pass. When the last jet went by and started throttling up we got a nice HOT blast of the smell of jet fuel.  I can't say that I won't be back, but we may change airlines so we don't need to endure the poorly planned annex wing.",yes,"{'Experience At Airport': 'Arrival and Departure', 'Date Visit': 'March 2024', 'Type Of Traveller': 'Couple Leisure', 'Queuing Times': 3, 'Terminal Cleanliness': 4, 'Terminal Seating': 5, 'Terminal Signs': 1, 'Food Beverages': 3, 'Airport Staff': 5, 'Recommended': 'yes'}"
2024-03-22,3,10,"""Poor design and poor governance""",Bryan Blair,Not Verified |  Shuttle between terminals to get to bag claim takes forever. Very poor design has shuttle bus.  Absolutely no controls at ride share pickup. Ubers double parried everywhere created 15 minute traffic jam delay. If you come to Nashville airport plan to wait. Everything takes three times longer than required. Poor design and poor governance.,,"{'Experience At Airport': 'Arrival Only', 'Date Visit': 'March 2024', 'Type Of Traveller': 'Business', 'Queuing Times': 1, 'Terminal Cleanliness': 2, 'Terminal Signs': 3, 'Food Beverages': 0, 'Airport Staff': 1, 'Recommended': 'no'}"
2023-12-28,1,10,"""Worst experience arriving""",S Lavin,"Not Verified |  Worst experience arriving to an airport. Have to stand in extremely long line waiting for shuttle to take you to main terminal to then get your bags and rental car. Took over 15 minutes standing in line with no official information from the airport staff. All information came from locals who were also in the line. Worst experience, arriving in a city. No soap on the ladies bathroom. Finally get on the shuttle to stand on the runway waiting for planes to taxi in and out. So now on a crowded shuttle watching planes move all around and still not to the terminal. Absolutely ridiculous and a miserable introduction to a city.",,"{'Experience At Airport': 'Arrival Only', 'Date Visit': 'December 2023', 'Type Of Traveller': 'Family Leisure', 'Queuing Times': 1, 'Terminal Cleanliness': 2, 'Terminal Seating': 1, 'Terminal Signs': 1, 'Food Beverages': 1, 'Airport Shopping': 1, 'Wifi Connectivity': 1, 'Airport Staff': 1, 'Recommended': 'no'}"
2023-11-26,5,10,"""employees had zero sense""",Michelle Addy,"✅ Trip Verified |  After having stood in line with my family for an hour and finally reaching the check-in counters for our airline, we were told to wait while while another 20+ people checked in before us, causing us to wait another 30 minutes. We were the only ones going to a separate state, so it would have been so easy to just check our 2 bags when we first got to check-in. So because adults couldn't plan ahead and get to the airport with plenty of time for their flight, we were the ones that had to stand there and wait for them. We finally made it to our gate with 10 minutes to spare. To say I was angry and frustrated that the employees had zero sense, is an understatement.",,"{'Experience At Airport': 'Departure Only', 'Date Visit': 'November 2023', 'Type Of Traveller': 'Family Leisure', 'Queuing Times': 4, 'Terminal Cleanliness': 4, 'Terminal Seating': 3, 'Terminal Signs': 5, 'Food Beverages': 4, 'Airport Shopping': 4, 'Wifi Connectivity': 4, 'Airport Staff': 2, 'Recommended': 'no'}"
2023-10-31,10,10,"""Had a great experience""",S Palen,"✅ Trip Verified |  Had a great experience. Going through security was fast, had no wait time. They had great local beers on tap and even a smoking section. It costs 10 bucks to enter, but considering I haven't been in an airport that had one in 15 years it made the wait SO much better. 10/10 will layover in.",yes,"{'Experience At Airport': 'Departure Only', 'Date Visit': 'October 2023', 'Type Of Traveller': 'Solo Leisure', 'Queuing Times': 5, 'Terminal Cleanliness': 4, 'Terminal Seating': 4, 'Terminal Signs': 4, 'Food Beverages': 5, 'Airport Shopping': 3, 'Wifi Connectivity': 3, 'Airport Staff': 4, 'Recommended': 'yes'}"
2023-04-04,2,10,"""unsatisfactory and unacceptable""",O Allen,✅ Trip Verified | I am writing to complain about the cost of long-term economy parking. I have lived in large cities around the country and long-term economy parking is around 8-10$ per day. This airport has continuously raised its long-term parking fee over the last few years to a now astronomical amount of 18$ per day! That is unsatisfactory and unacceptable. There have been no improvements to the parking lot and there are not buses running more often to them. Why the unreasonable raise. The traffic at the terminals themselves is also horrible. People will be waiting for almost an hour to pick someone up around the holidays.,,"{'Experience At Airport': 'Arrival and Departure', 'Date Visit': 'April 2023', 'Type Of Traveller': 'Couple Leisure', 'Queuing Times': 1, 'Terminal Cleanliness': 3, 'Terminal Seating': 3, 'Terminal Signs': 3, 'Food Beverages': 3, 'Airport Shopping': 3, 'Airport Staff': 3, 'Recommended': 'no'}"
2023-04-03,1,10,"""everything is worse than was before""",E Hanes,"✅ Trip Verified |  Getting in and out of the airport is now a real problem. Traffic does not flow around and is backed up constantly. New design has added stop lights which just backs up traffic even more. Years ago, BNA built a parking deck, then 2 years ago tore it down to do the new terminal and parking. Now everything is worse than was before. Even the shuttles to the parking areas are affected and now take forever to go to and from the pickup/drop off areas. Parking spaces are blocked off, constant construction. Cell phone lots have moved off site causing drivers to “Park” on the road. Traffic cops at arrivals do not enforce people from parking and moving on causing traffic to back up all the way around the short term parking area.",,"{'Experience At Airport': 'Departure Only', 'Date Visit': 'March 2023', 'Type Of Traveller': 'Couple Leisure', 'Queuing Times': 4, 'Terminal Cleanliness': 4, 'Terminal Seating': 4, 'Terminal Signs': 1, 'Food Beverages': 3, 'Airport Shopping': 3, 'Wifi Connectivity': 1, 'Airport Staff': 3, 'Recommended': 'no'}"
2022-12-23,2,10,"""Very very dissatisfied""",Tanny Crawford,Not Verified | Flight 1101. Dec 23 12:23AM: We have been sitting on the tarmac for 2 hours tonight. Yes there was some snow here. We were told there are no open gates. Get the other passengers off the planes at the gates if they aren’t going to fly out. There is no reason for planes to stay boarded sitting and blocking the gates. Ridiculous. Very very dissatisfied.,,"{'Experience At Airport': 'Departure Only', 'Date Visit': 'December 2022', 'Type Of Traveller': 'Family Leisure', 'Queuing Times': 1, 'Terminal Cleanliness': 5, 'Terminal Signs': 1, 'Food Beverages': 0, 'Recommended': 'no'}"
2022-11-21,9,10,"""super customer friendly service""",Mary Koets,✅ Trip Verified | Fantastic. Ample and clean restrooms. Great restaurants. Napping rooms available to rent. Everyone was kind and assisted as needed. They asked me if I needed help. Super customer friendly service.,yes,"{'Experience At Airport': 'Transit', 'Date Visit': 'November 2022', 'Type Of Traveller': 'Solo Leisure', 'Queuing Times': 4, 'Terminal Cleanliness': 4, 'Terminal Seating': 3, 'Terminal Signs': 4, 'Food Beverages': 5, 'Airport Shopping': 5, 'Wifi Connectivity': 4, 'Airport Staff': 5, 'Recommended': 'yes'}"
2022-09-16,2,10,"""Extremely noisy""",M Williams,"Not Verified |  Extremely noisy. Loud music, requiring loud announcements. In C terminal floor constantly shakes, it seems to be an engineering flaw. Avoid if you need to layover.",,"{'Experience At Airport': 'Departure Only', 'Date Visit': 'September 2022', 'Type Of Traveller': 'Business', 'Queuing Times': 4, 'Terminal Cleanliness': 4, 'Terminal Seating': 4, 'Terminal Signs': 3, 'Food Beverages': 4, 'Airport Shopping': 3, 'Wifi Connectivity': 4, 'Airport Staff': 4, 'Recommended': 'no'}"
2022-06-03,4,10,"""food and shops quite sparse""",L McKechnie,"✅ Trip Verified |  This was my first visit to Nashville airport and it will be my last. We arrived to fly back home to the UK. Airport was under construction, very few seats to sit while you waited for check-in to open. No where to purchase any snacks while waiting. After we checked in we had priority security. We proceeded to use priority lane but got so far and it was closed. There was a few of us and we had to join the end of the queue. One of the gentlemen asked a TSA agent what was happening with security. She was extremely rude and dismissive of him. So much for friendly and helpful staff! After security the selection of food and shops is quite sparse. Not what I would have expected from an airport the size of Nashville. We were extremely disappointed with our experience of this airport!",,"{'Experience At Airport': 'Departure Only', 'Date Visit': 'May 2022', 'Type Of Traveller': 'Couple Leisure', 'Queuing Times': 2, 'Terminal Cleanliness': 3, 'Terminal Seating': 1, 'Terminal Signs': 3, 'Food Beverages': 1, 'Airport Shopping': 1, 'Wifi Connectivity': 2, 'Airport Staff': 1, 'Recommended': 'no'}"
2022-05-07,1,10,"""I was exhausted and had no one to ask for directions!""",John Allen,"Not Verified |  Before I arrived, I called to check on parking. The last time I was there the sign pointed straight ahead for Terminal B parking. Didn't know you had to drive all the way around the airport to find Terminal B because there were no more signs. So, the operator who answered was very condescending and impatient. As if I was taking up his time. The place can be very confusing if you only use it every couple of years. I took the ""shuttle"" to the terminal. On the way home, in the baggage area, a sign said ""shuttles"" with an arrow. I walked and walked and walked with my bags to where there were buses. I asked which one to Terminal B parking. They were all buses to hotels! I was exhausted and had no one to ask for directions! They need people in booths or walking around who can answer questions!",yes,"{'Experience At Airport': 'Departure Only', 'Date Visit': 'July 2021', 'Type Of Traveller': 'Solo Leisure', 'Queuing Times': 1, 'Terminal Cleanliness': 4, 'Terminal Seating': 4, 'Terminal Signs': 1, 'Food Beverages': 0, 'Airport Staff': 1, 'Recommended': 'yes'}"
2022-02-23,2,10,"""I turned in a complaint to the airport and was basically told tough luck""",S Bert ,Not Verified |  I fly frequently in and out of Nashville Airport and don't really have ever any problems until today. My kids were in town and I had to take them to the airport for the return flight home. They are Minors so I went in with them to make sure they got on board the plane ok. I parked in the parking garage for less than 2 hours and was charged a full 1 day rate of 26 dollars. That rate kicks in at 45 minutes. I believe that is absurd. I don't have a problem paying to park but don't feel like I should have had to pay the full day rate. Don't get me wrong it isn't that I don't have the funds but it really the principle of it. I usually park off site because the rates are better and the shuttle service is better as well. I feel the full day rate shouldn't kick it until about 3 or 4 hours in the garage. I mean if you parked and took a flight somewhere it would take 3 to 4 hours to get there and back without really getting off a plane. So I turned in a complaint to the airport and was basically told tough luck. So my sentiment is Nashville Airport your customer service sucks. Do better. Not to mention the entire airport is a construction site inside and out.,yes,"{'Experience At Airport': 'Departure Only', 'Date Visit': 'February 2022', 'Type Of Traveller': 'Business', 'Queuing Times': 3, 'Terminal Cleanliness': 3, 'Terminal Seating': 2, 'Terminal Signs': 1, 'Food Beverages': 2, 'Airport Shopping': 2, 'Wifi Connectivity': 1, 'Airport Staff': 1, 'Recommended': 'yes'}"
2021-12-30,3,10,"""Very disappointed and very disrespectful""",Sarah Judy,"Not Verified |  I just dropped my Aunt off at the airport to catch her flight. I was parked for 5 min max with my Caution lights on in the terminal. As soon as I unloaded the car and told her goodbye, I got back in the vehicle and the traffic guy (about 60yr old) is yelling at me to move. I said I’m about to move I’m just starting my GPS, which takes 1 min. He then proceeded to come up to my window and yell and tell me “I don’t care what your doing, you can put your GPS on somewhere else. You need to move.” By this point I could’ve been done and gone if he wasn’t causing an issue over me dropping off my relative and only being there for 5 min. I know his job is important. I know it is important to try and keep traffic going so it doesn’t back up. What I don’t agree with is being rude while doing it. Everyone is there to do the same thing. It isn’t going to make things better, or traffic go any faster, by being rude and inconsiderate of others. Very disappointed and very disrespectful. He needs to be written up for this.",yes,"{'Experience At Airport': 'Departure Only', 'Date Visit': 'December 2021', 'Type Of Traveller': 'Solo Leisure', 'Queuing Times': 1, 'Terminal Cleanliness': 2, 'Terminal Seating': 1, 'Terminal Signs': 1, 'Food Beverages': 0, 'Airport Staff': 1, 'Recommended': 'yes'}"
2021-11-07,2,10,"""Seriously BNA get your act together""",Mylisa Panek,"Not Verified |  I have flown many times out of BNA never that much of a problem until this last flight, I would have driven to my destination had I known what a mess it is, now don't think I want to fly out of Nashville ever again. I was over 2 hrs early and only made it to the gate with 1 hr to wait. What happened to all the quick places to grab some food? Seriously BNA get your act together.",,"{'Experience At Airport': 'Departure Only', 'Date Visit': 'November 2021', 'Type Of Traveller': 'Couple Leisure', 'Queuing Times': 1, 'Terminal Cleanliness': 2, 'Terminal Signs': 2, 'Food Beverages': 1, 'Airport Staff': 1, 'Recommended': 'no'}"
2021-11-03,5,10,"""on track to reinvent our outdated BNA airport""",T M O'Dooley,"Not Verified |  In the heart of the South, on track to reinvent our outdated BNA airport. I have a question. Why is there no where to buy a Mountain Dew, Sun Drop, or Mello Yellow? I mean this is the South correct?",yes,"{'Experience At Airport': 'Arrival and Departure', 'Date Visit': 'November 2021', 'Type Of Traveller': 'Couple Leisure', 'Queuing Times': 4, 'Terminal Cleanliness': 4, 'Terminal Seating': 4, 'Terminal Signs': 4, 'Food Beverages': 2, 'Airport Shopping': 2, 'Airport Staff': 1, 'Recommended': 'yes'}"
2021-08-03,1,10,"""No employees enforced the mask rule""",B Elizabeth ,Not Verified |  A lot of people not wearing masks. No employees enforced the mask rule. The food employees were yelling at each other not wearing masks. The employees are rude. The airport is so dirty. I will never come here again.,,"{'Experience At Airport': 'Departure Only', 'Date Visit': 'August 2021', 'Type Of Traveller': 'Solo Leisure', 'Queuing Times': 1, 'Terminal Cleanliness': 1, 'Terminal Seating': 1, 'Terminal Signs': 3, 'Food Beverages': 0, 'Wifi Connectivity': 1, 'Airport Staff': 1, 'Recommended': 'no'}"
2021-07-13,2,10,"""there were so many people not wearing masks""",Dorothy Craig,Not Verified |  Although there were motivations in place and visible—there were so many people not wearing masks and the airport authority did not seem to care. I brought my own Lysol wipes and glad I did. I tried to sit in a chair but when I wiped it down the cloth showed so much grime and dirt that I ended up standing while I waited to board and I was pretty early. Cleaning crew were standing around talking on their phones while germs are having a field day on every surface of this airport. I live in Nashville and used to fly frequently. However now I’ll be seriously thinking twice about travel!,,"{'Experience At Airport': 'Departure Only', 'Date Visit': 'July 2021', 'Type Of Traveller': 'Couple Leisure', 'Queuing Times': 4, 'Terminal Cleanliness': 1, 'Terminal Seating': 1, 'Terminal Signs': 4, 'Food Beverages': 2, 'Airport Shopping': 1, 'Wifi Connectivity': 1, 'Airport Staff': 1, 'Recommended': 'no'}"
2021-05-06,1,10,"""I thought I was in a 1970’s low budget film""",Dedera Hayes ,"Not Verified |  I thought I was in a 1970’s low budget film. This place has outdated, smelly, nasty carpet, broken seat and 2 1/2 restaurants. I may be stretching it on the 2 1/2 restaurants but what few restaurants they do have are very poor.",,"{'Experience At Airport': 'Departure Only', 'Date Visit': 'May 2021', 'Type Of Traveller': 'Couple Leisure', 'Queuing Times': 1, 'Terminal Cleanliness': 1, 'Terminal Seating': 1, 'Terminal Signs': 1, 'Food Beverages': 1, 'Airport Shopping': 1, 'Wifi Connectivity': 2, 'Airport Staff': 4, 'Recommended': 'no'}"
2021-04-05,1,10,"""Lack of places to eat""",C Tomasso,Not Verified |  Infrastructure is poor. Lack of places to eat. Long lines at the few open food vendors. High priced and low quality food. Ugly terminal. No staff available for directions/questions.,,"{'Experience At Airport': 'Departure Only', 'Date Visit': 'April 2021', 'Type Of Traveller': 'Solo Leisure', 'Queuing Times': 1, 'Terminal Cleanliness': 1, 'Terminal Seating': 3, 'Terminal Signs': 1, 'Food Beverages': 1, 'Airport Shopping': 1, 'Wifi Connectivity': 1, 'Airport Staff': 1, 'Recommended': 'no'}"
2021-02-16,1,10,"""the airport is supposed to be prepared for planes to fly!""",A King,"✅ Trip Verified | We came to Nashville to visit. There was bad weather when we left, so I can understand that these may be special circumstances. That being said, all flights were cancelled little by little. They kept you in the airport for as long as possible. 1 restaurant that sits probably 30 people, 2 stores that were poorly stocked with disgusting sandwiches, 1 small bar. Al this to serve hundreds of people that are waiting to see if their flights will be cancelled or not. Finally, after 24hrs of being moved around from gate to gate and delayed, they got us on a plane. The pilot explained what led to all the delays and why we are still delayed. The Airport has only 1 Defreezer truck. It can de freeze 1-2 planes then has to go refuel, which takes 2 hrs. So, we were waiting for our turn to be defreezed. After about 20 min, the pilot gave us an update saying that the defreezer has a malfunction and the tech is coming to fix it. A little later, we got an update that said: well, I can see that there is only 1 person loading the luggage’s, so this may take a little while before we can even move the plane. In the meantime, we are still waiting on the update for the defreezer. A few minutes later, the pilot says we just found out that the mechanic is on his way and should be there in about 30 min. Damn. I’m not sure what is going on, but the airport is supposed to be prepared for planes to fly!",,"{'Experience At Airport': 'Departure Only', 'Date Visit': 'February 2021', 'Type Of Traveller': 'Family Leisure', 'Queuing Times': 3, 'Terminal Cleanliness': 3, 'Terminal Seating': 3, 'Terminal Signs': 4, 'Food Beverages': 1, 'Airport Shopping': 1, 'Wifi Connectivity': 3, 'Airport Staff': 1, 'Recommended': 'no'}"
2020-11-25,4,10,"""The cell phone parking lot is a disaster""",Sue Falls,Not Verified |  The cell phone parking lot is a disaster. Like a bad game of Tetris. I won’t use it again until it’s redone. Alarmist saw two wrecks. It’s necessary to be able to back in to park or you’re out of luck.,yes,"{'Experience At Airport': 'Transit', 'Date Visit': 'November 2020', 'Type Of Traveller': 'Couple Leisure', 'Queuing Times': 4, 'Terminal Cleanliness': 4, 'Terminal Seating': 5, 'Terminal Signs': 4, 'Food Beverages': 4, 'Airport Shopping': 4, 'Wifi Connectivity': 4, 'Airport Staff': 4, 'Recommended': 'yes'}"
2020-01-30,3,10,"""it has never been a good experience""",Jessie Shae,"Not Verified |  Lived here over 15 years and this is our home airport traveling at least every 3-4 weeks. We’ve been using this airport for years and it has never been a good experience. Security and parking is fine, even with the construction - no problems other than if you have an early flight give yourself time to park if you need the bus. As far as food options... it’s terrible. The Berry Bistro is the only option on the Southwest terminal side to get any sort of coffee that’s to go other than Starbucks. Starbucks takes over 20 minutes because they are the only ones with reliable options. The Berry Bistro two weeks ago was closed because no staff showed up to work in the am. Today (like 3 other times) they’ve had our order wrong, over charged us and then didn’t have the items they said they did. When we asked for a refund they couldn’t because they didn’t have a manager to approve so they had to get change out of their wallets to refund us. All the other food options in the court area have cold food, even in the warmers, the staff can’t speak English. If your going to expand this airport you need to massively step it up with a manager that can oversee these places and hire people that care to be working for the day not texting on their phones at the register. This airport is WAY behind the eight ball, compared to other similar markets around the country ie., Charlotte, Orlando, West Palm, St Louis. Your expansion plan must include better staffing and food options. Not to mention the one clothing store Fly Babies has had the same clothes for 15 years in the same spot. Update?",,"{'Experience At Airport': 'Arrival and Departure', 'Date Visit': 'January 2020', 'Type Of Traveller': 'Business', 'Queuing Times': 4, 'Terminal Cleanliness': 2, 'Terminal Seating': 4, 'Terminal Signs': 4, 'Food Beverages': 1, 'Airport Shopping': 1, 'Wifi Connectivity': 3, 'Airport Staff': 1, 'Recommended': 'no'}"
2019-12-18,7,10,"""Step it up a notch people""",Nathen Jones,"Not Verified |  Construction is taking forever and is very noisy and messy, my kids tripped on some construction material in a normal walkway but I am mainly posting this review because their toilet tissue is absolutely terrible! It’s like using printer paper and it gave me a terrible rash. Thumbs down big time for a simple commodity BNA. Lastly the security personnel could be a touch more humane, they have constantly been rude and demanding to my family over the years and other innocent parties doing nothing wrong at all. Step it up a notch people. Hope you read this for all the unspoken parties out there and get to work where you are falling short.",yes,"{'Experience At Airport': 'Arrival and Departure', 'Date Visit': 'December 2019', 'Type Of Traveller': 'Family Leisure', 'Queuing Times': 3, 'Terminal Cleanliness': 3, 'Terminal Seating': 3, 'Terminal Signs': 3, 'Food Beverages': 4, 'Airport Shopping': 4, 'Wifi Connectivity': 2, 'Airport Staff': 3, 'Recommended': 'yes'}"
2019-08-12,5,10,"""no paper towels are offered""",S Shaw,"✅ Trip Verified | I live in Nashville and fly somewhere around 75 times a year. BNA is currently undergoing some significant expansion and renovations that are necessary to keep up with the demand of Nashville’s incredible population growth. What continues to be overlooked are the restroom facilities. It’s the only airport I’ve traveled to or through where no paper towels are offered, which is a major invitation to spread sickness especially when coupled with the dryers that require poor hand washers to stick their hands fully in the machine and blow around all of the bacteria and germs they didn’t wash off with soap. Additionally, multiple sinks are always out of soap or the soap dispensers are not functioning properly. BNA must have the most germ and bacteria friendly airport for any city with major commercial airlines.",,"{'Experience At Airport': 'Departure Only', 'Date Visit': 'August 2019', 'Type Of Traveller': 'Business', 'Queuing Times': 4, 'Terminal Cleanliness': 1, 'Terminal Seating': 4, 'Terminal Signs': 5, 'Food Beverages': 3, 'Airport Shopping': 3, 'Wifi Connectivity': 3, 'Airport Staff': 3, 'Recommended': 'no'}"
2019-05-13,1,10,"""Employees rude and obnoxious""",April Sessions,"Not Verified |  So....most food vendors were filthy, most closed but no reason why, just rude employees waving you away. Coolers where drinks are grabbed from completely empty and again dirty. Burger King however was open but all counters and floor were dirty and greasy. Employees rude and obnxious. Don't waste your time or your money. I would rather stop somewhere pick up something that cost less and eat it cold than eat at BNA.",,"{'Experience At Airport': 'Departure Only', 'Date Visit': 'May 2019', 'Type Of Traveller': 'Couple Leisure', 'Queuing Times': 3, 'Terminal Cleanliness': 1, 'Terminal Signs': 3, 'Food Beverages': 1, 'Airport Shopping': 3, 'Wifi Connectivity': 1, 'Airport Staff': 3, 'Recommended': 'no'}"
