datePublished,ratingValue,bestRating,header,author,reviewBody,recommended,stats
2019-04-26,10,10,"""happy, calm, and full of personality""",Sarah Miller,"Not Verified |  TSA probably doesn’t get that many good reviews but I wanted to say a huge thank you to all the TSA folks I talked with. You were happy, calm, and full of personality. You made going through security a breeze and for that I thank you for keeping the morning happy. I wish every airport had TSA like Nashville! Well done",yes,"{'Experience At Airport': 'Arrival and Departure', 'Date Visit': 'April 2019', 'Type Of Traveller': 'Couple Leisure', 'Queuing Times': 5, 'Terminal Cleanliness': 5, 'Terminal Seating': 5, 'Terminal Signs': 5, 'Food Beverages': 3, 'Wifi Connectivity': 5, 'Airport Staff': 5, 'Recommended': 'yes'}"
2018-11-10,10,10,"""so thankful for everything""",Kara Jones,Not Verified |  My parents and I were about to board a flight and my dad started feeling sick. He was having a heart attack. Everyone at the airport was so nice and helpful. They got help to him so quick! A lady (I’m not real sure who she was) got our flights changed for us and got our luggage off the plane. A security guard stayed with me the whole time and helped me with everything! They were so wonderful and I’m so thankful for everything they did for us!,yes,"{'Experience At Airport': 'Departure Only', 'Date Visit': 'November 2018', 'Type Of Traveller': 'Family Leisure', 'Queuing Times': 5, 'Terminal Cleanliness': 5, 'Terminal Seating': 5, 'Terminal Signs': 5, 'Airport Staff': 5, 'Recommended': 'yes'}"
2018-06-06,8,10,"""tremendous in doing their job""",James Broadway,"Not Verified |  My 14 year old grand daughter flew unattended by an adult to JAX and the ladies at the check-in in the secure area were tremendous in doing their job. Answered all questions and put us at ease, got her on the plane and in a great seat without having to wrestle with the masses that were waiting to board. A big thank you to Southwest also. Now, parking was another thing, a nightmare with all the construction going on but we made it just fine.",yes,"{'Experience At Airport': 'Departure Only', 'Date Visit': 'June 2018', 'Type Of Traveller': 'Solo Leisure', 'Queuing Times': 5, 'Terminal Cleanliness': 5, 'Terminal Seating': 4, 'Terminal Signs': 5, 'Food Beverages': 4, 'Airport Staff': 5, 'Recommended': 'yes'}"
2017-11-19,7,10,"""the service is super slow""",V Stirling,✅ Trip Verified | Nashville airport is notorious at taking forever to get the bags unloaded to the carousel. We wait an additional 20 minutes just to get a bag. This happens all the time. The staff are nice but the service is super slow.,yes,"{'Experience At Airport': 'Arrival and Departure', 'Date Visit': 'November 2017', 'Type Of Traveller': 'Business', 'Queuing Times': 1, 'Terminal Cleanliness': 3, 'Terminal Seating': 2, 'Terminal Signs': 5, 'Food Beverages': 2, 'Airport Shopping': 1, 'Wifi Connectivity': 2, 'Airport Staff': 5, 'Recommended': 'yes'}"
2017-04-26,5,10,"""not a pleasant experience""",D Kitts,"✅ Verified Review |  We checked into the counter to the friendliest agents we've seen in a long time. The security checkpoint was understaffed and the woman checking us in was unpleasant to say the least. No smile, crabby attitude and just not happy with her job. She asked a co-worker for some help as she had already called for help three times. I was TSA prechecked, but ended up having to take my belt off and go through again. Then my bracelets and go through again. And then once more through and a final pat down. All the agents here were friendly and just doing their job, but next time I think I'll just go through the regular line and it'll probably go smoother. Not a pleasant experience.",,"{'Experience At Airport': 'Departure Only', 'Date Visit': 'April 2017', 'Type Of Traveller': 'Couple Leisure', 'Queuing Times': 3, 'Terminal Cleanliness': 3, 'Terminal Seating': 3, 'Terminal Signs': 4, 'Food Beverages': 4, 'Airport Shopping': 3, 'Wifi Connectivity': 2, 'Airport Staff': 2, 'Recommended': 'no'}"
2017-01-26,8,10,"""Nashville you're doing it right""",Marina DeSanto,"✅ Verified Review |  I've traveled for years - this is the first airport I have ever reviewed. Nashville staff were amazing - the TSA in most airports are the worst part of traveling! Most agents have an entitlement attitude, Nashville Airport TSA was excellent, something I've never experienced in an US airport. The staff were nice, the airport to was clean, and they had live music to ease you. Nashville you're doing it right, everyone seems to be happy - as a traveler I left as content as I arrived.",yes,"{'Experience At Airport': 'Departure Only', 'Date Visit': 'December 2016', 'Type Of Traveller': 'Solo Leisure', 'Queuing Times': 4, 'Terminal Cleanliness': 5, 'Terminal Seating': 5, 'Terminal Signs': 5, 'Food Beverages': 3, 'Airport Shopping': 3, 'Wifi Connectivity': 5, 'Airport Staff': 5, 'Recommended': 'yes'}"
2014-11-12,9,10,Nashville Airport customer review,B Swain,I have been flying from Nashville Int'l since 2009. The airport is clean the staff are friendly and helpful. Security staff are polite and efficient waiting areas are good and food/drink facilities are all right. All in all I have no complaints.,yes,"{'Queuing Times': 4, 'Terminal Cleanliness': 4, 'Airport Shopping': 4, 'Recommended': 'yes'}"
2012-10-22,10,10,Nashville Airport customer review,Colin Pay,Arrived from CLT on US Air left on Delta to ATL. No problems very short queuing at check in and security. Car hire facility could not be closer it is a muti-story garage across from exit doors.,yes,"{'Queuing Times': 5, 'Terminal Cleanliness': 5, 'Airport Shopping': 5, 'Recommended': 'yes'}"
2009-03-21,4,10,Nashville Airport customer review,C Maddox,This airport has made huge improvements over the past few years with shops and dining. My trips have always been trouble free with a short line in security. But unless your flying with Southwest you are probably going to have to change planes.,,{'Recommended': 'no'}
2007-11-19,4,10,Nashville Airport customer review,Chris Mitchell,One of the most convenient airports if you're renting a car. Car return is immediately adjacent to the terminal. You'll be at the ticket counter within 5 minutes walk after dropping off your rental car. Security line a bit long on most recent trip but it was the Friday afternoon before Thanksgiving. Airside is excellent - no long taxi or ground waits due to traffic (unless its a hold due to the destination) at BNA. Just wish there were more nonstop flights to west coast.,,{'Recommended': 'no'}
