datePublished,ratingValue,bestRating,header,author,reviewBody,recommended,stats
2016-05-27,2,10,"""not for those who travel frequently""",George Smith,"This airport is not for those who travel frequently. They do not have enough restaurants and bars and the ones they have only seat a few people. The airport staff and the restaurant staff are incredibly rude as they don't know how to handle a lot of people. I have decided to only fly into and out of Washington because of these issues. For those who haven't seen top notch airports, the lack of quality may not be noticed.",,"{'Experience At Airport': 'Departure Only', 'Date Visit': 'May 2016', 'Type Of Traveller': 'Business', 'Queuing Times': 2, 'Terminal Cleanliness': 3, 'Terminal Seating': 4, 'Terminal Signs': 4, 'Food Beverages': 1, 'Airport Shopping': 1, 'Wifi Connectivity': 3, 'Airport Staff': 1, 'Recommended': 'no'}"
2016-04-20,8,10,"""a good option to fly to/from""",V Mogollon,"Baltimore Washington is a nice airport that looks like it had been renovated recently since the last time I had used this airport a few years ago. I do like this airport because it is clean. When I was parking I had a little bit of trouble finding the long term parking because there is not a lot of signage for the long term parking. The buses to the main terminal are frequent and convenient. When I got to the main terminal I checked in quickly and then got to go through the nightmare that was security. I spent one hour in the security line because there was only one security agent working in the entire security line. The line was not that long, but it moved so slowly. For a Friday afternoon, I was surprised that they did not have more people working security. I almost missed my flight due to the security line. Coming back to Baltimore on Sunday night was longer than I thought. When we landed in Baltimore there were delays at the gate so we waited on the plane about a half hour longer than we had to. When I got to baggage claim, there were a few flights there at the same time, so everyone had to share the same carousel. They quickly realized how crowded it was and then moved some flights to another baggage claim belt, which was nice. There was a little bit of trouble at the credit card kiosk at the long term parking, which was a little frustrating, but long term parking was cheap so I can't complain. Overall, besides security, BWI is a good option to fly to/from.",yes,"{'Experience At Airport': 'Arrival and Departure', 'Date Visit': 'April 2016', 'Type Of Traveller': 'Solo Leisure', 'Queuing Times': 2, 'Terminal Cleanliness': 5, 'Terminal Seating': 5, 'Terminal Signs': 4, 'Food Beverages': 4, 'Airport Shopping': 4, 'Airport Staff': 5, 'Recommended': 'yes'}"
2016-04-14,7,10,"""virtually no queues""",Chris Miller,"It's been a while since I've used BWI, but I'd say they've done a nice job renovating it. There were virtually no queues as my flight departed at 6 am and returned around midnight. Some of the signs were not placed well, like the ones directing you to security and the parking lot bus waiting area. Overall, a nice, efficient airport that I wish was closer to where I live.",yes,"{'Experience At Airport': 'Arrival and Departure', 'Date Visit': 'April 2016', 'Type Of Traveller': 'Solo Leisure', 'Queuing Times': 5, 'Terminal Cleanliness': 4, 'Terminal Seating': 4, 'Terminal Signs': 2, 'Food Beverages': 2, 'Wifi Connectivity': 3, 'Airport Staff': 3, 'Recommended': 'yes'}"
2016-03-12,7,10,"""arrive early""",M Perry,Baltimore Washington is a fine airport. It is by no means the best airport I have seen but I have also seen far worse. The food offerings are nice for tourists to try local Maryland fare and try the crab cakes. I have flown into and out of BWI an uncountable number of times and the only major problem I have ever had was lines at security. They can stretch on for quite sometime so arrive early.,yes,"{'Experience At Airport': 'Arrival and Departure', 'Date Visit': 'February 2016', 'Type Of Traveller': 'Couple Leisure', 'Queuing Times': 1, 'Terminal Cleanliness': 2, 'Terminal Seating': 3, 'Terminal Signs': 4, 'Food Beverages': 4, 'Airport Shopping': 4, 'Recommended': 'yes'}"
2015-11-09,2,10,"""the services are awful""",L VanArsdale,Lots of money spent on this airport but the services are awful / not working. No power at the workstations. Internet has security issues beyond any seen at many other airports.,,"{'Experience At Airport': 'Transit', 'Date Visit': 'November 2015', 'Type Of Traveller': 'Solo Leisure', 'Queuing Times': 3, 'Terminal Cleanliness': 3, 'Terminal Signs': 3, 'Food Beverages': 0, 'Wifi Connectivity': 1, 'Recommended': 'no'}"
2015-04-22,3,10,Baltimore Washington Airport customer review,G Lewis,I fly out of BWI Southwest Airlines once a month to Tampa. It never fails when I return to BWI I have to wait 30 mins to an hour for my bags and it always starts like this. Your bags from Tampa will be on belt #1 and about 10 mins later they announce your bags from Tampa are now on belt #5. If you get lucky you might not get another belt change and in 20 min or so you bags will come out. If you have oversize bags such as golf clubs you can add another 10 min. The young workers in the oversize baggage area just sit on chairs and play with their cell phones never greet you or even recognize that you are there. The bottom line is that that baggage department at BWI is the worst in the country by far.,,"{'Queuing Times': 4, 'Terminal Cleanliness': 4, 'Airport Shopping': 4, 'Recommended': 'no'}"
2014-10-08,1,10,Baltimore Washington Airport customer review,A Kooyman,Are they serious about the rental car situation? This has to be the worse setup in the US. To get from the terminal to the car rental facility the bus takes 4 left turns on busy roads. On the way back you routinely get stuck in traffic - the rental shuttle tells you to allow 2 hours on your return! All of this in a region where cabs are as non-existent - you need a rental car for any appointment outside of downtown Baltimore.,,"{'Queuing Times': 3, 'Terminal Cleanliness': 3, 'Airport Shopping': 3, 'Recommended': 'no'}"
2014-08-26,8,10,Baltimore Washington Airport customer review,R Gonzaga,Great airport fast TSA checks with friendly smiling faces lots of food options and spacious boarding areas. The Southwest staff were friendly and professional from curbside to boarding lounge.,yes,"{'Queuing Times': 4, 'Terminal Cleanliness': 4, 'Airport Shopping': 4, 'Recommended': 'yes'}"
