datePublished,ratingValue,bestRating,header,author,reviewBody,recommended,stats
2024-08-30,2,10,"""my night was so miserable""",C Horten,"✅ Trip Verified |   This is the second time I write about this airport. Last time it was about TSA and this time this passenger passed through quickly without any delay to to my disability. However when the plane touched down after a day of travel this passenger decided to wait at the aiport overnight. Well, after overnighting at the SFO, I thought this would be just an ordinary thing. However my night at Baltimore Washington Airport was so miserable that I must record several warnings. 1) All the eateries and cafes are closed by 11pm 2) The workers are about as friendly and responsible as formerly at greyhound 3) hourly wage mentality prevalent, so whatever is not spelled out in the handbook is okay, including for instance having ground crew workers on break purposely sitting by visitor repeatedly. 4) actually the supervision is so loose that the people going in and out of gate doors to the tarmac/cargo holding area can be wearing any ID. The guy that was eying me at Terminal C had an ID badge but he was taking a lot more breaks than a job allows. 5) all the workers seem to take a lot of breaks and sit around throughout the terminals talking, even socializing like at Terminal A. 6) At terminal C, while I was quietly sitting and napping the red-alarm bell on the ceiling at the gate went off ""by itself' several times. It also did that at the gate across where I was sitting. The alarm went on-and-off ""by itself"" four times at least, and each time, when I was sort of dozing off. I had commented to myself that the music was objectionable, and they ""changed the music to soft jazz."" So evidently the security was looking and listening to me throughout my stay, since obviously very few passengers stay here during the early morning hours. 6) When I walked to Terminal A (where I hoped there would be no alarms) the security speaker announced my last name and terminal location and that security was ""on it."" So apparently even though I am an older disabled person with no record or history of vagrancy or crime, the airport security were ""alert to my whereabouts"" to the point of announcing my last name and location so all the workers could hear. 7) At Terminal A, another ground crew again tried again to sit nearby during his ""break."" When I sort of had enough of this and was muttering to myself, that evidently was shared with some cleaning staff, and two burly janitors (twins) who were heading to clean one of the men bathrooms in Terminal A loudly and repeatedly jeered at me. ""Why does she have to keep moving around that ch*nk as if they was after her?"" that kind of thing. 8) At Terminal B it was quieter because by 4am I found of group of nonwhites who were sitting in a section. However again, another ID-badge worker tried to sit near by while I was napping. 9) Workers were also resting or napping in the food-hall area. As a consequence even though the food-halls and other shops look very attractive, I will not have any desire to eat here. 10) The nice thing about this was that while there were no formal guards questioning anyone, there are apparently enough ""night crew"" who keep going in and out of gate-doors (plus the other hidden cameras and mics) that they don't need them. The strange thing is it was hard to tell who was actually a hired worker and a part-timer with a badge who just sits around and tries to harass visitors. This is obviously why unlike at the SFO or LAX nobody wants to overnight here, period.",,"{'Experience At Airport': 'Arrival Only', 'Date Visit': 'August 2024', 'Type Of Traveller': 'Solo Leisure', 'Queuing Times': 3, 'Terminal Cleanliness': 2, 'Terminal Seating': 2, 'Terminal Signs': 1, 'Food Beverages': 1, 'Airport Shopping': 1, 'Wifi Connectivity': 1, 'Airport Staff': 1, 'Recommended': 'no'}"
2024-06-29,2,10,"""International Terminals are the worst""",Tracy Steedman,"Not Verified |   BWI International Terminals are the worst I have been. As a former resident of Baltimore it's embarrassing. No variety, nothing open in the early am and the worst lounges. It can do way better considering the number of International travelers.",,"{'Experience At Airport': 'Arrival and Departure', 'Date Visit': 'June 2024', 'Type Of Traveller': 'Business', 'Queuing Times': 2, 'Terminal Cleanliness': 3, 'Terminal Seating': 2, 'Terminal Signs': 3, 'Food Beverages': 1, 'Airport Shopping': 2, 'Wifi Connectivity': 3, 'Airport Staff': 2, 'Recommended': 'no'}"
2024-02-12,2,10,"""TSA worker screaming at everyone""",E Colton,"✅ Trip Verified |  TSA worker screaming at everyone. She removed purse, shoes and jacket from the bin where I was told to place them. She threw each item on the belt individually. Never stopped hollering.",,"{'Experience At Airport': 'Departure Only', 'Date Visit': 'February 2024', 'Type Of Traveller': 'Family Leisure', 'Queuing Times': 5, 'Terminal Cleanliness': 4, 'Terminal Seating': 4, 'Terminal Signs': 5, 'Food Beverages': 5, 'Airport Shopping': 5, 'Wifi Connectivity': 5, 'Airport Staff': 1, 'Recommended': 'no'}"
2024-01-03,10,10,"""your kindness is noticed""",M Walker,"Not Verified |  My adult daughter had just returned from her connection in Las Vegas to Baltimore Airport in route to her final home destination in Maryland. My daughter had difficulty locating her car and had gotten on the wrong airport bus. Now normally this is frustrating for anyone, but my daughter is autistic so trying to problem solve while in a heightened emotional state is a big struggle for her. Morgan is higher functioning and prides herself on how independent she is, but after a night of flying across country and running to connection flights, she was feeling defeated and concerned about finding her vehicle as the sun was going down. A bus driver named Chris on bus 407 was her guardian angel. He went out of his way to get her to the correct bus before it got dark when the main office confirmed they were too swamped to assist. He even had to deal with an angry traveler yelling at him for taking the extra time of getting Morgan to the correct bus connection although Morgan said he was very efficient and quickly navigated her to the correct destination. Thank you Chris, your kindness is noticed and the world is a better place because of people like you!",yes,"{'Experience At Airport': 'Transit', 'Date Visit': 'January 2024', 'Type Of Traveller': 'Solo Leisure', 'Terminal Signs': 3, 'Airport Staff': 5, 'Recommended': 'yes'}"
2023-12-29,1,10,"""said that it wasn't as late as I thought""",S Kaylen,"✅ Trip Verified |  After arriving at BWI Airport around 5 PM from Detroit, I had to wait for two hours after touchdown for the handlers to begin bringing out the luggage and my suitcase was not among those that arrived. Upon enquiry at the Lost Luggage room, I was told that the plane was too heavy, so my suitcase (which was not anywhere near being overweight) had been randomly selected to be rerouted (thrown off the plane) to another airport. It would therefore now arrive at 10 PM from Chicago Midway. So I was given two choices: wait at the airport till 10 PM for my bag to arrive, or go home and wait ""two days"" for them to ""Overnight"" the bag to me via FedEX.  Really, how much extra fuel would it take for my normal-weight suitcase to be included in the original flight? I opted for the former option and prepared to settle in for a three-hour vigil at the BWI airport. At 10 PM I was at the conveyor belt that ground staff said I should stand at to wait for my suitcases. They said the plane would be 12 minutes late. And so I waited. Eventually another showed up. She was there to pick up her elderly mother who was on that plane from Chicago. She expressed concern as it was the first time her mother was flying using a walker. I would periodically check with ground crew if I was really standing at the right place. They always replied with the same thing: when the suitcases start arriving from Chicago they would be at belt 3. But it wasn't until well after 11 PM that I saw the belt I should be standing it was now Belt 4. The ground crew had not bothered to tell me about the change, even though I was standing near their desk and in regular conversation with them. The bags started rolling in and by 11:43 PM I was finally able to retrieve my suitcase. When I questioned the ground crew about the delay, they were very defensive and said that it wasn't as late as I thought because it took a long time for the plane to reach a gate, and they count the delay from the moment it does so. So there you are. This was my unplanned adventure on December 27. I hope your experience with Southwest Airlines and the BWI Airport is better than mine has been of late.",,"{'Experience At Airport': 'Arrival Only', 'Date Visit': 'December 2023', 'Type Of Traveller': 'Solo Leisure', 'Queuing Times': 3, 'Terminal Cleanliness': 3, 'Terminal Seating': 1, 'Terminal Signs': 3, 'Food Beverages': 1, 'Airport Shopping': 1, 'Wifi Connectivity': 2, 'Airport Staff': 1, 'Recommended': 'no'}"
2023-08-04,3,10,"""requested wheelchairs but no attendants""",Toni Clark,Not Verified | We had requested wheelchairs but there were no attendants to push them so we loaded our bags onto them and pushed them from Terminal A to Terminal D to board our flight to West Palm Beach.,,"{'Experience At Airport': 'Arrival and Departure', 'Date Visit': 'July 2023', 'Type Of Traveller': 'Couple Leisure', 'Queuing Times': 4, 'Terminal Cleanliness': 4, 'Terminal Signs': 4, 'Food Beverages': 0, 'Airport Staff': 4, 'Recommended': 'no'}"
2023-07-03,1,10,"""Terrible customer service""",C Kovacs,"Not Verified |  Overall employees from the shuttle bus driver to the ticket desk to TSA have a rude and unfriendly attitude. All employees seem to have a hourly based personality, only do was is absolutely necessary, nothing more. Most employees focus is talking to other employees and seemed bothered to have to do anything at all. Terrible customer service and willingness to help.",,"{'Experience At Airport': 'Departure Only', 'Date Visit': 'July 2023', 'Type Of Traveller': 'Family Leisure', 'Queuing Times': 1, 'Terminal Cleanliness': 1, 'Terminal Signs': 1, 'Food Beverages': 0, 'Recommended': 'no'}"
2023-05-11,1,10,"""worst service with respect to baggage""",Jennifer Carter,Not Verified |  BWI consistently has the absolute worst service with respect to baggage. We have waited up to a full hour for bags to be delivered to the baggage area. Larger and busier airports do a much better job. This department should be ashamed of their job performance.,,"{'Experience At Airport': 'Arrival Only', 'Date Visit': 'May 2023', 'Type Of Traveller': 'Family Leisure', 'Queuing Times': 4, 'Terminal Cleanliness': 3, 'Terminal Seating': 3, 'Terminal Signs': 4, 'Food Beverages': 3, 'Airport Shopping': 3, 'Wifi Connectivity': 3, 'Airport Staff': 3, 'Recommended': 'no'}"
2023-05-10,2,10,"""The TSA here is so rude""",Chad Leschefsky,"✅ Trip Verified |  The TSA here is so rude it’s funny. They treat you like cattle, yelling, belittling, and anger is a great way to describe these winners. I would avoid this airport at all costs if possible.",,"{'Experience At Airport': 'Departure Only', 'Date Visit': 'May 2023', 'Type Of Traveller': 'Business', 'Queuing Times': 1, 'Terminal Cleanliness': 1, 'Terminal Seating': 1, 'Terminal Signs': 3, 'Food Beverages': 3, 'Airport Shopping': 3, 'Wifi Connectivity': 1, 'Airport Staff': 1, 'Recommended': 'no'}"
2023-01-21,2,10,"""staff at security were very rude""",Z Crawford,"Not Verified |  The staff at security were very rude. I passed the security guy my passport then he mumbled something I didn’t hear. He then shouted at me to put my phone on the scanner to scan my ticket. Then I was about to walk through the security gate and one security worker was shouting in an irritated tone “push your bags through the scanner!” And as I was doing that she proceeded to shout it two more times. I heard her the first time. After that she said to her coworker “I don’t know how many times I have to say it” and her coworker said “yeah must’ve been about 4 times. I’ve stopped because nobody listens” They’re so disrespectful! Security is already overwhelming enough, especially for people with autism, anxiety etc. the first guy literally mumbled then yelled at me when I didn’t hear him. What if I had a hearing problem? The security workers need to have more respect and patience for others. The staff at Starbucks and auntie Anne’s however I didn’t have an issue with and for the most part were polite.",,"{'Experience At Airport': 'Departure Only', 'Date Visit': 'January 2023', 'Type Of Traveller': 'Couple Leisure', 'Queuing Times': 4, 'Terminal Cleanliness': 4, 'Terminal Seating': 3, 'Terminal Signs': 4, 'Food Beverages': 4, 'Airport Shopping': 3, 'Airport Staff': 1, 'Recommended': 'no'}"
2022-08-25,2,10,"""I will avoid this airport at all costs""",B Carol,"Not Verified |  I will avoid this airport at all costs in the future. TSA Agents were rude and condescending. Bathrooms were filthy. Restaurants were understaffed. There was no help at the gate for passengers who required assistance in boarding, so the Southwest gate agent had to bring each wheelchair passenger (10 of them) to the plane himself. Do yourself a favor and stay away.",,"{'Experience At Airport': 'Arrival and Departure', 'Date Visit': 'August 2022', 'Type Of Traveller': 'Couple Leisure', 'Queuing Times': 3, 'Terminal Cleanliness': 1, 'Terminal Seating': 2, 'Terminal Signs': 4, 'Food Beverages': 1, 'Airport Shopping': 1, 'Wifi Connectivity': 4, 'Airport Staff': 1, 'Recommended': 'no'}"
2022-08-07,1,10,"""Poor planning and poor logistics""",Jeremy Howard,"✅ Trip Verified | Spent 20 minutes sitting on the tarmac waiting for a gate to open. Then spent an additional 25 minutes sitting on the plane at the gate waiting for a skyway driver to attach to the plane. In that time the luggage was not unloaded from the plane, so another 20 minutes was wasted waiting for luggage to arrive at the baggage claim. After luggage was attained, I watched two ""long term"" busses pull away from the shuttle station at the same time. I then waited 35 minutes for one to come back to the pickup, by which time, I had created an account here and written this entire review and the shuttle still is not here. It arrived 38 minutes after leaving and both shuttles arrived at the same time. Poor planning and poor logistics by every department at the airport.",,"{'Experience At Airport': 'Arrival Only', 'Date Visit': 'August 2022', 'Type Of Traveller': 'Couple Leisure', 'Queuing Times': 1, 'Terminal Cleanliness': 2, 'Terminal Signs': 4, 'Food Beverages': 0, 'Airport Staff': 1, 'Recommended': 'no'}"
2022-05-25,1,10,"""I will always try to avoid Baltimore from now on""",J Donaldson,"✅ Trip Verified | This was the worst airport experience I have ever experienced! The wheelchair attendant pushed me to the Immigration line and left us, and never came back. My daughter had to push me and our carry-ons through customs. They never told us we had to get our luggage and take them with us to our connecting flight. So we had to wait for an attendant to bring our bags, this almost made us miss our flight. My daughter found a large raggedy cart that she placed our two large heavy suitcases on, then I pushed the cart while she pushed me. Then we walked not knowing where to go or how to check our bags because there was no workers around and this airport is very big. We did come across two police security officers who were of no help, we asked them to radio the airplane so that they would know we were on our way. They said no, they had no control over that and they were not affiliated with the airline. So we continued to struggle along and a man helped my daughter check our bags. Then finally we reached the plane and they were unaware we were even suppose to be there. I will always try to avoid Baltimore from now on.",,"{'Experience At Airport': 'Transit', 'Date Visit': 'May 2022', 'Type Of Traveller': 'Family Leisure', 'Queuing Times': 1, 'Terminal Cleanliness': 4, 'Terminal Signs': 1, 'Food Beverages': 0, 'Wifi Connectivity': 1, 'Airport Staff': 1, 'Recommended': 'no'}"
2022-03-07,2,10,"""this is the worst by far when it comes to customer service""",Kelly Rose,"✅ Trip Verified | Airline staff, TSA, and food workers all seem miserable. No one greets, everyone seems put out by having to actually work. I’ve been to a lot of airports lately and this is the worst by far when it comes to customer service.",,"{'Experience At Airport': 'Departure Only', 'Date Visit': 'March 2022', 'Type Of Traveller': 'Family Leisure', 'Queuing Times': 3, 'Terminal Cleanliness': 5, 'Terminal Seating': 4, 'Terminal Signs': 5, 'Food Beverages': 3, 'Airport Staff': 1, 'Recommended': 'no'}"
2022-02-24,3,10,"""security staff still treated us rudely""",Renee Mack,"Not Verified |  I was traveling with my mother, who is low vision and we were treated very rudely by an airport security personnel. After realizing that my mother was low vision, security staff still treated us rudely, trying to quickly usher us through their security system without much regard to her disability.",yes,"{'Experience At Airport': 'Departure Only', 'Date Visit': 'February 2022', 'Type Of Traveller': 'Family Leisure', 'Queuing Times': 4, 'Terminal Cleanliness': 4, 'Terminal Seating': 4, 'Terminal Signs': 4, 'Food Beverages': 4, 'Airport Shopping': 4, 'Wifi Connectivity': 4, 'Airport Staff': 2, 'Recommended': 'yes'}"
2021-12-01,10,10,"""personnel was friendly and very helpful""",D Nelson,✅ Trip Verified | Parking-each spot marked with assigned numbers. Each elevator marked. Kiosk was convenient to get tag for luggage. Personnel at the desk was very polite and helpful. We then proceeded to security and a couple of employees on the way were helpful and responsive to direct us. I wasn’t a passenger but was allowed to take my mom on wheelchair straight to the gate (my documents were checked and security point passed). Security check line was long but organized. People in wheelchairs didn’t have to be in line. Officers were focused and informed us on each step in the process. Airport building is spacious and constantly being cleaned. We noticed people cleaning bathrooms and hall handles. At the gate personnel was friendly and very helpful! Order was maintained throughout our departure. Five stars!,yes,"{'Experience At Airport': 'Departure Only', 'Date Visit': 'December 2021', 'Type Of Traveller': 'Solo Leisure', 'Queuing Times': 5, 'Terminal Cleanliness': 5, 'Terminal Seating': 5, 'Terminal Signs': 5, 'Food Beverages': 5, 'Airport Shopping': 5, 'Wifi Connectivity': 3, 'Airport Staff': 5, 'Recommended': 'yes'}"
2021-10-24,3,10,"""I cannot believe the level of inefficiency""",W Paul,"✅ Trip Verified | The rental car system here adds 30-45 min each time you go to the airport. I cannot believe the level of inefficiency displayed in this process. What clown decided to have the rental car lot 5 miles away? I will never, and I repeat, never, come back to this airport again. And I will be telling everybody I know.",,"{'Experience At Airport': 'Arrival and Departure', 'Date Visit': 'October 2021', 'Type Of Traveller': 'Business', 'Queuing Times': 2, 'Terminal Cleanliness': 3, 'Terminal Seating': 2, 'Terminal Signs': 2, 'Food Beverages': 2, 'Wifi Connectivity': 3, 'Airport Staff': 3, 'Recommended': 'no'}"
2021-10-05,2,10,"""customer service is horrible""",Terra Walter,Not Verified |  The customer service reps at gates A8 and A11 were very rude at Baltimore airport. Our flight in Manchester was delayed and our flight on to Nashville was delayed. I went up to both of them to ask questions because the flight number on our boarding passes were different. I only wanted to know if the flight number had changed because the flight number on our boarding passes on the screen said already departed. Our plane from Manchester arrived after the departure time. He kept arguing saying we missed our flight. No we did not miss our flight if it was delayed. He was a very rude and hateful man whom does not need to be dealing with the public. No reason for the hatefulness and rudeness. Very bad for business. Airport is very nice and well maintained but customer service is horrible. The lady at gate A8 would not even help us at all. She said I can’t help you and don’t know what to tell you. That’s terrible customer service. I usually fly into here but more than likely will not again. Very disappointed!,,"{'Experience At Airport': 'Arrival and Departure', 'Date Visit': 'October 2021', 'Type Of Traveller': 'Family Leisure', 'Queuing Times': 1, 'Terminal Cleanliness': 3, 'Terminal Seating': 3, 'Terminal Signs': 4, 'Food Beverages': 4, 'Airport Shopping': 3, 'Wifi Connectivity': 2, 'Airport Staff': 1, 'Recommended': 'no'}"
2021-09-07,1,10,"""A bad experience and I will not be going back""",John Smith,Not Verified |  Terrible airport. Made me go through TSA lines twice and charged me an extra $30 to check a bag all because they did not like the fact that I had a souvenir inside of my bag. A bad experience and I will not be going back.,,"{'Experience At Airport': 'Departure Only', 'Date Visit': 'September 2021', 'Type Of Traveller': 'Family Leisure', 'Queuing Times': 1, 'Terminal Cleanliness': 1, 'Terminal Seating': 1, 'Terminal Signs': 1, 'Food Beverages': 1, 'Airport Shopping': 1, 'Wifi Connectivity': 1, 'Airport Staff': 1, 'Recommended': 'no'}"
2021-07-29,7,10,"""I am thoroughly unhappy with the service at this airport""",Theresa Knox ,"Not Verified |  I am thoroughly unhappy with the service at this airport. The removal of skycaps was a terrible disservice to your customers, especially those who are in need of assistance. My 93-year-old mother was brought a wheelchair to the ramp and told, ""Oh, I can't push her to baggage. Someone else will have to help you."" I had recently had a left hip surgery and had to push my mother in order to get down to the baggage area. How can an airport with this much traffic, not set up a contract to help with their customers in need of wheelchair assistance? Please consider hiring a group through a contract that can help with this service. Our senior population is neglected in so many ways and the airport should not be one of those places. I wish that you would consider addressing my concerns. Thank you.",yes,"{'Experience At Airport': 'Arrival and Departure', 'Date Visit': 'July 2021', 'Type Of Traveller': 'Family Leisure', 'Queuing Times': 3, 'Terminal Cleanliness': 3, 'Terminal Seating': 4, 'Terminal Signs': 3, 'Food Beverages': 4, 'Wifi Connectivity': 4, 'Airport Staff': 4, 'Recommended': 'yes'}"
2021-07-25,2,10,"""avoid this airport for future travel""",Debra Rhinehardt,"Not Verified |  Having been to many airports, I found BWI to be the worst customer friendly ever! Total chaos, and not very helpful staff (rude), when asking questions. TSA/Security were the worst, barking orders and talk to customers with total disrespect. I have never encountered such rudeness. We will surely avoid this airport for future travel.",,"{'Experience At Airport': 'Departure Only', 'Date Visit': 'July 2021', 'Type Of Traveller': 'Family Leisure', 'Queuing Times': 2, 'Terminal Cleanliness': 3, 'Terminal Seating': 2, 'Terminal Signs': 1, 'Food Beverages': 3, 'Airport Staff': 1, 'Recommended': 'no'}"
2021-04-14,1,10,"""has the absolute worst TSA system""",B James,"✅ Trip Verified | Baltimore/Washington International Airport (Concourses D) has the absolute worst TSA system. There was not a designated Pre-TSA line and when I was asked to remove my shoes I told them I was Pre-TSA. The guy said ok, but a lady with a very nasty attitude told him no she needs to show her boarding pass but by this time my purse and phone with the boarding pass had already gone though the machine and they wouldn’t pass it back. Now keep in mind that I paid $85 not to remove my shoes and I wasn’t prepared so I was wearing shoes where I didn’t have on socks. But that’s not the point. The point is their system should be set up correctly for Pre-TSA customers. Then to make matters worse my purse had been pulled for extra checking and when they didn’t find me because I was being held up because of the shoes situation they made me wait while they checked others when I finally made it though the line and held me there for more than 5 minutes. Then found absolutely nothing in my purse. When he couldn’t find anything he took everything out to say that I was good. So back to my point. Baltimore/Washington International Airport (Concourses D) has the absolute worst TSA in my travels and I travel all over and a lot.",,"{'Experience At Airport': 'Departure Only', 'Date Visit': 'April 2021', 'Type Of Traveller': 'Business', 'Queuing Times': 1, 'Terminal Cleanliness': 1, 'Terminal Signs': 5, 'Food Beverages': 0, 'Recommended': 'no'}"
2021-03-28,3,10,"""Very unpleasant experience""",Sam Halk,"Not Verified |  One of the most annoying airports for two reasons. First the rudest and angriest airport workers I have ever seen. Second the rent a car experience is horrible, nothing telling you when you arrive that you need to takes shuttle bus to a special facility that is quite a distance away. Asking people working there where to go is not pleasant. Took a while to find one to tell me. Very unpleasant experience.",,"{'Experience At Airport': 'Arrival Only', 'Date Visit': 'March 2021', 'Type Of Traveller': 'Family Leisure', 'Queuing Times': 3, 'Terminal Cleanliness': 3, 'Terminal Signs': 3, 'Food Beverages': 0, 'Airport Staff': 1, 'Recommended': 'no'}"
