datePublished,ratingValue,bestRating,header,author,reviewBody,recommended,stats
2019-08-03,1,10,"""they were confrontational and hostile""",P Milne,"✅ Trip Verified | First time travelling through La Guardia, my wife is 17 weeks pregnant and both of us are serving military. Only scanners were being used at security screening, my wife and I were concerned with harm to our baby, so she tried to opt-out of the scanner to do a pat-down instead. Security staff were immediately demeaning towards her, pushed her to the side of the scanner without offering direction. I had to stand on the other side of security watching helplessly while my pregnant wife was forced to stand in the open, without shoes, for almost 10 minutes until I questioned staff on my side. Employees never gave a clear explanation, and the employee she had initially spoken to just walked off without communicating the opt-out to her co-workers. Any time I questioned staff, they were confrontational and hostile towards me. When my wife finally got a pat down the employee verbally demeaned her, chastised her for not following directions, even though directions were not given. TSA guidelines clearly state that an opt-out of scanners is not meant to punish people, but my pregnant wife was embarrassed and felt like she was being punished. Shame on the security staff for being so ignorant and unprofessional. We will never ever visit this airport again if we can help it.",,"{'Experience At Airport': 'Departure Only', 'Date Visit': 'August 2019', 'Type Of Traveller': 'Couple Leisure', 'Queuing Times': 1, 'Terminal Cleanliness': 4, 'Terminal Seating': 3, 'Terminal Signs': 4, 'Food Beverages': 3, 'Airport Shopping': 3, 'Wifi Connectivity': 1, 'Airport Staff': 1, 'Recommended': 'no'}"
2019-07-31,1,10,"""still continues to be the worst airport""",G Alex,❎ Not Verified | La Guardia still can’t get one simple thing right. One has to wait 30mins to go from Term B to C or D. The most minimal amount of common sense would be to allow people to walk from C to B but instead you have to wait 30-40mins which means a missed flight for sure. Ridiculous and is why still continues to be the worst airport - 3rd world airport is an understatement.,,"{'Experience At Airport': 'Arrival Only', 'Date Visit': 'July 2019', 'Type Of Traveller': 'Business', 'Queuing Times': 1, 'Terminal Cleanliness': 1, 'Terminal Seating': 1, 'Terminal Signs': 2, 'Food Beverages': 1, 'Airport Shopping': 1, 'Wifi Connectivity': 2, 'Airport Staff': 1, 'Recommended': 'no'}"
2019-06-11,2,10,"""departure is a mess""",E Mark,"Not Verified |  Arrival was uneventful, but departure is a mess. Going through security, the clear company was putting 10 and 12 people at a time at the front of the line, the TSA agent had to take his word for who was clear, they had two lines going to the same bin line instead of opening up another one. No one knew if they were supposed to go through metal detector for the scanner so they were getting mad at those in the wrong line, after getting through people were grabbing the wrong bins with the security guard standing there watching and not helping another passenger who had her laptop taken. Really miss managed. Then you pay $17 at bar brace for a sandwich that is the nastiest thing you ever will eat. I'll try Newark next time.",,"{'Experience At Airport': 'Arrival and Departure', 'Date Visit': 'June 2019', 'Type Of Traveller': 'Family Leisure', 'Queuing Times': 1, 'Terminal Cleanliness': 3, 'Terminal Seating': 3, 'Terminal Signs': 3, 'Food Beverages': 1, 'Airport Staff': 1, 'Recommended': 'no'}"
2019-06-06,1,10,"""inconvenience and mismanagement""",G George,"✅ Trip Verified | My experience at La Guardia was beyond the most horrific I have ever experienced in an impoverished third world country. I have been through airport construction projects in numerous airports and none remotely approached the inconvenience and mismanagement at La Guardia. None, nowhere. Communication was nonexistent or worse, incomprehensible. I will select a few examples from this nightmare just to illustrate. We landed hours late because of weather (to be fair, no fault of the airport). It was almost midnight. We followed the taxi signs, followed the taxi signs, followed the taxi signs until, finally, at the end of the terminal, far from the usual curbside, we at last found the taxi stand. Or so we thought. The long line waiting for taxi was actually not waiting for taxis at all, but for the bus, to take us to the taxis. Taxis were not allowed at the terminal. So we waited in torrential rain for the bus, which eventually took us to another place where we waited in the rain for a taxi. For our return, I had rented a car and had to drop it off. Unlike any other airport, there were no signs directing you to the rental car return. Fortunately or so I thought I knew my way around. I headed through a maze of construction to the place car dropoffs had been for decades . All but 2 had to move because of the construction. There were no signs or any communications informing you where to go. I asked a police officer, who kindly sent me in the wrong direction. GPS didn’t work. Finally, we found the virtually unmarked dropoff. I asked why there were no signs anywhere directing people to the new dropoffs. He responded, incredibly, that “we are not allowed to have signs off the airport”. We waited for the shuttle bus only to find out that the shuttle bus had to take us to another shuttle bus. During construction, car rental companies, who could not have signs off the airport, were not allowed to have shuttles on the airport. I know construction creates inconvenience, but the experience was a horrific nightmare not an inconvenience and I place full 100% blame on management, customer disregard, and complete incompetence in planning. As the saying goes, only in NY. “",,"{'Experience At Airport': 'Arrival and Departure', 'Date Visit': 'June 2019', 'Type Of Traveller': 'Couple Leisure', 'Queuing Times': 1, 'Terminal Cleanliness': 1, 'Terminal Signs': 1, 'Food Beverages': 0, 'Recommended': 'no'}"
2019-04-28,1,10,""" a third world airport""",K Knott,"✅ Trip Verified |  You’ll spend 45mins to an hour trying to get to departures or arrivals or waiting for a pickup. They do not care at all that they have screwed the traffic situation beyond comprehension! Who plans an $8B renovation and doesn’t plan for traffic? I’m born and raised in NY and I’ve watched this airport go from horrible to absolutely insufferable! Do yourself a huge favor go to JFK and stay as far away from the hellhole that LGA has become. There’s no food or coffee or even clean bathrooms in the airport, And you’ll spend an hour from when you exit the expressway at the airport trying to go a half mile to the terminal or if arriving wait an hour for your ride to travel a half mile to get you. Avoid at all costs. Thanks LGA for reminding me why I never fly here. Its a third world airport.",,"{'Experience At Airport': 'Arrival Only', 'Date Visit': 'April 2019', 'Type Of Traveller': 'Solo Leisure', 'Queuing Times': 1, 'Terminal Cleanliness': 1, 'Terminal Seating': 1, 'Terminal Signs': 1, 'Food Beverages': 1, 'Airport Shopping': 1, 'Wifi Connectivity': 1, 'Airport Staff': 1, 'Recommended': 'no'}"
2019-04-24,4,10,"""nowhere to purchase hot coffee""",Brett Inlander,Not Verified |  I was picking up my daughter and there was nowhere to purchase hot coffee in the baggage claim or check in area. This is unacceptable in today’s world where there is a Dunkin Donuts every mile. They should add a coffee stand immediately.,,"{'Experience At Airport': 'Arrival Only', 'Date Visit': 'April 2019', 'Type Of Traveller': 'Solo Leisure', 'Queuing Times': 4, 'Terminal Cleanliness': 3, 'Terminal Seating': 1, 'Terminal Signs': 2, 'Food Beverages': 1, 'Airport Shopping': 3, 'Wifi Connectivity': 4, 'Airport Staff': 3, 'Recommended': 'no'}"
2019-03-10,10,10,"""a few kind New Yorkers""",Fern Rodriguez,"✅ Trip Verified |  I’m a blur right now, exhausted, but happy as I sit at LGA waiting to fly home to Florida. It takes chaos to help us recognize peace. I lost my phone after I got to the airport this morning, in the security or it fell out of my coat. Rushing up to the security, a few kind New Yorkers working at security helped me ping my iPhone with my Apple Watch, called it, helped me look on the ‘find my phone’ app and even ran my bags through the closed line to see if they could see it on X-ray just to be sure. Just about then the tears starting coming, thinking I couldn’t board my plane and get home. Home sounded pretty darn good about now. All of a sudden the New York hero swoops in holding an I-phone, that suspiciously looks like mine, and proclaims “someone found an I-phone”. I took the phone, uttered a million thank yous. That didn’t seem quite enough and I hugged Mr Hero. Still overcome with gratitude, I threw my hands up in the air and shouted “ I love New Yorkers”. The security guard confirmed it “New Yorkers are really nice people”. With that, I walked away with my happy ending thanks to the heart of New York... it’s people.",yes,"{'Experience At Airport': 'Departure Only', 'Date Visit': 'March 2019', 'Type Of Traveller': 'Family Leisure', 'Queuing Times': 5, 'Terminal Cleanliness': 5, 'Terminal Seating': 5, 'Terminal Signs': 5, 'Food Beverages': 3, 'Airport Shopping': 5, 'Wifi Connectivity': 5, 'Airport Staff': 5, 'Recommended': 'yes'}"
2019-02-24,1,10,"""This place is a nightmare""",F Baker,"Not Verified |  Please, please, please, when you upgrade this airport, be sure to eliminate all off the euro Cibo garbage and bring back normal restaurants and shops that everyone much prefers. Also, we all have smartphones in our hands so please also get rid of all the little used iPads cluttering up every single surface of the terminal. This place is a nightmare.",,"{'Experience At Airport': 'Arrival and Departure', 'Date Visit': 'February 2019', 'Type Of Traveller': 'Business', 'Queuing Times': 4, 'Terminal Cleanliness': 4, 'Terminal Seating': 1, 'Terminal Signs': 3, 'Food Beverages': 1, 'Airport Shopping': 2, 'Airport Staff': 3, 'Recommended': 'no'}"
2019-01-23,1,10,"""Do yourselves a favor and avoid""",M Donlon,"Not Verified | Do yourselves a favor and avoid having to fly through LaGuardia at almost any cost. First off, I have been to much better run airport in most 3rd world countries. They have made somewhat of an attempt to ""modernize"" some terminals, but it still requires catching a shuttle from one terminal to the other, where the transfer station signage is almost as bad as the attitude and organization of the staff who are responsible for running and coordinating the shuttles. I literally missed a connection because of the inefficiency of having to go from one terminal, to the other, and I had 45min to do so. Also gates are often switched at the last minute due to staffing and scheduling issues which forces you onto the archaic shuttle system between terminals. Oh, and also while I was here, a water pipe burst at the entrance to one terminal, which facilitated the need to again bus everyone on said shuttle system to another terminal, just so they can exit the airport.",,"{'Experience At Airport': 'Arrival and Departure', 'Date Visit': 'January 2019', 'Type Of Traveller': 'Business', 'Queuing Times': 1, 'Terminal Cleanliness': 2, 'Terminal Seating': 2, 'Terminal Signs': 1, 'Food Beverages': 1, 'Airport Shopping': 1, 'Wifi Connectivity': 4, 'Airport Staff': 1, 'Recommended': 'no'}"
2018-12-08,1,10,"""incompetence and customer disregard""",M Anderson,"✅ Trip Verified | It took 45 min from the time I entered my uber ride in the designated passenger pickup area in the parking garage to the time the car left the garage on to the streets. Even with the effects of construction, this experience/agony (and it is not the first time) is a result of incompetence and customer disregard by whoever designed this traffic organization. The traffic wardens inside the garage appear lost, disoriented and overwhelmed. I can only wish NYC mayor and the CEO of Port Authority were with me in the car to see with their own eyes what mess their incompetent lazy underlings have created with the traffic situation at the terminal as well as with car pickup protocol.",,"{'Experience At Airport': 'Arrival Only', 'Date Visit': 'December 2018', 'Type Of Traveller': 'Business', 'Queuing Times': 1, 'Terminal Cleanliness': 3, 'Terminal Signs': 2, 'Food Beverages': 0, 'Airport Staff': 3, 'Recommended': 'no'}"
2018-12-04,1,10,"""excruciatingly hot""",Cheryl Lynn Edwards,✅ Trip Verified | I am sitting in Terminal B at Gate D6 as I write this review. It is excruciatingly hot. I mean everyone is complaining and the American Airline gate employee says nothing to be done just deal with it it the entire terminal. I love AA and write great reviews and letters about its staff all the time but this AA employee needs more training or termination. And if LaGuardia doesn’t realize that people are getting sick because of this heat then they need new facilities employees. I wish I could add a picture of the airline employees in tank tops. This is crazy. People are also sitting in the floor and standing also because of too few seats. LaGuardia please get it together.,,"{'Experience At Airport': 'Departure Only', 'Date Visit': 'December 2018', 'Type Of Traveller': 'Couple Leisure', 'Queuing Times': 1, 'Terminal Cleanliness': 1, 'Terminal Seating': 1, 'Terminal Signs': 4, 'Food Beverages': 3, 'Airport Shopping': 3, 'Airport Staff': 3, 'Recommended': 'no'}"
2018-11-27,1,10,"""Should be shut down""",T Acura,"Not Verified |  
Just a lost cause. Should be shut down. Can’t handle any part of travel experience. This is a place beyond redemption or repair. Can’t handle incoming flights never gates like they didnt know we where coming. Departures always delayed with no information. Place is filthy and other services are the worst. Time to make this a hotel or housing development or Parking lot. Wait it is a parking lot.",,"{'Experience At Airport': 'Arrival Only', 'Date Visit': 'November 2018', 'Type Of Traveller': 'Business', 'Queuing Times': 1, 'Terminal Cleanliness': 1, 'Terminal Seating': 1, 'Terminal Signs': 1, 'Food Beverages': 1, 'Airport Shopping': 1, 'Wifi Connectivity': 1, 'Airport Staff': 1, 'Recommended': 'no'}"
2018-11-13,1,10,"""Whatever happened to communication""",Steve Parkinson,"✅ Trip Verified | Whoever thought the iPads to order at the terminal was a good idea. For a start they were not charged. Had to wait to get served and the service was appalling. Whatever happened to communication “Have a nice day”, “can l help you sir”? It is so impersonal and takes longer to work out than it would to actually serve a person. If l ever see the iPads on a bench I will walk, no, run to where I can actually get served get a receipt and tip someone.",,"{'Experience At Airport': 'Transit', 'Date Visit': 'November 2018', 'Type Of Traveller': 'Business', 'Queuing Times': 2, 'Terminal Cleanliness': 2, 'Terminal Seating': 2, 'Terminal Signs': 3, 'Food Beverages': 1, 'Airport Shopping': 1, 'Wifi Connectivity': 1, 'Airport Staff': 1, 'Recommended': 'no'}"
2018-11-12,8,10,"""A great convenience""",R Sanyal,"✅ Trip Verified | The terminals at La Guardia are undergoing a massive makeover - hence the immediate approaches look daunting; it is also outdated in terms of decor and available services. However, this airport, given that it serves the needs of New Yorkers travelling to points east of the Mississippi, and Canada, is extremely convenient. A short taxi ride brings you to the airport. The distance from the entrance to the gates is very, very short. Thus, you save a lot of time. From being dropped off at the entrance gate of the terminal to the TSA check area, it is less than a one minute walk - if you have your boarding pass with you. The gates are immediately thereafter. I am sure once the new terminals are constructed, the walks will be long and I will have to trudge long distances to my gate. I used Terminal B for a United flight from Gate C9. C9 is at the end of the terminal pier. So this is a very convenient, straight forward, quick terminal to use. In less than 5 minutes, including TSA inspection I was at my gate! I did not check any bags. Ample seating and quite a few electric connections to charge your phones all around. At this end, with the large glass windows, not only is the waiting areas bright, thanks to natural light streaming in, you can see flights landing and taking off. I was given TSA pre-check and going through the security inspection was a quick walk in the park. I did not have to pull out my laptop or liquids or even shed my coat or remove my footwear; I had put the phone in my bag. Food stalls after TSA are few but basic snacks and sandwiches are available. A little bit of research before coming to the airport can help travelers prepare for the services available and thus manage expectations. While the airport currently handles more traffic and passengers than it was built for, this is the airport where you can be at your gate from arriving at the terminal in just a few short minutes. A great convenience to busy, on the go New Yorkers!",yes,"{'Experience At Airport': 'Departure Only', 'Date Visit': 'November 2018', 'Type Of Traveller': 'Business', 'Queuing Times': 5, 'Terminal Cleanliness': 4, 'Terminal Seating': 4, 'Terminal Signs': 5, 'Food Beverages': 2, 'Airport Shopping': 1, 'Airport Staff': 3, 'Recommended': 'yes'}"
2018-11-08,1,10,"""airport is extremely mismanaged""
",O Jackson,"✅ Trip Verified | La Guardia is the worst airport I have ever flown into and out of. The airport is extremely mismanaged and lacks quality customer experience. We witnessed an elderly woman who was being assisted by one airport associate drop her 3 bags at the bottom of the escalator and told that she needed to go upstairs but lacked the ability to get all of her bags up the escalator herself. She then had to flag down a police officer to ask another associate to assist her who then loaded her bags and brought them up on the elevator for her as the first associate should have done. The signs throughout the airport contradict each other offering opposite directions for where the public transportation and the uber/Lyft pick up is located. Multiple water fountains aren’t even functioning, among other things. The traffic flow is confusing and disorganized causing massive arrival and departure delays. Truly an overall disappointing and poor experience.",,"{'Experience At Airport': 'Arrival and Departure', 'Date Visit': 'November 2018', 'Type Of Traveller': 'Couple Leisure', 'Queuing Times': 1, 'Terminal Cleanliness': 1, 'Terminal Seating': 5, 'Terminal Signs': 1, 'Food Beverages': 5, 'Airport Shopping': 4, 'Wifi Connectivity': 5, 'Airport Staff': 1, 'Recommended': 'no'}"
2018-09-18,1,10,"""Absolutely atrocious airport""",J Perry,"Not Verified | Absolutely atrocious airport. How people are able to get through TSA without wanting to stop and get into an altercation with an agent is beyond me. The rudest and most disrespectful employees I’ve ever come across in any airport; and I’ve traveled to 4 continents and 35+ countries. LaGuardia, please get your personnel in order and under control. Side note, I did meet 3 awesome employees at Hudson News, 5 Guys, and 1 security worker at Terminal B. Aside from that - nah, I will pay immensely to avoid this place at all costs moving forward.",,"{'Experience At Airport': 'Departure Only', 'Date Visit': 'September 2018', 'Type Of Traveller': 'Family Leisure', 'Queuing Times': 2, 'Terminal Cleanliness': 1, 'Terminal Seating': 2, 'Terminal Signs': 2, 'Food Beverages': 1, 'Airport Shopping': 1, 'Airport Staff': 1, 'Recommended': 'no'}"
2018-09-03,1,10,"""Absolutely horrendous airport""
",S Dawes,"Not Verified |  Absolutely horrendous airport. Poor or no options for eating, TSA closes esrly, its dirty, and very small for the airline and passenger traffic. The worst part, extremely long taxiing time and the worst air traffic control ever.",,"{'Experience At Airport': 'Departure Only', 'Date Visit': 'August 2018', 'Type Of Traveller': 'Business', 'Queuing Times': 1, 'Terminal Cleanliness': 2, 'Terminal Seating': 2, 'Terminal Signs': 1, 'Food Beverages': 1, 'Airport Shopping': 1, 'Wifi Connectivity': 2, 'Airport Staff': 3, 'Recommended': 'no'}"
2018-07-14,10,10,"""such a pleasant experience""",C Davids,✅ Trip Verified | I’ve read so many bad reviews on this airport and was terrified to go. But it was such a pleasant experience! The staff here were very nice compared to usual airport staff. The food court is modern and has great and healthy choices. There’s an airport link that is super convenient. I’m actually excited to fly to and from La Guardia again!,yes,"{'Experience At Airport': 'Arrival and Departure', 'Date Visit': 'July 2018', 'Type Of Traveller': 'Solo Leisure', 'Queuing Times': 4, 'Terminal Cleanliness': 4, 'Terminal Seating': 5, 'Terminal Signs': 5, 'Food Beverages': 5, 'Airport Shopping': 5, 'Airport Staff': 5, 'Recommended': 'yes'}"
2018-06-09,1,10,"""unwilling to assist the passengers""",Theodore Leb,"Not Verified |  The departing gate is not big enough to accommodate the passengers. It is dirty and the Spirit staff are rude, obnoxious and unwilling to assist the passengers. Mostly interested in how they could catch passengers trying to board with larger carry on bags than allowed. Instead of being trained to offer customer service, they are trained to generate extra income for Spirit Airlines. Spirit Airlines is all about the money!",,"{'Experience At Airport': 'Departure Only', 'Date Visit': 'April 2018', 'Type Of Traveller': 'Business', 'Queuing Times': 1, 'Terminal Cleanliness': 1, 'Terminal Seating': 1, 'Terminal Signs': 1, 'Food Beverages': 1, 'Airport Shopping': 1, 'Wifi Connectivity': 1, 'Airport Staff': 1, 'Recommended': 'no'}"
2018-06-01,1,10,"""dropped off at the wrong end""",S Kemp,✅ Trip Verified | We had to ride there from JFK and were dropped off at the wrong end of the terminal and were not guided to the disabled handicap area to catch our flight. We had asked four different people before someone finally told us and by the way that was another customer not even one of the staff members at LaGuardia. As we were going through the airport the gentleman that was taking my mothers wheelchair pushed her into an object and in to me which was absolutely unacceptable.,,"{'Experience At Airport': 'Arrival and Departure', 'Date Visit': 'May 2018', 'Type Of Traveller': 'Family Leisure', 'Queuing Times': 1, 'Terminal Cleanliness': 3, 'Terminal Seating': 2, 'Terminal Signs': 1, 'Food Beverages': 2, 'Wifi Connectivity': 1, 'Airport Staff': 1, 'Recommended': 'no'}"
2018-05-18,1,10,"""an embarrassment to NYC""",Andrea Pusic ,"❌ Not Verified |  This airport is an embarrassment to NYC on so many levels. Conditions are significantly worse than many/most airports in the developing world. In addition to the poor conditions, it is now necessary to take an airport bus to get a cab into the City. Ridiculous.",,"{'Experience At Airport': 'Arrival Only', 'Date Visit': 'May 2018', 'Type Of Traveller': 'Business', 'Queuing Times': 1, 'Terminal Cleanliness': 1, 'Terminal Seating': 1, 'Terminal Signs': 2, 'Food Beverages': 1, 'Airport Shopping': 1, 'Wifi Connectivity': 1, 'Airport Staff': 1, 'Recommended': 'no'}"
2018-05-05,1,10,"""Horrible experience""",Mindy LaCou,"No TSA pre check. The agent manning the check was horrible, he couldn’t figure out how to give us the paper to allow us to keep shoes on etc. Made us take out everything even though we had our paper. Separated all of our belongings into different bins after we put it in bins. I left behind my entire makeup bag as I am not used to having to remove it from my carry-on. Horrible experience and we travel a lot!",,"{'Experience At Airport': 'Departure Only', 'Date Visit': 'May 2018', 'Type Of Traveller': 'Couple Leisure', 'Queuing Times': 1, 'Terminal Cleanliness': 1, 'Terminal Seating': 1, 'Terminal Signs': 1, 'Food Beverages': 1, 'Wifi Connectivity': 4, 'Airport Staff': 1, 'Recommended': 'no'}"
2018-03-08,1,10,"""This airport is awful""",T Irving,"✅ Trip Verified | This airport is awful. Where are the signs for long-term parking? There are no signs for long-term parking. Security was a huge wait. Arrived at airport two hours before my flight and made it with minutes to spare. It's like a horrible maze designed to make you miss your flight. I have no idea how much I'll have to pay for parking, and I parked outside with the winter storm today, I have no idea if my car will even be there when I get back.",,"{'Experience At Airport': 'Departure Only', 'Date Visit': 'March 2018', 'Type Of Traveller': 'Business', 'Queuing Times': 1, 'Terminal Cleanliness': 3, 'Terminal Signs': 1, 'Food Beverages': 0, 'Wifi Connectivity': 1, 'Airport Staff': 1, 'Recommended': 'no'}"
2018-02-18,1,10,"""poorly staffed, disorganized""",Abigail Orde,"❎ Not Verified | This airport is poorly staffed, slow, disorganized, confusing, dirty, old, and expensive. In the words of a previous review, “a total disaster”. Worst airport I’ve ever been in and  I’ve been to Kathmandu, Nepal, which more resembled a shed than an airport.",,"{'Experience At Airport': 'Departure Only', 'Date Visit': 'February 2018', 'Type Of Traveller': 'Solo Leisure', 'Queuing Times': 1, 'Terminal Cleanliness': 1, 'Terminal Seating': 2, 'Terminal Signs': 1, 'Food Beverages': 1, 'Airport Shopping': 2, 'Wifi Connectivity': 2, 'Airport Staff': 1, 'Recommended': 'no'}"
