datePublished,ratingValue,bestRating,header,author,reviewBody,recommended,stats
2018-01-29,1,10,"""food at this airport is a total scam""",B Harris,"❎ Not Verified |  My review is for the food at this airport. Why would an airport ever have one vendor for the entire airport. That is absolutely outrageous. There is absolutely zero competition and horrible selections for full blown gouging prices. Can you believe a food court with different places, all owned by the same company, ridiculous. $6 for a slice of pizza. $7 for a bag of candy and a drink. $12 for a small sandwich. Absolutely outrageous. This company should be completely fired and removed from this airport immediately. The food at this airport is a total scam.",,"{'Experience At Airport': 'Arrival and Departure', 'Date Visit': 'January 2018', 'Type Of Traveller': 'Solo Leisure', 'Queuing Times': 1, 'Terminal Cleanliness': 1, 'Terminal Seating': 3, 'Terminal Signs': 1, 'Food Beverages': 1, 'Airport Shopping': 2, 'Wifi Connectivity': 1, 'Airport Staff': 1, 'Recommended': 'no'}"
2018-01-29,4,10,"""airport feels very old and outdated""",R Sanderson,✅ Trip Verified | How is it possible that the Greatest City on Earth has this joke of an airport for domestic flights? The airport feels very old and outdated. Food court available only before the security. Once you pass security - there’s not much choice at all! Restrooms are not cleaned regularly. It’s time to modernize LGA - New Yorkers deserve better!,,"{'Experience At Airport': 'Arrival and Departure', 'Date Visit': 'December 2017', 'Type Of Traveller': 'Solo Leisure', 'Queuing Times': 3, 'Terminal Cleanliness': 3, 'Terminal Seating': 2, 'Terminal Signs': 4, 'Food Beverages': 2, 'Airport Shopping': 1, 'Wifi Connectivity': 2, 'Airport Staff': 2, 'Recommended': 'no'}"
2018-01-05,1,10,"""the worst I have ever been to""",L Murff,❎ Not Verified |  This airport is the worst I have ever been to. I have flown all over the world and have never experienced anything this bad. On top of the poor conditions the staff are rude and in no way helpful. I swore many years ago I would never use La Guardia again and after trying one more time I am comfortable never using this terrible airport again.,,"{'Experience At Airport': 'Arrival and Departure', 'Date Visit': 'January 2018', 'Type Of Traveller': 'Business', 'Queuing Times': 1, 'Terminal Cleanliness': 1, 'Terminal Seating': 2, 'Terminal Signs': 1, 'Food Beverages': 0, 'Wifi Connectivity': 3, 'Airport Staff': 1, 'Recommended': 'no'}"
2018-01-04,1,10,"""No good facilities""",Ravi Vee,"❎ Not Verified |  I have travelled many airports throughout the world. Terminal 1 in La Guardia is by far the worse! Free WiFi for 30 minutes, are you in the Stone Age? If your flight gets delayed, you do not have much to do. No good facilities to talk about. I do not think we will use this airport again.",,"{'Experience At Airport': 'Departure Only', 'Date Visit': 'January 2018', 'Type Of Traveller': 'Family Leisure', 'Queuing Times': 5, 'Terminal Cleanliness': 3, 'Terminal Seating': 1, 'Terminal Signs': 1, 'Food Beverages': 1, 'Airport Shopping': 1, 'Wifi Connectivity': 1, 'Airport Staff': 2, 'Recommended': 'no'}"
2017-12-29,2,10,"""a disgrace to this thing we call airports""
",L Andrews,"❎ Not Verified |  La Guardia is a disgrace to this thing we call airports. Advertised $4 hot dog? Useless iPads will clear that up for you! $12 for a hot dog. Over $20 for a full meal. No restaurants for people who want something quick and cheap, and even the stores that sell fast snacks had terrible selection (they don't even sell Doritos). Literally every flight was delayed: we were misinformed multiple times about the extent of our delay, about whether or not we were waiting on another aircraft to arrive or if they were going to use a different aircraft. The WiFi is ridiculously expensive, hence the urge to write a terrible review during your free complimentary 30 minutes of wifi before you are kicked off and forced to pay! But, if wasting your own hard earned money and valuable time doesn't bother you, then you'll absolutely love this airport!",,"{'Experience At Airport': 'Arrival and Departure', 'Date Visit': 'December 2017', 'Type Of Traveller': 'Couple Leisure', 'Queuing Times': 1, 'Terminal Cleanliness': 3, 'Terminal Seating': 3, 'Terminal Signs': 3, 'Food Beverages': 1, 'Airport Shopping': 1, 'Wifi Connectivity': 1, 'Airport Staff': 3, 'Recommended': 'no'}"
2017-12-15,1,10,"""This is a terrible airport""",C Ecton,"✅ Trip Verified | What moron thought up the airport bus system to rental cars. Two transfers, miss marked buses, inaccurate directions. Biden was mistaken, LaGuardia is not a third world country, it’s a failed country. This is a terrible airport. NYC should shut it down, tear it down, and start all over.",,"{'Experience At Airport': 'Arrival Only', 'Date Visit': 'December 2017', 'Type Of Traveller': 'Business', 'Queuing Times': 3, 'Terminal Cleanliness': 1, 'Terminal Seating': 1, 'Terminal Signs': 1, 'Food Beverages': 3, 'Airport Shopping': 2, 'Wifi Connectivity': 1, 'Airport Staff': 1, 'Recommended': 'no'}"
2017-12-05,4,10,"""everything falling apart""",Ben Weeks,"❎ Not Verified | La Guardia airport is a total zoo. When I flew back in 2014 it was a disaster, 3 years later nothing has changed. When AA took over US Airways they got Terminal C which is where the legacy US Airways routes including flights to Charlotte depart. Terminal C is awful, very small, limited food options and very little seating, the AA side of the terminal is bland while the Delta side is a lot nicer with iPads (with almost no apps) set up. Airport is very very old and very dirty and everything seems to be falling apart. Expect your flight to be delayed out of LGA flight rarely leave LaGuardia on time. Our flight ended up leaving 45 minutes late, check-in was super slow and so was security, most of the staff are completely clueless and have no idea what is going on. When arriving in LaGuardia they gave us the wrong carousel for our bags and after waiting 30 minute we finally found them at a different carousel on the other side of arrivals and the airport staff had absolutely no idea! While JFK and Newark can also have quite a bit of problems LaGuardia seems to be one of the worst, so avoid!",,"{'Experience At Airport': 'Departure Only', 'Date Visit': 'January 2017', 'Type Of Traveller': 'Solo Leisure', 'Queuing Times': 1, 'Terminal Cleanliness': 2, 'Terminal Seating': 2, 'Terminal Signs': 2, 'Food Beverages': 3, 'Airport Shopping': 2, 'Wifi Connectivity': 2, 'Airport Staff': 2, 'Recommended': 'no'}"
2017-12-02,1,10,"""extremely disappointed with my experience""",K Andrews,"❎ Not Verified |  I have been flying 3+ times a year for the last 10 years. I'm extremely disappointed with my experience at La Guardia both the arrival and departure. When I arrived I felt as though I was boarding he subway, the smell was horrendous. When I was going through security for the departure I have never met ruder people.",,"{'Experience At Airport': 'Arrival and Departure', 'Date Visit': 'November 2017', 'Type Of Traveller': 'Solo Leisure', 'Queuing Times': 1, 'Terminal Cleanliness': 1, 'Terminal Seating': 1, 'Terminal Signs': 2, 'Food Beverages': 1, 'Airport Shopping': 1, 'Airport Staff': 1, 'Recommended': 'no'}"
2017-11-03,6,10,"""food was extremely over priced""",Spencer Neuman,"❎ Unverified |  When I departed the airport on a Saturday morning, security lines were really short but I was hungry for breakfast so I went to a restaurant. The food was extremely over priced. $4 for toast and $5 for water. Very upsetting but the good thing was that my flight departed on time. When I got back on Monday, I had a much better experience. The moment I got to the taxi line, the dispatcher got me a taxi and I was on my way.",yes,"{'Experience At Airport': 'Arrival and Departure', 'Date Visit': 'October 2017', 'Type Of Traveller': 'Couple Leisure', 'Queuing Times': 4, 'Terminal Cleanliness': 3, 'Terminal Seating': 4, 'Terminal Signs': 5, 'Food Beverages': 1, 'Airport Shopping': 2, 'Wifi Connectivity': 2, 'Airport Staff': 5, 'Recommended': 'yes'}"
2017-08-10,4,10,"""This airport is a total disaster""",Miosotis Maldonado,"❎ Unverified |  This airport is a total disaster. They are under construction so go figure. There is a lot of traffic due to the exterior color metrication. The TSA pre-check was fast. Once in the terminal there are a few restaurants and a couple of stores. Food and beverage prices are a little high, your typical airport prices. The airport crew can be a little nasty and not helpful. They didn't allow me to start inside the terminal as my flights kept on being canceled and got stranded there for 3 days. The construction means that some areas are closed, and everything feels right.",,"{'Experience At Airport': 'Departure Only', 'Date Visit': 'August 2017', 'Type Of Traveller': 'Couple Leisure', 'Queuing Times': 1, 'Terminal Cleanliness': 2, 'Terminal Seating': 1, 'Terminal Signs': 2, 'Food Beverages': 2, 'Airport Shopping': 1, 'Airport Staff': 1, 'Recommended': 'no'}"
2017-08-10,4,10,"""airport is a total disaster""",Miosotis Maldonado,"❎ Unverified |  This airport is a total disaster. They are under construction so go figure. There is a lot of traffic due to the exterior color metrication. The TSA pre-check was fast. Once in the terminal there are a few restaurants and a couple of stores. Food and beverage prices are a little high, your typical airport prices. The airport crew can be a little nasty and not helpful. They didn't allow me to start inside the terminal as my flights kept on being canceled and got stranded there for 3 days. The construction means that some areas are closed, and everything feels right.",,"{'Experience At Airport': 'Departure Only', 'Date Visit': 'August 2017', 'Type Of Traveller': 'Couple Leisure', 'Queuing Times': 1, 'Terminal Cleanliness': 2, 'Terminal Seating': 1, 'Terminal Signs': 2, 'Food Beverages': 2, 'Airport Shopping': 1, 'Airport Staff': 1, 'Recommended': 'no'}"
2017-08-09,4,10,"""a total disaster""",Miosotis Maldonado,"✅ Verified Review | La Guardia airport is a total disaster. They are under construction so go figure. There is a lot of traffic due to the exterior works. The TSA pre-check was fast. Once in the terminal there are a few restaurants and a couple of stores. Food and beverage prices are a little high, your typical airport prices. The airport crew can be a little nasty and not helpful. They didn't allow me to stay inside the terminal as my flights kept on being canceled and got stranded there for 3 days. The construction means that some areas are closed.",,"{'Experience At Airport': 'Departure Only', 'Date Visit': 'August 2017', 'Type Of Traveller': 'Couple Leisure', 'Queuing Times': 1, 'Terminal Cleanliness': 2, 'Terminal Seating': 1, 'Terminal Signs': 2, 'Food Beverages': 2, 'Airport Shopping': 1, 'Airport Staff': 1, 'Recommended': 'no'}"
2017-07-24,1,10,"""woman is still there doing nothing""",G Carugati,"❎ Unverified |  Friday July 21. I arrive at the airport to meet my daughter and her 3-year-old son. Their Spirit flight from Chicago is arriving at least one hour late. I am told the only place to wait for arriving passengers is near baggage claim. There is a woman there, apparently doing nothing, in a kind of uniform wearing a badge reading something like ""passenger assistant"". I ask her where to find an arrivals monitor. She laughs and says: ""there are no such monitors here"". I ask where to find them elsewhere, she says ""there are only departures monitors"". I express my surprise, she keeps laughing and she says ""this is how this airport is right now"". Then I ask her to please find information about Spirit 630, she laughs again and says ""it's impossible"". Then I wander about the airport, finally spotting, on the floor above, an arrivals monitor. The arrival appears to be imminent, so I go downstairs not to miss my daughter. Of course I still don't know whether the plane has landed. The woman is still there doing nothing.",,"{'Experience At Airport': 'Transit', 'Date Visit': 'July 2017', 'Type Of Traveller': 'Solo Leisure', 'Queuing Times': 1, 'Terminal Cleanliness': 3, 'Terminal Signs': 1, 'Food Beverages': 0, 'Airport Staff': 1, 'Recommended': 'no'}"
2017-06-27,8,10,"""through security in less than 10 minutes""",C Ford,"❎ Unverified | 7.30am departure on Air Canada in La Guardia Terminal B on a Monday morning could have been an anxious experience but it was shockingly smooth. We were through security in less than 10 minutes. The A gate area is small, but there was seating for all and food options available with short queues at 6.30am. There was even a tiny duty free shop open. 30min of free wifi is available and worked fine.",yes,"{'Experience At Airport': 'Departure Only', 'Date Visit': 'June 2017', 'Type Of Traveller': 'Couple Leisure', 'Queuing Times': 5, 'Terminal Cleanliness': 4, 'Terminal Seating': 4, 'Terminal Signs': 3, 'Food Beverages': 4, 'Airport Shopping': 2, 'Wifi Connectivity': 3, 'Airport Staff': 4, 'Recommended': 'yes'}"
2017-03-17,7,10,"""staff friendly and helpful""",F Amy,"We arrived at La Guardia Airport because our flight out of JFK was cancelled and we were re-routed. Staff at the ticket counter (Delta) were courteous and helpful (at 5:00 a.m.). We were booked on a flight that didn't leave until 14 hours later, but staff suggested we go on the stand-by list, and we were in the air within an hour. The gate seating was very adequate. There were iPads to use free, and were able to charge our phone. Staff at the gate were also very friendly and helpful.",yes,"{'Experience At Airport': 'Departure Only', 'Date Visit': 'March 2017', 'Type Of Traveller': 'Couple Leisure', 'Queuing Times': 4, 'Terminal Cleanliness': 4, 'Terminal Seating': 5, 'Terminal Signs': 4, 'Food Beverages': 4, 'Wifi Connectivity': 5, 'Airport Staff': 5, 'Recommended': 'yes'}"
2017-03-16,1,10,"""extremely poorly maintained facility""",K Cook,"✅ Verified Review |  
Our 5-hour layover at La Guardia Airport was very unpleasant. We were in the B Terminal for the entire layover. The women's restroom had only 1 stall, the wait was long, & the only sink was clogged & already half-filled with ""used"" water. We were subjected to a dirty terminal, as well as having to breathe plane fumes in what was already a stuffy & poorly ventilated waiting area/corridor. Until such time as we receive confirmed evidence that this airport has been upgraded & cleaned up, we will not be choosing flights that either arrive or depart from this extremely poorly maintained facility.",,"{'Experience At Airport': 'Departure Only', 'Date Visit': 'March 2017', 'Type Of Traveller': 'Business', 'Queuing Times': 1, 'Terminal Cleanliness': 1, 'Terminal Seating': 2, 'Terminal Signs': 2, 'Food Beverages': 3, 'Airport Shopping': 1, 'Wifi Connectivity': 1, 'Airport Staff': 3, 'Recommended': 'no'}"
2016-12-06,1,10,"""nowhere to sit""",Jane Eakins,"✅ Verified Review |  
I arrived at La Guardia airport in American / Delta terminal and had to wait 50 minutes to meet my colleague flying in on a separate flight. There is nowhere to sit - period. When I enquired I was told by an airport employee that all seating was taken out due to the homeless population. As a traveler who has paid for a flight into NY that should not become my burden. I am saddened by the homeless population but I am a senior citizen north of 60 and to not have a place to sit seems unhealthy and unreasonable.",,"{'Experience At Airport': 'Arrival Only', 'Date Visit': 'December 2016', 'Type Of Traveller': 'Business', 'Queuing Times': 3, 'Terminal Cleanliness': 1, 'Terminal Seating': 1, 'Terminal Signs': 2, 'Food Beverages': 1, 'Airport Shopping': 1, 'Wifi Connectivity': 1, 'Airport Staff': 1, 'Recommended': 'no'}"
2016-09-30,5,10,"""parking buses are inconsistent and sporadic""",R Williams,"✅ Verified Review | I understand that the parking is difficult and you have to leave at least another hour plus. The buses are so inconsistent and sporadic at La Guardia that the system is in disarray. Upon our arrival for our first flight the bus we needed was no where to be found. Another bus radioed the correct bus and no answer. He was nice enough to bring us close to our terminal since we waited over 40 minutes. If this driver didn't help us we probably would have missed our flight. Upon our return the same senerio happened- no directions and every employee we asked hadn't a clue. We waited 40 minutes and the driver stops and talked to everyone he knows bringing the trip to retrieve our car close to a hour and 10 min. The airport should institute and educate directions to their employees and have signs for where to go. Airport staff as far as TSA, American Airlines staff and the Hudson news staff were excellent. This isn't our first time parking since construction. Once the parking issue is complete it will be seamless like prior to the construction.",yes,"{'Experience At Airport': 'Arrival and Departure', 'Date Visit': 'September 2016', 'Type Of Traveller': 'Business', 'Queuing Times': 4, 'Terminal Cleanliness': 4, 'Terminal Signs': 1, 'Food Beverages': 4, 'Airport Staff': 2, 'Recommended': 'yes'}"
2016-09-28,1,10,"""signage is confusing""",A Granger,"Just a short visit to La Guardia airport but one I will never forget. Staff are 50/50 between ok and horrible. Signage is confusing. Nice doesn't feature and helpfulness was swapped some time ago with disdain, apathy and hatred for mankind. I don't want to come through here ever again.",,"{'Experience At Airport': 'Transit', 'Date Visit': 'September 2016', 'Type Of Traveller': 'Business', 'Queuing Times': 1, 'Terminal Cleanliness': 3, 'Terminal Seating': 1, 'Terminal Signs': 1, 'Food Beverages': 0, 'Airport Staff': 1, 'Recommended': 'no'}"
2016-09-20,3,10,"""finally getting an upgrade""",Antonio Bellamy,"I fly American Airlines now into LaGuardia so I can use C terminal. Yes, this airport is horrible. But if you fly Delta or American you will have a great chance of getting C terminal and not the the main terminals which are run down and dirty but glad this airport is finally getting an upgrade.",yes,"{'Experience At Airport': 'Arrival and Departure', 'Date Visit': 'September 2016', 'Type Of Traveller': 'Couple Leisure', 'Queuing Times': 2, 'Terminal Cleanliness': 2, 'Terminal Seating': 1, 'Terminal Signs': 1, 'Food Beverages': 3, 'Airport Shopping': 2, 'Wifi Connectivity': 4, 'Airport Staff': 3, 'Recommended': 'yes'}"
2016-08-18,1,10,"""impossible to talk to anyone""",Susan Sawle,"Worst airport I have ever been to. Flight was canceled and could not get any answers. They had 2 girls working at the information desk and almost half of the flights were canceled. Needless to say it was impossible to talk to anyone. Some people said it was the weather, which was clear, other said it was an electrical problem and still some said it was the other airports mistake. People were rude and not informative Never again..",,"{'Experience At Airport': 'Departure Only', 'Date Visit': 'August 2016', 'Type Of Traveller': 'Family Leisure', 'Queuing Times': 2, 'Terminal Cleanliness': 1, 'Terminal Seating': 1, 'Terminal Signs': 3, 'Food Beverages': 1, 'Airport Shopping': 1, 'Wifi Connectivity': 1, 'Airport Staff': 1, 'Recommended': 'no'}"
2016-08-07,1,10,"""dysfunctional, disorganized, dirty""",p bliss,"I have traveled through more than 30 airports worldwide over the last 35 years. La Guardia is the most dysfunctional, disorganized, dirty and disgusting airport I have ever dealt with, which unfortunately only seems to get worse with every time I am forced to travel through it due to flight or airline choice. It is so disappointing that an airport in a hub city like NY is worse than any third world airport I've been through. I cannot emphasize enough how much I loathe this airport.",,"{'Experience At Airport': 'Arrival and Departure', 'Date Visit': 'August 2016', 'Type Of Traveller': 'Family Leisure', 'Queuing Times': 1, 'Terminal Cleanliness': 1, 'Terminal Seating': 1, 'Terminal Signs': 1, 'Food Beverages': 1, 'Airport Shopping': 1, 'Wifi Connectivity': 2, 'Airport Staff': 1, 'Recommended': 'no'}"
2016-07-28,3,10,"""unorganized sloppy run facility""",R Strange,"Had to connect through here and after my last experience here 5 years ago I swore this never again. Spent 4 hours in line for take off to the point it got hotter through the day and we had to return to the gate, supposedly for fuel. After another thirty minutes the flight was cancelled. At this point I have to guess there were forty to fifty planes waiting to take off. It is an unorganized sloppy run facility where the employees carry an entitlement attitude vs a service attitude. I will cancel a trip rather than travel through this place again.",,"{'Experience At Airport': 'Transit', 'Date Visit': 'July 2016', 'Type Of Traveller': 'Family Leisure', 'Queuing Times': 2, 'Terminal Cleanliness': 1, 'Terminal Seating': 1, 'Terminal Signs': 2, 'Food Beverages': 1, 'Airport Shopping': 1, 'Wifi Connectivity': 2, 'Airport Staff': 1, 'Recommended': 'no'}"
2016-07-08,2,10,"""getting to La Guardia was a nightmare""",Al Rodriguez,"Getting to La Guardia was a nightmare. They are doing construction and don't know how to properly divert traffic. I was flying Delta and I was pleasantly surprised to find the terminal was not bad. My prior experiences at LGA were not good. The other terminals are beyond horrible. I was expecting long lines at the security check point, but luckily they were not bad. It took less than 10 minutes to get through. The usual hassles, but not worse than other places. They herded us onto the plane and we got seated and we were all smiles when the plane left the gate on time. But that is when things got bad. We spent just under an hour waiting on line to take off. This added substantially to our travel time. Worst part is that when we flew back, the same thing happened. We landed early but ended up waiting close to an hour to get to our gate. The incompetence shown by the Port Authority of NY and NJ is incredible. I would recommend that you avoid this airport as much as possible. A week after this trip I took another out of Newark and that was a much more pleasant experience. It's hard to believe these two airports are run the by same agency.",,"{'Experience At Airport': 'Arrival and Departure', 'Date Visit': 'June 2016', 'Type Of Traveller': 'Family Leisure', 'Queuing Times': 2, 'Terminal Cleanliness': 3, 'Terminal Seating': 2, 'Terminal Signs': 1, 'Food Beverages': 2, 'Airport Shopping': 2, 'Wifi Connectivity': 1, 'Airport Staff': 2, 'Recommended': 'no'}"
2016-04-08,1,10,"""nothing short of horrible""",CW Wright,"My experience at La Guardia was nothing short of horrible. It's nasty, disorganized, and the airport staff are rude. Expect to be met with a scowl upon your arrival, and know that any and all questions/complaints will fall on deaf ears. New York is a great city with hospitable people, but this mockery of an establishment does not reflect that greatness. I didn't have an issue with the fact that our flight was delayed five hours, but I did have a problem with the attitudes of the employees, the frustratingly slow service, and the general lack of information that is provided regarding airport procedures. I traveled from New York to Atlanta, and there is a stark difference between the two airports. La Guardia needs to figure out what Hartsfield-Jackson airport is doing right and get their act together.",,"{'Experience At Airport': 'Arrival and Departure', 'Date Visit': 'April 2016', 'Type Of Traveller': 'Couple Leisure', 'Queuing Times': 1, 'Terminal Cleanliness': 2, 'Terminal Seating': 2, 'Terminal Signs': 2, 'Food Beverages': 1, 'Airport Shopping': 1, 'Airport Staff': 1, 'Recommended': 'no'}"
2016-04-01,1,10,"""not enough seats""",P Anderson,"Not enough seats at the gates, or enough bathrooms. Bathrooms had no paper towels and the soap dispensers look just like the faucets. They are not marked as soap, so most women in there were wandering around looking for soap. The most annoying aspect of this airport is the inability to pay with cash for anything. I am sure they think they are being progressive by insisting orders be placed via IPads, but it isn't progressive. It is a slap in the face for customer service. Nothing like having three employees standing around doing nothing while you have to stand there and maneuver a ridiculous amount of screens and menus to order a cup of tea. Apparently a person without a credit card is not welcome to eat or drink at la Guardia airport.",,"{'Experience At Airport': 'Departure Only', 'Date Visit': 'April 2016', 'Type Of Traveller': 'Solo Leisure', 'Queuing Times': 3, 'Terminal Cleanliness': 2, 'Terminal Seating': 1, 'Terminal Signs': 3, 'Food Beverages': 1, 'Airport Shopping': 1, 'Airport Staff': 1, 'Recommended': 'no'}"
2016-03-28,2,10,"""really poorly organised""",Nick Tohill,La Guardia is possibly the worst airport I have experienced. The line to get through security is really poorly organised and moves at a snails pace. Once through to the other side there is very little in the way of shops of food offerings. Terrible. One toilet that I found and none of the hand dryers were working.,,"{'Experience At Airport': 'Departure Only', 'Date Visit': 'March 2016', 'Type Of Traveller': 'Solo Leisure', 'Queuing Times': 1, 'Terminal Cleanliness': 1, 'Terminal Seating': 2, 'Terminal Signs': 2, 'Food Beverages': 1, 'Airport Shopping': 1, 'Wifi Connectivity': 1, 'Airport Staff': 1, 'Recommended': 'no'}"
