datePublished,ratingValue,bestRating,header,author,reviewBody,recommended,stats
2023-10-26,8,10,"""Restrooms are plentiful and clean""",Mahmud Noormohamed,"✅ Trip Verified | The new Terminal C is a significant improvement over the old Delta terminal. This is a spacious terminal with plenty of light from the floor to ceiling windows giving views of the airport runways/aprons and CitiField and Arthur Ashe Stadium. The walk from gate 75 to gate 97 was rather long. Restrooms are plentiful and clean; however, in some locations they could use more stalls given the number of passengers who traverse this terminal. Dining options are placed conveniently. I had a delicious lunch at one of the restaurants. The airport WiFi is very fast and worked flawlessly.",yes,"{'Experience At Airport': 'Departure Only', 'Date Visit': 'October 2023', 'Type Of Traveller': 'Solo Leisure', 'Queuing Times': 5, 'Terminal Cleanliness': 4, 'Terminal Seating': 4, 'Terminal Signs': 4, 'Food Beverages': 5, 'Wifi Connectivity': 5, 'Recommended': 'yes'}"
2023-06-18,8,10,"""High marks for LGA new Terminal B""",F Kauner,"✅ Trip Verified |  High marks for LGA new Terminal B. The building is spacious with plenty of light. Long walks from check-in to the gates and one has to walk through the  shopping mall to get to one's gate. Arrived on a Thursday at 7:00. Went to the TSA PRE line. There were about 20 people ahead of me but, with 4 stations open to check ID, the line moved quickly. Found myself in a too-slow security lane. People, why do you wait until you get up to the scanner to remove your watch, belt, jewelry, etc. Especially if you're in PRE, you know who this works! Still and all, I arrived at 7:00, checked luggage and was through security by 7:15. Not at all bad for this newly refurbished airport.",yes,"{'Experience At Airport': 'Departure Only', 'Date Visit': 'June 2023', 'Type Of Traveller': 'Business', 'Queuing Times': 5, 'Terminal Cleanliness': 5, 'Terminal Seating': 3, 'Terminal Signs': 4, 'Food Beverages': 0, 'Airport Staff': 4, 'Recommended': 'yes'}"
2023-05-31,1,10,"""no signage to speak of for Frontier""",T Marston,"✅ Trip Verified |  Absolutely no signage to speak of for Frontier, very hard to figure out where to go amongst all the Competitor airline signage, very difficult to find the terminal to go to, and the ticket agents and bag person was rude. The only thing going for this terminal was the security desk, they were nice, and the person behind the screener checking the people images was sort of funny, other then that everyone else i dealt with was rude.",,"{'Experience At Airport': 'Departure Only', 'Date Visit': 'May 2023', 'Type Of Traveller': 'Family Leisure', 'Queuing Times': 1, 'Terminal Cleanliness': 1, 'Terminal Seating': 1, 'Terminal Signs': 1, 'Airport Staff': 1, 'Recommended': 'no'}"
2022-10-18,4,10,"""Horrible experience""",Jane Lilja,"Not Verified | While arriving to La Guardia Terminal B from JFK after an international flight, we were too early to check in. There is no restaurant to relax in without going through security It was too early to check bags therefore could not go through security but had nowhere to have a drink & food & relax. Very few seats Those that we’re provided were backless benches. After a renovation it seems someone should have thought to provide food service for those arriving too early to check in. Horrible experience",,"{'Experience At Airport': 'Departure Only', 'Date Visit': 'October 2022', 'Type Of Traveller': 'Couple Leisure', 'Queuing Times': 3, 'Terminal Cleanliness': 4, 'Terminal Seating': 1, 'Terminal Signs': 1, 'Food Beverages': 1, 'Airport Staff': 4, 'Recommended': 'no'}"
2022-09-05,2,10,"""Its bad reputation is well earned""",S Tyler ,"Not Verified |  Terrible signage, inefficient layout, understaffed. Its bad reputation is well earned. Not much else to say. Ridiculous that they are trying to renovate the airport but simply better signage would go a long way.",,"{'Experience At Airport': 'Departure Only', 'Date Visit': 'September 2022', 'Type Of Traveller': 'Solo Leisure', 'Queuing Times': 2, 'Terminal Cleanliness': 2, 'Terminal Seating': 1, 'Terminal Signs': 1, 'Food Beverages': 2, 'Airport Shopping': 2, 'Airport Staff': 1, 'Recommended': 'no'}"
2022-08-25,10,10,"""Delta Terminal C is elegant, convenient and modern""",N Vail,"✅ Trip Verified |  The new Delta Terminal C is elegant, convenient and modern. Restaurants, gate areas, and restrooms were all immaculate. Check-in went smoothly. Keep it up.",yes,"{'Experience At Airport': 'Arrival and Departure', 'Date Visit': 'August 2022', 'Type Of Traveller': 'Couple Leisure', 'Queuing Times': 5, 'Terminal Cleanliness': 5, 'Terminal Seating': 5, 'Terminal Signs': 5, 'Food Beverages': 5, 'Airport Shopping': 5, 'Wifi Connectivity': 5, 'Airport Staff': 5, 'Recommended': 'yes'}"
2022-07-25,1,10,"""I will never fly through La Guardia again""",Ynette Evans,"Not Verified |  I had a flight scheduled to leave a 6 in the morning connecting in La Guardia. Several delays and flight changes later, I finally managed to get on a plane, and then had to wait in the plane for another hour because La Guardia had shut down airspace. I will have to figure out another connecting flight because of this, and they made me check my carry on so God knows where that will end up. This has been a complete nightmare I will never fly through La Guardia again.",,"{'Experience At Airport': 'Arrival and Departure', 'Date Visit': 'July 2022', 'Type Of Traveller': 'Solo Leisure', 'Queuing Times': 1, 'Terminal Cleanliness': 2, 'Terminal Seating': 1, 'Terminal Signs': 2, 'Food Beverages': 2, 'Airport Shopping': 2, 'Airport Staff': 1, 'Recommended': 'no'}"
2022-07-23,1,10,"""a pathetic excuse for an airport""",O James,"✅ Trip Verified | This has to be the worst airport I’ve ever been too. Not only is every terminal a 20 minute drive but the ‘shuttle service’ drops you half a mile from terminal C. Wait it gets better, you have to walk another mile once you get through security to get to gate 67 because they refuse to open a closer security checkpoint site. This is a pathetic excuse for an airport and honestly should be shut down.",,"{'Experience At Airport': 'Departure Only', 'Date Visit': 'July 2022', 'Type Of Traveller': 'Couple Leisure', 'Queuing Times': 1, 'Terminal Cleanliness': 1, 'Terminal Seating': 1, 'Terminal Signs': 1, 'Food Beverages': 1, 'Airport Shopping': 1, 'Wifi Connectivity': 1, 'Airport Staff': 1, 'Recommended': 'no'}"
2022-07-14,9,10,"""The new terminal is unrecognizable and a huge improvement!""",Nathaniel Altman,"✅ Trip Verified | I hadn't flown from LGA in years and was very impressed with the new Terminal B (home to American Airlines and others). Beautifully designed, spacious, and easy to navigate with abundant dining and shopping opportunities. Check-in areas are spacious and efficient. Great rest rooms. The new terminal is unrecognizable and a huge improvement!",yes,"{'Experience At Airport': 'Departure Only', 'Date Visit': 'July 2022', 'Type Of Traveller': 'Couple Leisure', 'Queuing Times': 4, 'Terminal Cleanliness': 4, 'Terminal Seating': 4, 'Terminal Signs': 5, 'Food Beverages': 4, 'Airport Shopping': 4, 'Wifi Connectivity': 3, 'Airport Staff': 4, 'Recommended': 'yes'}"
2022-05-18,1,10,"""Don’t mind taking your money but don’t care if you get what you pay for""",Karen Roberts,"✅ Trip Verified | We flew from Dallas to New York where we had a lay over and changed planes before going to Portland Maine. We thought! However our flight to Portland was delayed several times and then cancelled late at night when shops closed. There were elderly people and handicapped people and some medical issues. No assistance was offered. The passengers stuck together and tried to help each other as much as possible. Had to ask for snacks and water but no wheelchairs, no blankets, no directions, just a lot of rudeness. We spent the night on the floor freezing in the airport, then next morning when trying to leave nothing but rudeness everywhere. Security screaming at deaf boy because they wouldn’t calm down long enough to realize or listen to us trying to tell them he was deaf. Eating places the same way. Don’t mind taking your money but don’t care if you get what you pay for and rude to boot. Check in very inefficiently run.",,"{'Experience At Airport': 'Arrival and Departure', 'Date Visit': 'May 2022', 'Type Of Traveller': 'Family Leisure', 'Queuing Times': 1, 'Terminal Cleanliness': 1, 'Terminal Seating': 1, 'Terminal Signs': 1, 'Food Beverages': 1, 'Airport Shopping': 1, 'Wifi Connectivity': 1, 'Airport Staff': 1, 'Recommended': 'no'}"
2022-05-08,3,10,"""constant delays with security""",R Blake,✅ Trip Verified | Multibillion dollar renovation at LaGuardia yet security with pre check takes 20 minutes? What’s the point? Never experienced such significant and constant delays with security.,,"{'Experience At Airport': 'Departure Only', 'Date Visit': 'May 2022', 'Type Of Traveller': 'Business', 'Queuing Times': 1, 'Terminal Cleanliness': 4, 'Terminal Seating': 1, 'Terminal Signs': 1, 'Food Beverages': 4, 'Airport Shopping': 4, 'Airport Staff': 3, 'Recommended': 'no'}"
2022-05-03,1,10,"""waiting for hours inside the airport""",Melinda Sierra,"✅ Trip Verified |  Upon landing and looking for a taxi I found this Appallingly inefficient scenario: There were ropes inside the airport lobby where people waited for taxis. Some people just skipped the line and went directly outside where they queued with the passengers who had waited for one hour while the other stranded people were inside still waiting. People in wheelchairs were set aside and automatically skipped the line. My wait for a trickling taxi was one hour. When I finally went outside to the next queue the waiting travelers inside had at least a 2 hour wait. The line inside the airport extended way outside the rope lines. People with children or pets were literally in deep trouble. The taxi cabs are not allowed to pick up passengers at the airport curb but are obliged to wait in a parking lot two miles from the airport and then fight traffic to get to curb and pick up a traveler. They make this long circle around the airport. There are hundreds of taxi cabs waiting in the lot. Causing hundreds of stranded travelers waiting for hours inside the airport. I would like to know the genius who created this mess so I could tell him/her what a dumb way to manage the taxi/passenger situation. With all the taxi cabs waiting in the parking lot causing the passengers to wait for hours in the airport instead of a quick turn over like in any other civilized country. It’s a disgrace and mismanagement of available taxis, time, airport disruption due to interminable lines and disgruntled passengers and extra fuel since the driver needs to travel fighting traffic to reach the terminal AGAIN. Besides that, think of the extra burden on the environment and the air we breathe, circling around like that for no reason whatsoever. Taxis are constantly needed, don’t keep them in a parking lot 2 miles from airport trickling in, like slow drops.",,"{'Experience At Airport': 'Departure Only', 'Date Visit': 'April 2022', 'Type Of Traveller': 'Business', 'Queuing Times': 1, 'Terminal Cleanliness': 4, 'Terminal Seating': 2, 'Terminal Signs': 2, 'Food Beverages': 1, 'Airport Staff': 2, 'Recommended': 'no'}"
2022-04-23,10,10,"""just the pleasantries that were needed""",Travis Thornton,"Not Verified |  The customer service we received by American Airlines and TSA was amazing. I forgot my bag at a store in La Guardia when I purchased an item. We only realized it when we were outside! Well, we told a TSA agent what happened and they directed us to the security agent. She told me to ask AA for a gate pass and if not she would personally escort me back to the store. The AA agent was super nice and told me she would radio someone to walk me. She the asked for my receipt and contacted the store directly! TSA took over and sent someone to the store and brought out bag! Wow, this was just the pleasantries that were needed after an wonderful cruise.",yes,"{'Experience At Airport': 'Arrival and Departure', 'Date Visit': 'April 2022', 'Type Of Traveller': 'Family Leisure', 'Queuing Times': 5, 'Terminal Cleanliness': 5, 'Terminal Seating': 5, 'Terminal Signs': 5, 'Food Beverages': 5, 'Airport Shopping': 5, 'Wifi Connectivity': 5, 'Airport Staff': 5, 'Recommended': 'yes'}"
2022-02-02,1,10,"""Absolutely pathetic""",T Terry,"Not Verified | What a complete joke - this is not a terminal, but a completely messed up construction zone. You will have to walk through mud, rain, snow and ice to get in and out of that terminal. There is not even a drop off without having to walk for 5-10 minutes through the complete mess. Once you made it to the ""terminal"", don't expect seating anywhere near the ""gate"". Also, don't expect the plane to be anywhere close to the construction zone that you have to enter to catch a flight. For that, you leave the building and walk and walk through the same weather, mud and rain that you experienced getting into that building. I have no idea why any airline in the world would assume that this was anywhere close to acceptable. Over the last 40 years, I have been flying with poor airlines into poor airports, but this is absolutely the worst and most unbelievable experience. For sure the last time that I flew with Delta Airlines, which is the only airline expecting their customers to accept walking through a muddy construction zone to use their ""service"". Absolutely pathetic.",,"{'Experience At Airport': 'Arrival and Departure', 'Date Visit': 'February 2022', 'Type Of Traveller': 'Business', 'Queuing Times': 3, 'Terminal Cleanliness': 1, 'Terminal Seating': 1, 'Terminal Signs': 2, 'Food Beverages': 2, 'Airport Shopping': 1, 'Airport Staff': 1, 'Recommended': 'no'}"
2021-11-13,6,10,"""the design of the Terminal D is dreadful""",Blaise Hancock,"Not Verified |  While pretty, the design of the Terminal D is dreadful if you are a human who has to walk the half mile to the last gate. And if you forget, or need to use a restroom after you get to the gate, be prepared to hike back that half mile! Further sadness is the design flaw of the expansive windows. Pretty views, but no overhang and poor window tinting means I left the airport sunburned and sweating from the greenhouse-effect heat! Sunburned from sitting inside an airport? Crazy, but true. Lastly, LaGuardia is now the most expensive airport in the world to get a snack, try the $6 bottle of orange juice (that costs $0.50 wholesale, and $4 at other airports). Shame on NYC and Skanska Design.",,"{'Experience At Airport': 'Departure Only', 'Date Visit': 'November 2021', 'Type Of Traveller': 'Business', 'Queuing Times': 3, 'Terminal Cleanliness': 5, 'Terminal Seating': 5, 'Terminal Signs': 3, 'Food Beverages': 1, 'Airport Staff': 2, 'Recommended': 'no'}"
2021-09-17,5,10,"""is still very much a work in progress""",B Webster,✅ Trip Verified | It was the last leg of a long day traveling from JAC. The airport is undergoing a multi billion dollar renovation and is still very much a work in progress. Eating and shopping options are somewhat limited compared to other airports I was at on this trip. I was too tired and hungry to go exploring. There was only one monitor to check for departing flights at the far end of the C concourse. This was frustrating as my departure gate changed twice. The departing flight was stuck on the tarmac for about 45 minutes due to Air Traffic. Who knew that a late night departure from LaGuardia could get delayed waiting to take off?,,"{'Experience At Airport': 'Transit', 'Date Visit': 'September 2021', 'Type Of Traveller': 'Solo Leisure', 'Queuing Times': 4, 'Terminal Cleanliness': 3, 'Terminal Seating': 4, 'Terminal Signs': 1, 'Food Beverages': 3, 'Airport Staff': 4, 'Recommended': 'no'}"
2021-04-19,4,10,"""I was totally disappointed""",Debbie Sherrie,"✅ Trip Verified | I realize the renovation is not complete - but I am so disappointed that the layout doesn't seem to consider people who are not 20-30 somethings or athletes. The corridors going to the gates are excessively long and I see no plans for moving sidewalks. I am a ""normal"" 50 something with no disabilities and still found it to be a trek. If you're going to do something, why not do it right? I was totally disappointed. Nice advertising, nice fountain but really, I like convenience most.",,"{'Experience At Airport': 'Arrival and Departure', 'Date Visit': 'April 2021', 'Type Of Traveller': 'Solo Leisure', 'Queuing Times': 4, 'Terminal Cleanliness': 4, 'Terminal Seating': 4, 'Terminal Signs': 4, 'Food Beverages': 0, 'Recommended': 'no'}"
2020-09-27,8,10,"""TV’s are deafening""",B Bruce ,"✅ Trip Verified | TV’s are deafening. Not all of us need to anesthetized by useless news. Make some quiet sections. Other then that, the terminal has improved immensely.",yes,"{'Experience At Airport': 'Departure Only', 'Date Visit': 'September 2020', 'Type Of Traveller': 'Couple Leisure', 'Queuing Times': 4, 'Terminal Cleanliness': 5, 'Terminal Seating': 5, 'Terminal Signs': 5, 'Food Beverages': 5, 'Airport Shopping': 4, 'Wifi Connectivity': 4, 'Airport Staff': 4, 'Recommended': 'yes'}"
2019-11-14,3,10,"""Worst shuttle service I have ever seen""",Aaron Mailhot,"Not Verified |  Worst shuttle service I have ever seen, out of many, and I want to stress up front that there was zero hustle in the the service people involved with the unacceptably-long shuttle time. My wife and I arrived at a high-numbered (no letter) gate and saw that we needed to get to gate 'D2'. After looking around in confusion and almost following a sign for D gate departures OUT of the airport, we figured out there was a shuttle between terminals (no signs for it that I saw). After a short walk, we got to a waiting line of shuttle passengers, some of which it sounded like they were waiting many minutes more. Another ten minutes later we were finally got on the shuttle, which took another ten plus minutes to get to our gate. Fortunately we had a reasonably-long layover to work with so we made our flight, another shuttle passenger was not so lucky. Also, at our gate the seating was very poorly laid out and cramped, yay. At least the staff at that gate showed some hustle to get us on the plane which was appreciated, my heart goes out to them.",,"{'Experience At Airport': 'Arrival and Departure', 'Date Visit': 'November 2019', 'Type Of Traveller': 'Couple Leisure', 'Queuing Times': 2, 'Terminal Cleanliness': 4, 'Terminal Seating': 2, 'Terminal Signs': 1, 'Food Beverages': 3, 'Airport Staff': 3, 'Recommended': 'no'}"
2019-10-20,1,10,"""will gladly pay more money to not stop at LGA""",J Pearce,"Not Verified |  The worst airport experience I have had. Every flight to and from were delayed. They are clearly overbooking flights and can't handle the traffic. I missed my connection and have to pay for the hotel out of pocket because it was ""air traffic control"" issues and not weather related. They should't take in more flights than they're capable of handling. It took 45 mins to take a shuttle to go 2 terminals over because theres no traffic control for cars/buses. There so signs or info for which bus to take. The ""bus stops"" were overflowed with people waiting. And no help directing people. I will gladly pay more money to not stop at LGA.",,"{'Experience At Airport': 'Arrival and Departure', 'Date Visit': 'October 2019', 'Type Of Traveller': 'Solo Leisure', 'Queuing Times': 1, 'Terminal Cleanliness': 2, 'Terminal Seating': 1, 'Terminal Signs': 1, 'Food Beverages': 2, 'Wifi Connectivity': 2, 'Airport Staff': 2, 'Recommended': 'no'}"
2019-09-24,1,10,"""easily the worst of them all""",Jim Shan,"Not Verified |  
I would say it is a third world experience but that is unfair to underdeveloped countries. I have been to plenty of airports around the world and LGA is easily the worst of them all. The traffic situation is a disaster and only gets worse. It never improves. This airport should be avoided if at all possible.",,"{'Experience At Airport': 'Arrival Only', 'Date Visit': 'September 2019', 'Type Of Traveller': 'Business', 'Queuing Times': 1, 'Terminal Cleanliness': 2, 'Terminal Seating': 3, 'Terminal Signs': 2, 'Food Beverages': 3, 'Recommended': 'no'}"
2019-09-18,2,10,"""disgustingly filthy""",MaryAnn May,"Not Verified | Absolutely disgustingly filthy. Food and wrappers on floors and seats. Sticky armrests. Badly stained carpets. The concourse of arrival Monday, September 16, for flt 5469 Delta from YUL and departure # 3300 Delta to GRR were awfully uncared for. Several ""cleaners"" were there but not doing their jobs anything more than chatting. It was very disappointing as Delta has certainly lowered the bar for service/customer care. Also, the wheelchair was stained. You are asking for health problems with such inattention to hygiene. Is it incorrect to expect workers to work? Look presentable? Attend to expectations of cleanliness? Or am I just too old school?",,"{'Experience At Airport': 'Arrival and Departure', 'Date Visit': 'September 2019', 'Type Of Traveller': 'Solo Leisure', 'Queuing Times': 2, 'Terminal Cleanliness': 1, 'Terminal Seating': 1, 'Terminal Signs': 2, 'Food Beverages': 2, 'Airport Staff': 1, 'Recommended': 'no'}"
2019-08-29,1,10,"""food options were pathetic""",Tanya Broussard,"✅ Trip Verified | This is by far the worst airport that I have ever had the displeasure of “visiting.” No one could tell us which gate our plane would be arriving at. It took over an hour of us walking around, asking every Delta employee to eventually know where we were to go. The food options were pathetic: almost every stand had the same pre-made sandwiches sitting around for purchase. But the worst of all was the hot serve-your-self options that were placed under heating lamps in the middle of walkways. Passing travelers were free to touch and stir the food trays, but most did not even buy! All I could think about was the massive amount of global germs that would be deposited in each dish! To make matters even more depressing was the pan handle-like atmosphere where airport employees were harassing travelers to sign up for American Express credit cards. Some became indignant when we refused due to time restraints. One told me, “Ahh, come on, you got time, your plane isn’t leaving until 2.00!” Sadly, however, he or no one else, would help us locate our gate. My husband and I had to be detectives and do our own footwork to locate our plane’s eventual arrival gate. Finally, the “icing on the cake” would be the rock-hard stale doughnuts I purchased out of desperation after throwing away my pricey, cold, bland ham and cheese sandwich encased in a soggy roll, layered with smooshed tomatoes and wilted lettuce! Imagine eating that mess of a meal while looking at the horribly stained and filthy grey carpet and praying that you are hopefully at the right gate of departure. I say throw the whole airport away and start again. We, the customers, deserve a whole lot better.",,"{'Experience At Airport': 'Departure Only', 'Date Visit': 'August 2019', 'Type Of Traveller': 'Family Leisure', 'Queuing Times': 1, 'Terminal Cleanliness': 1, 'Terminal Seating': 1, 'Terminal Signs': 1, 'Food Beverages': 1, 'Airport Shopping': 1, 'Wifi Connectivity': 3, 'Airport Staff': 1, 'Recommended': 'no'}"
2019-08-18,3,10,"""avoid LGA no matter""",J Trump,Not Verified |  We arrived 1.5 hours before our flight. We spent 30 minutes in line to check in with United and the next 40 minutes getting through TSA. It was 4:45am on a Sunday morning. We barely made the gate before they closed it. I am not sure how an airport can operate so inefficiently. Lesson learned. It is worth an extra amount of money to avoid United at all costs and to fly JFK and avoid LGA no matter how good a deal it may be.,,"{'Experience At Airport': 'Departure Only', 'Date Visit': 'August 2019', 'Type Of Traveller': 'Family Leisure', 'Queuing Times': 1, 'Terminal Cleanliness': 1, 'Terminal Seating': 1, 'Terminal Signs': 5, 'Food Beverages': 0, 'Airport Staff': 1, 'Recommended': 'no'}"
2019-08-12,2,10,"""never go to this airport again""",Ryan Withrow,"✅ Trip Verified |  My 18 year old son and two 17 year old friends were at Lagardia this morning over three hours before flight. The security check-in line was very long. After over 1 hour they got to the metal detectors and were told the phone or phone scanners were down and told the boys they would need to go get a paper ticket printed. They did this and of course by then the flight had departed. The airline would not help our boys and they are right now stranded in New York. We have scrambled to get them a hotel. This is shameful, and would never go to this airport again.",,"{'Experience At Airport': 'Departure Only', 'Date Visit': 'August 2019', 'Type Of Traveller': 'Family Leisure', 'Queuing Times': 1, 'Terminal Cleanliness': 1, 'Terminal Seating': 1, 'Terminal Signs': 1, 'Food Beverages': 1, 'Airport Shopping': 1, 'Wifi Connectivity': 1, 'Airport Staff': 1, 'Recommended': 'no'}"
