datePublished,ratingValue,bestRating,header,author,reviewBody,recommended,stats
2024-09-09,2,10,"""needs to improve the quality""",E Brown,Not Verified |  Leaving travelers sitting in the tarmac for over an hour when there is no weather on site after a cross country flight is not acceptable. We can see the weather now rolling on meaning this hour will be extended further escalating aggravation onboard. The airline was quick to clear us as landed in their system to give the facade of a timely travel experience but that is a complete fabrication of the truth. MCO needs to improve the quality of the experience for a city that is supposed to be welcoming of its travelers.,,"{'Experience At Airport': 'Arrival Only', 'Date Visit': 'September 2024', 'Type Of Traveller': 'Solo Leisure', 'Queuing Times': 1, 'Terminal Cleanliness': 2, 'Terminal Seating': 2, 'Terminal Signs': 3, 'Food Beverages': 2, 'Airport Shopping': 1, 'Wifi Connectivity': 3, 'Airport Staff': 3, 'Recommended': 'no'}"
2024-07-06,1,10,“I loathe this place”,S Warner,"Not Verified | Why is MCO getting worse with each passing week? As a frequent flyer, out of all three terminals, across several carriers, this airport is pathetic. Between the sheer lack of on site parking, the lack of employees that speak English and unimaginably poor ground service, I loathe this place. I will do anything I can to avoid checking a bag because I know I am in for a minimum of a 30 minute wait at baggage claim. That’s on a good day. The wait for a gate to taxi to, the wait for a jet way brought to the plane, then the incredible, inevitable wait at baggage. Carry on only isn’t always an option for me. As one waits, the announcements are made at times only in Spanish, but when they do make it in English, usually secondary to the Spanish, it’s incomprehensible. Listen at any baggage claim, you’ll hear passengers complaining about them. After a ridiculous wait, when you finally get your bag, it’s smash to bits. Every.Single.Time. Of every airport I travel, world wide, my home airport, MCO, is a disaster.",,"{'Experience At Airport': 'Arrival Only', 'Date Visit': 'June 2024', 'Type Of Traveller': 'Family Leisure', 'Queuing Times': 2, 'Terminal Cleanliness': 2, 'Terminal Seating': 1, 'Terminal Signs': 2, 'Food Beverages': 2, 'Airport Shopping': 1, 'Wifi Connectivity': 1, 'Airport Staff': 1, 'Recommended': 'no'}"
2024-05-16,1,10,"""TSA women are horrible""",H Tyler,"Not Verified |   The TSA women are horrible with no manners. They should be saying “thank you for visiting, come back again”. Instead they tell me this is not Universal this is Orlando International Airport when I’m going through the scanner. They speak harshly to some and are nice to some. Second time departing Orlando and they tell me I have something between my legs. They told me either they feel me all over in front of everyone or they take me to a room to strip down. Mind you I’m traveling with a small child. They really need to learn courtesy and be more polite. Is this how they are being trained? This is the Jet Blue TSA ; one had gray hair and the other had red short hair. They picked up my sun screen in my carryon but not the big Fuji bottle in my son’s bag smh. So much for checking and security!",,"{'Experience At Airport': 'Departure Only', 'Date Visit': 'April 2024', 'Type Of Traveller': 'Family Leisure', 'Queuing Times': 3, 'Terminal Cleanliness': 5, 'Terminal Seating': 4, 'Terminal Signs': 3, 'Food Beverages': 4, 'Airport Shopping': 3, 'Wifi Connectivity': 3, 'Airport Staff': 1, 'Recommended': 'no'}"
2024-05-13,1,10,"""does not have enough parking spaces""",Jose Ammirabile,"Not Verified |   My wife arrived on Flight AD8706 arrived 6PM sharp and my wife only left the luggage's/immigration at 7:50. Between the airplane get the finger, luggage available, it took 1 hour and 40 minutes. Immigration was quick. Also the terminal does not have enough parking spaces for it's current operations. This was the third time parking A and C where closed and I had to park elsewhere. Luckily I learned how to park at train station and walked 20 minutes to airport C, avoiding a 30 minutes walking from B parking to C.",,"{'Experience At Airport': 'Arrival Only', 'Date Visit': 'May 2024', 'Type Of Traveller': 'Couple Leisure', 'Queuing Times': 1, 'Terminal Cleanliness': 4, 'Terminal Seating': 4, 'Terminal Signs': 1, 'Food Beverages': 1, 'Airport Staff': 2, 'Recommended': 'no'}"
2024-05-08,4,10,"""Very far behind the times""",B Warner,"✅ Trip Verified |  This airport has a extremely large number of visitors. Ground transport and flow to and from are fine. Concessions facilities and restaurants are far and few between 1 sit down bar restaurant for many gates waiting lines everywhere, all facilities both male and female have long lines. Very far behind the times, would rather fly to any other airport in they area.",,"{'Experience At Airport': 'Arrival and Departure', 'Date Visit': 'May 2024', 'Type Of Traveller': 'Business', 'Queuing Times': 3, 'Terminal Cleanliness': 3, 'Terminal Seating': 2, 'Terminal Signs': 3, 'Food Beverages': 1, 'Airport Shopping': 1, 'Airport Staff': 1, 'Recommended': 'no'}"
2024-04-16,3,10,"""continues to get worse and worse""",Kimberly White,"Not Verified |   I live in Orlando, so use this airport frequently. I don't know what is happening but it continues to get worse and worse. I flew internationally for holiday and returned last evening (April 15th). I left out of Terminal A and returned to Terminal C. I parked in North Lot. Apparently you can take a shuttle from C to the South Lot but not the North Lot. WHY? So I had to take a shuttle to Terminal A to then take another shuttle to my vehicle in North Lot. The shuttle took forever to arrive to C. I saw other shuttles (Mears, off site parking etc) circle two or three times while I waited for the shuttle to take me to A. When it did arrive, me and other other 3 passengers all informed him we were going to A, however he dropped us at Terminal B and told us that was his only stop. So I then had to drag my luggage across the airport to get to Terminal A to catch the next shuttle. That shuttle arrived slightly faster, however the driver didn't even get out of his seat to help any of the passengers board. He just sat there staring at us. A nice passenger helped me load my luggage onboard. I had asked a couple people in the airport how to get where i was going and one girl actually told me ""it wasn't her job to answer that question"". When I did get to my vehicle and went to pay and leave the attendant couldn't have been any more annoyed that I was trying to pay her. She barely could extend her arm to take my payment and seemed severely pissed off she had to actually perform a function. I traveled to three countries and therefore three airports and am sadly embarrassed how our city is represented with regard to our airport. After customs and retrieving my bags, it took me 2 hours to get to my vehicle last night which is horrible. Why is there no shuttle to North Lot from C? Why doesn't the shuttle that is supposed to take you to A not actually take you to A? Why are the workers so rude and unhelpful. Really poor on MCO's part.",,"{'Experience At Airport': 'Arrival and Departure', 'Date Visit': 'April 2024', 'Type Of Traveller': 'Solo Leisure', 'Queuing Times': 2, 'Terminal Cleanliness': 3, 'Terminal Signs': 2, 'Food Beverages': 0, 'Airport Staff': 1, 'Recommended': 'no'}"
2024-03-28,2,10,"""Worst wheelchair assistance""",Nancy Willis,"Not Verified |  Worst wheelchair assistance experience ever. Attendant assigned to me did not speak enough English to understand my needs, ended up parking me off to the side and walked away!",,"{'Experience At Airport': 'Arrival Only', 'Date Visit': 'March 2024', 'Type Of Traveller': 'Solo Leisure', 'Queuing Times': 1, 'Terminal Cleanliness': 1, 'Terminal Seating': 1, 'Terminal Signs': 1, 'Wifi Connectivity': 1, 'Airport Staff': 3, 'Recommended': 'no'}"
2023-11-08,1,10,"""the worst airport experience""",Jim Campbell,"Not Verified |  This was the worst airport experience in my life. Very Rude People. Very Few Facilities.  The public announcements were a joke and they were being read like it a joke by a person who sounded about 10 years old. They kept repeating that people are not allowed to use phones in the terminal, and yet looking around guess what, everyone is on their phones because that's what travellers need to do! Being asked to pay $30 for a baggage trolley. (£1 in the UK). Massive queues for the immigration lanes - we waited for over 2 hours. This terminal is very badly designed. No opportunity to purchase any refreshments and no seats. There are no shops whatsoever in the airport on the way to the hire car. (we rented a villa so a shop would have been really handy) Outbound - Similar experience, very few shops and no opportunity to buy any duty free. Encountered extremely rude & cranky TSA operatives. I ended up getting angry myself at the way I was being shouted at and left my iPad/tablet behind. It would have been fine but the tray with this item ended up on a different conveyer belt and I didn't realise I'd left it behind until I was on the flight. To add insult to injury, MCO Lost and Found have said the only option to get my item returned will cost me $349 via UPS. This is an absolute joke as the UPS website quotes me a fraction of this price. The item itself is worth about $150. When you consider MCO auctions thousands of lost electrical items for profit (ggauctionsonline.net), this little operation seems to be lining somebody's pockets at MCO. I had high hopes for this visit but I never dreamt I'd end up being financially exploited by the richest country in the world.",,"{'Experience At Airport': 'Arrival and Departure', 'Date Visit': 'October 2023', 'Type Of Traveller': 'Family Leisure', 'Queuing Times': 1, 'Terminal Cleanliness': 5, 'Terminal Seating': 1, 'Terminal Signs': 1, 'Food Beverages': 1, 'Airport Shopping': 1, 'Wifi Connectivity': 1, 'Airport Staff': 1, 'Recommended': 'no'}"
2023-10-29,1,10,"""staff and TSA were crotchety"" ",S Danes,"✅ Trip Verified |   The airport staff and TSA were crotchety, not at all helpful with my disabled family member either. A lady stands at the family and disabled TSA line entrance and basically gate keeps it. We explained we had an autistic family member and she still tried to deny us access, she was so rude. Not at all up on the TSA cares policy in the least!  Do not recommend. Oh but don't worry they gave me a sunflower lanyard that no one paid any attention to.",,"{'Experience At Airport': 'Arrival and Departure', 'Date Visit': 'October 2023', 'Type Of Traveller': 'Family Leisure', 'Queuing Times': 3, 'Terminal Cleanliness': 5, 'Terminal Seating': 5, 'Terminal Signs': 5, 'Food Beverages': 5, 'Wifi Connectivity': 5, 'Airport Staff': 1, 'Recommended': 'no'}"
2023-09-25,9,10,"""a big improvement on previous visits""",P Robertson,"✅ Trip Verified | Arrival and departure into the new Terminal C at MCO. I have to say it was terrific. Through immigration in 10 minutes and into a rental car 15 min after that. Departure was equally as good. No Queues at security and a good selection of Eating places, including Shake shack. We only had hand luggage which is important to state, but it was a big improvement on previous visits.",yes,"{'Experience At Airport': 'Arrival and Departure', 'Date Visit': 'September 2023', 'Type Of Traveller': 'Family Leisure', 'Queuing Times': 5, 'Terminal Cleanliness': 5, 'Terminal Seating': 4, 'Terminal Signs': 5, 'Food Beverages': 5, 'Airport Shopping': 3, 'Wifi Connectivity': 4, 'Airport Staff': 3, 'Recommended': 'yes'}"
2023-09-21,1,10,"""Shockingly poor from start to finish""",Kerry May,"✅ Trip Verified |  Shockingly poor from start to finish. Could not disembark on arrival as ground crew had a problem with connecting equipment - about 30 minutes extra. Allegedly only ‘one belt’ was working for baggage - waited 2 hours with lack of seating, people lying on the floor etc waiting to get bags. We asked if our elderly parents could go through passport control and get a seat, while we waited for the luggage. We were told yes, this would be fine. Then when our parents attempted to do this they were spoke to in a demeaning tone and said they couldn’t do this. Totally understand that things can go wrong in any industry, but a timely, consistent and courteous approach are some of the best ways of dealing with problems and maintaining or improving customer relationships and experiences. Orlando Airport is the worst airport I have ever had to use.",,"{'Experience At Airport': 'Arrival Only', 'Date Visit': 'September 2023', 'Type Of Traveller': 'Family Leisure', 'Queuing Times': 1, 'Terminal Cleanliness': 2, 'Terminal Seating': 1, 'Terminal Signs': 1, 'Food Beverages': 1, 'Airport Shopping': 1, 'Wifi Connectivity': 1, 'Airport Staff': 1, 'Recommended': 'no'}"
2023-09-18,1,10,"""get some real seating please""",D Mayne,"✅ Trip Verified |  I have unfortunately had to travel to or through MCO with some frequency over the years and it is always chaotic and the employees have no sense of urgency. To get through the line to have baggage checked by security can take very little time but the screening process takes forever if they have to pull your bags. It requires a supervisor who has led feet and all slow the process down and make things annoyingly tedious. There were 4 people in wheelchairs awaiting their baggage for almost a half hour while I and 4 others were also waiting for someone to expedite the process of opening and checking bags.  Service is slow all over, there is nowhere to sit and when you do find a seat it’s covered in crumbs, old turkey and goo from the 1980s. No where to charge your phone or get work done. Not business friendly whatsoever.  No retail spaces to pass the time. Folks sitting on the floors everywhere you look. The only pluses are that’s it’s usually cheap, car rental return is easy and the tram always seems pretty clean. Just get some real seating please.",,"{'Experience At Airport': 'Arrival and Departure', 'Date Visit': 'September 2023', 'Type Of Traveller': 'Business', 'Queuing Times': 2, 'Terminal Cleanliness': 1, 'Terminal Seating': 1, 'Terminal Signs': 3, 'Food Beverages': 1, 'Airport Shopping': 1, 'Wifi Connectivity': 2, 'Airport Staff': 1, 'Recommended': 'no'}"
2023-08-15,1,10,"""a consistently poor experience""",Andrew Addison,"Not Verified |  One of the worst tourist airports I have visited. Over two hours for baggage to be retrieved on arrival and then an incredibly slow departure from the airport as you pass through customs. On departure, only 2 out of 12 security lines open (in the middle of the day) which resulted in over an hour queue to exit. This is my third trip through Orlando airport in the last four months and it’s a consistently poor experience every time.",,"{'Experience At Airport': 'Arrival and Departure', 'Date Visit': 'August 2023', 'Type Of Traveller': 'Family Leisure', 'Queuing Times': 1, 'Terminal Cleanliness': 4, 'Terminal Seating': 2, 'Terminal Signs': 2, 'Food Beverages': 1, 'Airport Shopping': 1, 'Wifi Connectivity': 4, 'Recommended': 'no'}"
2023-07-16,3,10,"""Very poor service""",Wayne Johnson,"Not Verified | The TSA was very rude and did not treat people as customers. They were confused about what they wanted you to do, and then they started yelling at people. Very poor service!",,"{'Experience At Airport': 'Arrival and Departure', 'Date Visit': 'July 2023', 'Type Of Traveller': 'Couple Leisure', 'Queuing Times': 4, 'Terminal Cleanliness': 2, 'Terminal Seating': 1, 'Terminal Signs': 4, 'Food Beverages': 4, 'Airport Shopping': 2, 'Wifi Connectivity': 1, 'Airport Staff': 1, 'Recommended': 'no'}"
2023-07-06,1,10,"""no direct customer service number""",LaVonda Conyers,Not Verified | This is the worst Airport ever! My son was scheduled to depart from there last night when his flight was delayed. Then they got on the next flight but it left the gate only to return back to the airport. They were told that they were going to have to board a different flight due to something with the plane. Only to find out that they wouldn't be able to board another flight departing until Saturday. The airline nor airport would accommodate them in no way. I have been calling since last night until current leaving messages and getting the run around. This was my son 1st experience on a plane to celebrate his birthday and look what happens. There's no direct customer service number for the airline which doesn't make sense.,,"{'Experience At Airport': 'Arrival and Departure', 'Date Visit': 'July 2023', 'Type Of Traveller': 'Family Leisure', 'Queuing Times': 1, 'Terminal Cleanliness': 1, 'Terminal Signs': 1, 'Food Beverages': 0, 'Wifi Connectivity': 1, 'Airport Staff': 1, 'Recommended': 'no'}"
2023-06-14,2,10,"""Totally unacceptable service""",Christine Wood,"Not Verified | Upon arrival at Orlando the Customs were excellent and very quick, our luggage arrived very promptly too - we opted to take our luggage on the mono-rail with us and were out of the airport within 45 minutes - excellent service all round. We also Departed on 11th May, the departure was awful, our Virgin Check-in was faultless, the Security was AWFUL, so long and disorganised, its been like this for the last 22 years and never gets any better, very long queues and half the security lanes closed - why! (the staff though are lovely). When we got to the area where we departed from all the food areas were closed (9pm), our flight did not leave until 10.20 - Outback Steak House could not seat us as they only had 1 member of staff working, it was the same for the other outlet. The Duty Free, which is the worst Duty Free I have ever seen, no stock at all also shut at 9pm! If you have flights going out with 100's of people of those flights you should have some outlets open to feed them, the lounges close at 9pm too. Totally unacceptable service.",yes,"{'Experience At Airport': 'Arrival and Departure', 'Date Visit': 'April 2023', 'Type Of Traveller': 'Couple Leisure', 'Queuing Times': 2, 'Terminal Cleanliness': 4, 'Terminal Seating': 4, 'Terminal Signs': 4, 'Food Beverages': 1, 'Airport Shopping': 1, 'Wifi Connectivity': 5, 'Airport Staff': 5, 'Recommended': 'yes'}"
2023-06-11,1,10,"""Restrooms outdated and small""",B Terry,Not Verified |  Restrooms outdated and small. Staff is slow and unwilling to help. Security lines can be up to a mile. Limited seating at the gates. Expect to walk a lot navigating terminals and the trams.,,"{'Experience At Airport': 'Arrival and Departure', 'Date Visit': 'June 2023', 'Type Of Traveller': 'Family Leisure', 'Queuing Times': 1, 'Terminal Cleanliness': 4, 'Terminal Seating': 1, 'Terminal Signs': 2, 'Food Beverages': 3, 'Airport Shopping': 3, 'Wifi Connectivity': 2, 'Airport Staff': 1, 'Recommended': 'no'}"
2023-06-05,2,10,"""never experienced a new terminal as bad as this""",Joel Gorn,Not Verified |  I have never experienced a new terminal as bad as this. You have to walk half a mile up hill to get to baggage claim after a long flight. I saw people stopped and hyperventilating. Then the wait for bags is absurdly long. I am not quite sure if they have more than a few people unloading planes. Then the border patrol guy gave me a lecture on how wonderful Florida is because you don’t pay income tax. I see what not paying income tax does to infrastructure. Then rechecking bags is confusing and unclear. Overall I give the new MCO a D minus.,,"{'Experience At Airport': 'Arrival and Departure', 'Date Visit': 'June 2023', 'Type Of Traveller': 'Solo Leisure', 'Queuing Times': 1, 'Terminal Cleanliness': 3, 'Terminal Seating': 4, 'Terminal Signs': 1, 'Food Beverages': 3, 'Airport Shopping': 1, 'Airport Staff': 2, 'Recommended': 'no'}"
2023-05-28,2,10,"""Marathon walk to bag claim""",Nancy Krug,"✅ Trip Verified |  As a frequent flyer and Orlando area resident, I was flabbergasted by the impoverished appearance and user unfriendliness of this brand new terminal C. Plain, unadorned beige walls. Shockingly scuffed and marred floors. Crudely finished bathroom floor. Marathon walk to bag claim. It looked like a low bid renovation of a bus terminal. The huge ceiling height and skylights made me wonder about cooling costs. I felt bad for my fellow travelers, walking the long distances after a 10 hour flight, undistracted by color, design, or assistance. I appreciated the airport ambassador who directed us, and the courteous passport control folks. However, I am shocked by this building, and embarrassed for the image of Orlando that it gives to visitors to the City Beautiful.",,"{'Experience At Airport': 'Arrival Only', 'Date Visit': 'May 2023', 'Type Of Traveller': 'Couple Leisure', 'Queuing Times': 3, 'Terminal Cleanliness': 2, 'Terminal Signs': 3, 'Food Beverages': 0, 'Airport Staff': 4, 'Recommended': 'no'}"
2023-05-22,2,10,"""new terminal is terrible""",Jeannette Green,"Not Verified | The new terminal in Orlando is terrible. Lines are long, service is lacking and rude, the building is very big and confusing. Took almost an hour to get our luggage and then we had to wait another 10+ minutes to get a walker (brought from somewhere else - it was on the same plane). Will not book any MCO flights in the future with any carrier in that terminal.",,"{'Experience At Airport': 'Arrival and Departure', 'Date Visit': 'May 2023', 'Type Of Traveller': 'Couple Leisure', 'Queuing Times': 1, 'Terminal Cleanliness': 3, 'Terminal Seating': 3, 'Terminal Signs': 3, 'Food Beverages': 0, 'Airport Staff': 1, 'Recommended': 'no'}"
2023-05-21,1,10,"""Wait times are insane""",O  Carr,✅ Trip Verified | Wait times are insane. People arriving 2+ hours early were missing flights left and right because security lines were taking more than an hour and 15 minutes. We made our flight with 30 seconds to spare after SPRINTING through the airport.,,"{'Experience At Airport': 'Departure Only', 'Date Visit': 'May 2023', 'Type Of Traveller': 'Family Leisure', 'Queuing Times': 1, 'Terminal Cleanliness': 5, 'Terminal Signs': 5, 'Food Beverages': 0, 'Airport Staff': 1, 'Recommended': 'no'}"
2023-05-16,4,10,"""Our luggage took one hour to arrive""",Sam Healey,Not Verified |  We arrived at Orlando via Terminal C which is the terminal BA and Aer Lingus to name but two now use for their flights. On arrival we had to go upwards via a sloped incline to arrive at an upper level where a sign indicated how far it was to baggage reclaim (it stated an 8 minute walk). This is not at all accurate for families with small children or for anyone with any sort of mobility issue. There are no moving walkways of any kind or seating prior to arriving into the baggage reclaim area prior to entering immigration/passport control. Our luggage that day took one hour to arrive; this was due to inclement weather and problems with unloading the aircraft. Some of the TSA staff at departures could benefit from more training in customer relations. Airside area is clean and has a few shops and eating places in it prior to arrival at the gate area. Be prepared for a long walk to your flight if your gate for this is at the end of the corridor.,yes,"{'Experience At Airport': 'Arrival and Departure', 'Date Visit': 'May 2023', 'Type Of Traveller': 'Family Leisure', 'Queuing Times': 4, 'Terminal Cleanliness': 4, 'Terminal Seating': 2, 'Terminal Signs': 3, 'Food Beverages': 3, 'Airport Shopping': 3, 'Wifi Connectivity': 4, 'Airport Staff': 2, 'Recommended': 'yes'}"
2023-05-13,2,10,"""worst to spend any time in at all""",Cindy Wagoner,"Not Verified |  Of all the airports, this is the worst to spend any time in at all. NO working outlets for charging phones or electronics. Restrooms for women require long waits and today was relatively clean, but in the past has not been good at all. Limited food vendors and few choices. I avoid this airport whenever possible and really wish it was traveler friendly. People sitting on the floor because there are not enough seats. Queue lines in the walkway that makes it difficult to move around.",,"{'Experience At Airport': 'Transit', 'Date Visit': 'May 2023', 'Type Of Traveller': 'Business', 'Queuing Times': 1, 'Terminal Cleanliness': 2, 'Terminal Seating': 1, 'Terminal Signs': 2, 'Food Beverages': 1, 'Airport Shopping': 1, 'Wifi Connectivity': 3, 'Airport Staff': 1, 'Recommended': 'no'}"
2023-05-10,1,10,"""absolute worst airport experience""",Laura Carpenter,"Not Verified |  Who designed this monstrosity? This is the absolute worst airport experience I've ever had, and the absolute worst at MCO. We arrived yesterday at Terminal C from a British Air 9-hour flight. We were met with an uphill incline (and we had baggage with us). We are in our 70s and had to stop several times to catch our breath. Besides the steep incline, this is very antiseptic looking. Once I regained my breathing, I thought to myself that if I were a first-time traveler to the United States, I'd want to turn around and go home. Took a long time to get baggage, but we were on a large plane. Our plane arrived early at 6:25 pm, and our ticket said 6:50 arrival. We had family coming to pick us up, and they had to keep circling around. We left Terminal C around 7:30 pm. Absolutely ridiculous. Worst news for me is that I'm scheduled to fly Icelandair in November, and I'll be dreading that arrival for the next several months. Invest a buck or two, people! Install some escalators!",,"{'Experience At Airport': 'Arrival Only', 'Date Visit': 'May 2023', 'Type Of Traveller': 'Couple Leisure', 'Queuing Times': 1, 'Terminal Cleanliness': 3, 'Terminal Signs': 2, 'Food Beverages': 0, 'Airport Staff': 3, 'Recommended': 'no'}"
