datePublished,ratingValue,bestRating,header,author,reviewBody,recommended,stats
2019-01-14,1,10,"""unpleasant arrival experience""",A Jonas,"✅ Trip Verified | Most unpleasant arrival experience in my life. Arrived at 10 pm on January the 7th from Panama and went directly to immigration line (visitors). Very disappointed to see that there were only 2 agents allocated for our line, while that line for locals had more than 7 agents. As a result it took us more than 1:30h to pass the immigration controls. Then, they took me to the customs office with the excuse of having a common name (they didn't provide more explanations but the way the agent explained didn't sound very convincing, besides it was the first time that it happened to me in US territory). Time spent in the office, 30 minutes. After the office I finally got to pick my lugagge, only to discover that it had to go through a 2nd security check and that we had to pick it in another terminal. Sadly when we got to the pick up terminal, part of the lugagge didn't come out. Nobody from the airport or airline was present to assist us. I asked to another passenger in the same situation and he told me that this messy inconvenient was really normal in the airport. We sat for more than 1 hour besides the belts, until the last bag finally came out. It took me 3 hours to fly from Panama to Orlando and incredibly it took me more than 4 hours to try to go out of the Airport. These guys have no idea of customer experience. I know security is a priority but it doesn't give them the right to provide such a poor service. If I don't know how to treat my guests I simply don't invite them.",,"{'Experience At Airport': 'Arrival Only', 'Date Visit': 'January 2019', 'Type Of Traveller': 'Couple Leisure', 'Queuing Times': 1, 'Terminal Cleanliness': 5, 'Terminal Signs': 5, 'Food Beverages': 4, 'Recommended': 'no'}"
2019-01-10,1,10,"""TSA are disgusting""",Rhonda Sihocky,✅ Trip Verified | TSA are disgusting and dehumanizing. This pig of a women was pounding on the plastic barricade and bellowing to people to move up a few inches. I was traveling for work so I had no choice. This is unacceptable.,,"{'Experience At Airport': 'Departure Only', 'Date Visit': 'January 2019', 'Type Of Traveller': 'Business', 'Queuing Times': 1, 'Terminal Cleanliness': 1, 'Terminal Signs': 1, 'Food Beverages': 0, 'Recommended': 'no'}"
2019-01-07,4,10,"""it is horribly outdated""",T Nicks,"Not Verified |  We arrived later in the evening. Our plane was delayed, so we got something to eat in the main terminal. I'm glad we did, because there were few options near our gate. Because we ate first, security was short (it was horribly long before we ate). My biggest issue is that for an international airport at a major tourist destination, it is horribly outdated. For us, specifically, it is a huge lack of charging stations. We were at the gate 15 waiting area. In that area, there were 6 outlets, each with 2 outlets and 2 USB chargers. That makes a total of 24 people who can charge a device. Get with it. Most modern airports (we live in Denver and use DIA regularly, but have seen it at most other parts airports as well) have seats that charge, so every passenger has the opportunity to do so. In this information age, we all use our devices for everything from business, to email, to boarding passes, to transportation (Uber, etc.). We had been gone from our lodging most of the day and arrived with devices in need for charging. Do you have a plan for when a passenger arrives with an electronic boarding pass, but their phone dies before boarding because they couldn't charge it?",,"{'Experience At Airport': 'Departure Only', 'Date Visit': 'January 2019', 'Type Of Traveller': 'Family Leisure', 'Queuing Times': 4, 'Terminal Cleanliness': 4, 'Terminal Seating': 2, 'Terminal Signs': 3, 'Food Beverages': 2, 'Airport Shopping': 4, 'Wifi Connectivity': 5, 'Airport Staff': 5, 'Recommended': 'no'}"
2019-01-04,1,10,"""Avoid MCO at all cost""",M Johnson,"✅ Trip Verified | Absolutely horrendous experience going through Orlando International airport! During holiday season travel rush, the airport closed all TSA precheck lines and created massive queues, herding everyone into general security check lines. The staff were extremely incompetent and could not adequately direct the traffic or move the lines along. It was the absolutely worst security experience I have ever experienced of any airport, any country! Avoid MCO at all cost!",,"{'Experience At Airport': 'Departure Only', 'Date Visit': 'January 2019', 'Type Of Traveller': 'Solo Leisure', 'Queuing Times': 1, 'Terminal Cleanliness': 2, 'Terminal Seating': 1, 'Terminal Signs': 1, 'Food Beverages': 0, 'Wifi Connectivity': 3, 'Airport Staff': 1, 'Recommended': 'no'}"
2019-01-04,1,10,"""bathrooms filthy and smelly""",Mary Snow,"Not Verified | If I could give this airport a 0/10 I would. Driving into the airport required a toll road and most rental cars charge more without sun pass. When we finally made it into the airport the signs to return rental cars were quite confusing, we had to go around the entire airport to return our car, when we finally made it to the terminal. the TSA line was long. Food options were very limited and the bathrooms were filthy and smelly!!",yes,"{'Experience At Airport': 'Departure Only', 'Date Visit': 'January 2019', 'Type Of Traveller': 'Couple Leisure', 'Queuing Times': 1, 'Terminal Cleanliness': 1, 'Terminal Seating': 1, 'Terminal Signs': 1, 'Food Beverages': 1, 'Airport Shopping': 1, 'Wifi Connectivity': 1, 'Airport Staff': 1, 'Recommended': 'yes'}"
2019-01-04,5,10,"""no one cares about customer service""",Carlos Diaz,Not Verified | The customer service at Nathan's and Burger King on gates 60-99 are the worst customer I have ever received. More than 15 people on line to order and only one register open. The employees show that they do not care. Nathan's always runs out of food that’s in the menu daily and even forks. Looks like no one cares about customer service at those two locations.,yes,"{'Experience At Airport': 'Transit', 'Date Visit': 'January 2019', 'Type Of Traveller': 'Business', 'Queuing Times': 3, 'Terminal Cleanliness': 4, 'Terminal Seating': 5, 'Terminal Signs': 5, 'Food Beverages': 1, 'Airport Shopping': 3, 'Wifi Connectivity': 3, 'Airport Staff': 3, 'Recommended': 'yes'}"
2018-12-31,1,10,"""Waiting time, almost an hour""
",C Edwards,"Not Verified |  This is the third time that I have to wait so long for our baggage. That happened in July with Southwest and in December with Spirit and Frontier. Waiting time, almost an hour.",,"{'Experience At Airport': 'Arrival Only', 'Date Visit': 'December 2018', 'Type Of Traveller': 'Family Leisure', 'Queuing Times': 1, 'Terminal Cleanliness': 3, 'Terminal Signs': 3, 'Food Beverages': 0, 'Recommended': 'no'}"
2018-12-21,1,10,"""the most unfriendly airport""",Jason Brown,"✅ Trip Verified | Terrible signage, terminal train out of service, police officer unprofessional when asked a question. I have traveled 24 round trips this year and find Orlando to be the most unfriendly airport in my long travel history. You know when NY and NJ is better there is a real problem! It is very obvious no cares here, what a shame. At the end of the day one airport has to be the worst and it’s Orlando!",,"{'Experience At Airport': 'Arrival Only', 'Date Visit': 'December 2018', 'Type Of Traveller': 'Family Leisure', 'Queuing Times': 1, 'Terminal Cleanliness': 1, 'Terminal Seating': 2, 'Terminal Signs': 1, 'Food Beverages': 2, 'Wifi Connectivity': 1, 'Airport Staff': 1, 'Recommended': 'no'}"
2018-12-21,1,10,"""airport has done away with special assistance""
",B Kemp,"✅ Trip Verified | Three planes came in together and there was over 800 people in the immigration hall with three officers on. We saw people collapse and children were crying. We waited over two hours as this airport has done away with special assistance, my wife has muscular dystrophy and is in a wheelchair. We will never again fly into this airport. It’s appalling. What a horrendous way to treat your visitors. Virgin sent us a text before we arrived apologising for the wait in the immigration hall so obviously people had complained to them.",,"{'Experience At Airport': 'Arrival Only', 'Date Visit': 'December 2018', 'Type Of Traveller': 'Couple Leisure', 'Queuing Times': 1, 'Terminal Cleanliness': 1, 'Terminal Signs': 1, 'Food Beverages': 0, 'Recommended': 'no'}"
2018-11-14,3,10,"""there is no signage""",W Edwards,"✅ Trip Verified | Orlando International has two separate security check points in terminal B that are gate specific. Our boarding pass that we got printed a few minutes prior to going through security didn’t list a gate. Having not been to the airport before we just got into the first check point with our kids and all the carry-ons. It took about 20 minutes before we got to the TSA desk at which time they told us we had to leave and go to the other check point. We then waited in line another 20 minutes to get to the security screening in the second checkpoint line. Our complaint is that first the gate should be printed on the boarding pass as clearly the TSA counter had this information 20 minutes later. Second, there is no signage or employees going around checking to inform travelers they are in the right checkpoint. We all expect some wait at the airport but things like this are simply maddening! Further, when we talked to the TSA folks, they rolled their eyes like this is a very common thing and they wished it wasn’t that way. So my question is this, why isn’t the airport leadership taking this on as an issue to be corrected? Also, the gates for Delta were super crowded! We had to stand the entire time waiting to board, which isn’t easy with small children.",,"{'Experience At Airport': 'Arrival and Departure', 'Date Visit': 'November 2018', 'Type Of Traveller': 'Family Leisure', 'Queuing Times': 3, 'Terminal Cleanliness': 4, 'Terminal Seating': 1, 'Terminal Signs': 2, 'Food Beverages': 2, 'Airport Staff': 1, 'Recommended': 'no'}"
2018-11-10,1,10,"""the worst I have ever seen""",David Ellis,"Passport control at this airport is the worst I have ever seen on this planet bar none. Our plane landed from London at 5:50pm, the air bridge took 15 minutes to dock at the aircraft. Then we were told that the customs hall was overloaded and there would be a passenger hold on the aircraft for a further 20 minutes. Despite being first off the plane we then waited in line for another 2 hours. Customs was also no better, there were a total of 6 CBP lanes open for all arriving visitors. My wife also got a secondary immigration inspection for the apparent reason that she would be staying too long (we were on 2 one-way tickets) despite us both being on the same bookings and me being admitted without question. That whole process took another 90 minutes of waiting for a single CBP officer. So after landing at 5:50pm we got to our rental car at 10:30pm. We will never use this airport again. Orlando lives from tourism and frankly with a welcome like this they can keep it. I would give zero points if allowed.",,"{'Experience At Airport': 'Arrival Only', 'Date Visit': 'November 2018', 'Type Of Traveller': 'Couple Leisure', 'Queuing Times': 1, 'Terminal Cleanliness': 1, 'Terminal Seating': 1, 'Terminal Signs': 1, 'Food Beverages': 0, 'Wifi Connectivity': 1, 'Airport Staff': 1, 'Recommended': 'no'}"
2018-11-09,2,10,"""employees rude and offensive""",R Prees,"Not Verified | Avoid at all cost, this is the worst airport I have flown into. The employees are rude and offensive, do yourself a favour fly to Sanford. I will not be flying with Virgin again because they land at this airport in the looses term, I would give it minus If it would let me.",,"{'Experience At Airport': 'Departure Only', 'Date Visit': 'November 2018', 'Type Of Traveller': 'Family Leisure', 'Queuing Times': 1, 'Terminal Cleanliness': 2, 'Terminal Seating': 1, 'Terminal Signs': 1, 'Food Beverages': 1, 'Airport Shopping': 1, 'Wifi Connectivity': 1, 'Airport Staff': 1, 'Recommended': 'no'}"
2018-11-03,2,10,"""avoid at all costs""",Sam Anderson,"Not Verified |  TSA lines 30 minutes or more, and the airport authority staff sitting in various places around the main floor do nothing to inform. This place used to be one of the best. I would now avoid at all costs. Horrible treatment of the flying public.",,"{'Experience At Airport': 'Departure Only', 'Date Visit': 'November 2018', 'Type Of Traveller': 'Solo Leisure', 'Queuing Times': 1, 'Terminal Cleanliness': 1, 'Terminal Seating': 4, 'Terminal Signs': 1, 'Food Beverages': 2, 'Airport Shopping': 2, 'Wifi Connectivity': 3, 'Airport Staff': 1, 'Recommended': 'no'}"
2018-10-29,1,10,"""What a joke!""",Jennifer Dalton,Not Verified |  What a joke! The staff members at this airport are the most rude and ignorant people I have encountered in my life. Be prepared to deal with the worst attitudes possible and for no apparent reason. I have traveled to this airport many times and this will be my last! I refuse to deal with these security and ticket staff. From now on I will just fly into Tampa and drive to Orlando.,,"{'Experience At Airport': 'Departure Only', 'Date Visit': 'October 2018', 'Type Of Traveller': 'Solo Leisure', 'Queuing Times': 2, 'Terminal Cleanliness': 2, 'Terminal Seating': 2, 'Terminal Signs': 2, 'Food Beverages': 2, 'Airport Shopping': 2, 'Wifi Connectivity': 2, 'Airport Staff': 1, 'Recommended': 'no'}"
2018-10-28,10,10,"""appreciated their integrity""",Pamela Boynton,"✅ Trip Verified | Honesty, graciousness and hospitality describe my latest trip to MCO last week. I was traveling there because my daughter was having surgery so my mind was scattered. Once I landed after flying for 5+ hours, I was ready to catch Uber and get to her house before her surgery early the next morning. As I was taking off an outer coat due to the 40 degree warmer weather, I set my purse down. When I gathered my things as the Uber driver came up, I left my purse on the planter. Of course when we got to her house - no purse. My Uber driver was going back to the airport and offered to see if he could locate it when I gratefully appreciated. My daughter went on line to file a lost and found report. We prayed and moments later, a detective  called. They had been trying to locate me for more than 30 minutes. The Security Guard at the airport found my purse and immediately turned it in. When I spoke to the Detective, I thanked him profusely and asked about next steps. He said Lost and Found would contact me the next morning. They did - twice. They confirmed the contents with me and gave me instructions as to how to pick it up. I told them I would come after my daughter's surgery was over and they understood completely. Around 1pm the next day, I went back to the airport and found them - they were already waiting for me. I asked how I could repay them - tips, writing letters of appreciation or what. They said none of that was necessary and asked how my daughter was. All I can say is how much I truly appreciated their integrity, concern and graciousness. I will highly recommend the Orlando Airport and Orlando in general and a wonderful place to visit!",yes,"{'Experience At Airport': 'Arrival and Departure', 'Date Visit': 'October 2018', 'Type Of Traveller': 'Solo Leisure', 'Queuing Times': 4, 'Terminal Cleanliness': 5, 'Terminal Seating': 4, 'Terminal Signs': 4, 'Food Beverages': 4, 'Wifi Connectivity': 4, 'Airport Staff': 5, 'Recommended': 'yes'}"
2018-09-17,3,10,"""not a friendly user installation""",Richard Leclerc,"✅ Trip Verified | Orlando International Airport is definitely not a friendly user installation. You have to walk and going up and down to reach your luggages and the parking. Also the staff at security gates (TSA) are not fit to handle customers. They are rude, impolite and unprofessional. They need to retrain at Disney Institute, few miles away from the airport, to learn about what is quality service!",,"{'Experience At Airport': 'Arrival and Departure', 'Date Visit': 'August 2018', 'Type Of Traveller': 'Family Leisure', 'Queuing Times': 2, 'Terminal Cleanliness': 5, 'Terminal Seating': 3, 'Terminal Signs': 2, 'Food Beverages': 1, 'Airport Shopping': 4, 'Wifi Connectivity': 5, 'Airport Staff': 1, 'Recommended': 'no'}"
2018-09-13,1,10,"""Security is horrendous""",S Johnson,"✅ Trip Verified | TSA/Security is horrendous and caused us to almost miss our flight. We checked the airport app upon arrival and the estimated wait time for Gates 1-59 security was 6-10 minutes. So we took our time, got some coffee, etc. My wife checked the app again a bit later and suddenly the wait time was 22-26 minutes. We hurried over and discovered the chaos that is MCO security. Several times, several lines merged into one or branched from one line to several. It was like herding cattle. The last time the line branched we apparently chose the wrong line. It just wasn't moving and when we finally got to the front we find that the bag scanner wasn't working properly. All told, it took me 47 minutes to get through security, but it didn't end there for my wife. Her bag was pulled out to be searched, along with a few others'. I went on to the gate to plead with the gate agent because we were about to miss our flight. My wife tells me that the two bags in front of hers were searched because of 1) Disney picture frames, and 2) a hairbrush. For her, it was a handful of quarters. She ran to the tram, then from the tram towards the gate. Luckily I saw her just as the gate agents closed the door. I told them she was on her way and pleaded with them to let us board. They reopened the doors for us and let us on. TSA was rude and condescending, though. I witnessed it myself but my wife tells me it got even worse after I left. We don't travel to Florida often, but it will never again be to Orlando.",,"{'Experience At Airport': 'Departure Only', 'Date Visit': 'September 2018', 'Type Of Traveller': 'Couple Leisure', 'Queuing Times': 1, 'Terminal Cleanliness': 3, 'Terminal Seating': 2, 'Terminal Signs': 1, 'Food Beverages': 3, 'Wifi Connectivity': 3, 'Airport Staff': 1, 'Recommended': 'no'}"
2018-09-09,2,10,"""MCO is the worst airport""
",W James,"Not Verified |  I live in Florida but have traveled quite a bit and I have to say that MCO is the worst airport that I've ever been to. Going through the lines for security is a mess. It's like herding cattle. Today I stood on one spot, in a line, for over a half an hour. Once I got to the scanner, the alarm went off. I went back through and it was fine. The lady behind me had the same thing happen. Needless to say, I and the lady behind me, missed our flights. Going to try OIA next time.",,"{'Experience At Airport': 'Departure Only', 'Date Visit': 'September 2018', 'Type Of Traveller': 'Family Leisure', 'Queuing Times': 3, 'Terminal Cleanliness': 4, 'Terminal Seating': 4, 'Terminal Signs': 3, 'Food Beverages': 4, 'Airport Shopping': 4, 'Wifi Connectivity': 4, 'Airport Staff': 3, 'Recommended': 'no'}"
2018-08-31,1,10,"""ill informed rude staff""
",A Stevenson,"Not Verified |  I have been travelling to Orlando for over 25 years for vacation and work, and over the last 9 months this immigration situation has gone from bad to appalling. You arrive after 9.5 hours in the air to go through a small area with no refreshments or bathroom facilities and then you put your passport into the machines getting a ticket which has cleared you for entry. Once out of this area you are the herded by ill informed rude staff to meet the customs officials and get asked the same questions by these people, some of whom are really nice others can be really obnoxious. So you land at 3.30 pm and get your baggage at 6.00 p.m. Not acceptable. Get this new area sorted get your entry system sorted, get your staff trained in customer service. I have been into dozens of US and other country customs area and this is by far the worse.",,"{'Experience At Airport': 'Arrival Only', 'Date Visit': 'April 2018', 'Type Of Traveller': 'Couple Leisure', 'Queuing Times': 1, 'Terminal Cleanliness': 2, 'Terminal Seating': 1, 'Terminal Signs': 2, 'Food Beverages': 1, 'Airport Shopping': 3, 'Wifi Connectivity': 1, 'Airport Staff': 2, 'Recommended': 'no'}"
2018-08-31,7,10,"""revaluate wheelchair service""",Robert Kelley,"Not Verified | Wheelchair passengers had to wait 15 extra minutes on the plane before wheelchairs arrived at the gate, even though they wheelchairs had been requested in advance. Then, once we deplaned and had our wheelchairs we had to wait additional time before anyone arrived to push us. OIA needs to revaluate their wheelchair service contractor and demand that they hire additional people and buy more wheelchairs. It's a good thing we didn't have a connecting flight or we could have missed it.",yes,"{'Experience At Airport': 'Arrival Only', 'Date Visit': 'August 2018', 'Type Of Traveller': 'Couple Leisure', 'Queuing Times': 3, 'Terminal Cleanliness': 4, 'Terminal Seating': 4, 'Terminal Signs': 4, 'Food Beverages': 3, 'Airport Staff': 2, 'Recommended': 'yes'}"
2018-08-30,9,10,"""definitely my favorite""",Nikhil Sanghrajka,"Not Verified | MCO being my home airport is definitely my favorite, but I have many reasons that would put this under favorites for many non-floridians. First of all I am a frequent flyer and with TSA-Pre Check you can zip through security lines here. The airport is organized and although there is a high amount of passenger traffic everything runs smoothly. There are plenty of restaurants and shopping areas as well as an Apple store which is awesome. The airport is super clean and transportation shuttles are everywhere so you will always get to your gate on time. I have almost never experienced delays at this airport even during international departures. There is also great Wi-Fi through out the whole airport. Customer service and staff are calm and helpful and always cheerful! The only thing I would add to this airport is more international gates to increase international traffic. The overall experience is amazing though, so if you ever fly into Florida I recommend Orlando International Airport!",yes,"{'Experience At Airport': 'Arrival and Departure', 'Date Visit': 'July 2018', 'Type Of Traveller': 'Solo Leisure', 'Queuing Times': 4, 'Terminal Cleanliness': 5, 'Terminal Seating': 5, 'Terminal Signs': 4, 'Food Beverages': 5, 'Airport Shopping': 5, 'Wifi Connectivity': 4, 'Airport Staff': 5, 'Recommended': 'yes'}"
2018-08-18,1,10,"""an awful place""",Candice Howells,"Not Verified | I was very disappointed in the Orlando Airport. The lines are extremely long going through security and the airport employees are very rude, disrespectful and loud. I would never hire any of them to deal with any of my customers. I have been through that airport now three times, and always the same thing. I feel sorry for the first time flyer- it’s an awful place! All they need to do is be nice. If I treated my customers this way I would be fired!",,"{'Experience At Airport': 'Arrival and Departure', 'Date Visit': 'August 2018', 'Type Of Traveller': 'Family Leisure', 'Queuing Times': 1, 'Terminal Cleanliness': 1, 'Terminal Seating': 1, 'Terminal Signs': 1, 'Food Beverages': 0, 'Airport Staff': 1, 'Recommended': 'no'}"
2018-07-30,1,10,"""tired and ill-prepared airport""",K Johnstone,"✅ Trip Verified | Worst airport I have come across and totally unacceptable for a destination that relies almost entirely on tourism. It is an unfriendly, tired and ill-prepared airport to arrive in. We were held on the plane for 40 minutes because they had no space for us in the arrival halls and then we had to wait in 'holding pens' for a couple of hours in endlessly long snaking queues standing up. Everyone had arrived at that time from long haul flights, so already exhausted. All the children were crying, there were no seats available for those who needed to sit. Nobody wants to spend three hours getting through the airport when they have travelled so far and then need to travel further to their final destination. The ceilings were all coming apart, everything looked very tired and not fit for purpose. Even an apology over the tannoy system would have been appreciated but there was nothing. Only commands to not use your phone or camera. I would avoid this airport at all costs. Plus the signage throughout is terrible!",,"{'Experience At Airport': 'Arrival and Departure', 'Date Visit': 'July 2018', 'Type Of Traveller': 'Family Leisure', 'Queuing Times': 1, 'Terminal Cleanliness': 2, 'Terminal Seating': 2, 'Terminal Signs': 1, 'Food Beverages': 0, 'Airport Staff': 1, 'Recommended': 'no'}"
