datePublished,ratingValue,bestRating,header,author,reviewBody,recommended,stats
2017-02-13,7,10,"""a more pleasant airport than many""",R Matthews,"✅ Verified Review | San Diego airport is a nice size but a short on restaurants and other amenities and can be become congested at peak times. At Terminal 1 there are two isolated gate concourses and each only has one real restaurant. You can't get from one concourse to the other without going back through TSA. It's a poor design and gives the vendors in each concourse a monopoly. Getting to the airport can get very congested at busy times as there are some severe bottlenecks for cars, taxis, shuttles, Uber, etc. But at non-peak hours and times of year it's generally pretty good. It's not the airport's fault directly, but the surface streets around the airport are crumbling, sometimes too narrow, have pot holes that could swallow a german shepard, and make getting too and from the airport unpleasant at best. Also look for the nearby Mobile station to refuel your rental car. The closer Shell is nearly a $1/gallon more (at least in Feb 2017). It's annoying all the shuttles, taxis, rental car bus, etc pick you up and drop you off on the other side of an impenetrable fence. So you're forced to go up a long slow escalator to take a sky bridge. Many airports, even much larger ones, have crosswalks across the surface traffic to get to those areas but SAN forces you to use the awkward sky bridge. On the plus side the WiFi is free, fast, and easy to access. What few food options there are tend to be fairly decent (if typically airport expensive). They also have some decent options before passing through TSA (unlike many airports) including the Breeze and Jack In The Box at Terminal 1. And the restaurants that I've been to (including Breeze) clearly display the prices for everything including adult beverages (unlike many airports). TSA lines are generally reasonable and, even at peak times, I think I've waited at most around 15 minutes. But each TSA station serves relatively few gates which helps a lot. It's nothing like the TSA nightmare in Seattle. There's also the relatively new centralized rental car center which is a big improvement over a bunch of little off-site rental locations. The shuttle service is faster and, if for some reason, something goes wrong picking up your rental you have a dozen or so other choices in the same building. Overall SAN is a more pleasant airport than many.",yes,"{'Experience At Airport': 'Departure Only', 'Date Visit': 'February 2017', 'Type Of Traveller': 'Business', 'Queuing Times': 3, 'Terminal Cleanliness': 4, 'Terminal Seating': 3, 'Terminal Signs': 4, 'Food Beverages': 2, 'Airport Shopping': 2, 'Wifi Connectivity': 5, 'Airport Staff': 3, 'Recommended': 'yes'}"
2016-07-07,4,10,"""never enough seats""",J Mulholland,"Southwest Airlines terminal has 12 womens toilets for 10 gates, there is always a 15 to 25 plus person line, not for the mens room though. There are never enough seats, the food options lines are always long and if you change planes and get gate 1, 1a, you have to go through security again and there is no TSA line. Hate flying through here.",,"{'Experience At Airport': 'Departure Only', 'Date Visit': 'July 2016', 'Type Of Traveller': 'Business', 'Queuing Times': 1, 'Terminal Cleanliness': 2, 'Terminal Seating': 1, 'Terminal Signs': 3, 'Food Beverages': 2, 'Airport Shopping': 1, 'Airport Staff': 5, 'Recommended': 'no'}"
2016-01-22,6,10,"""seating is limited""",David Davenport,"SAN is convenient to downtown San Diego, but lack of frequent public bus connection at night and on weekends is a drawback. Circulation between terminals is via shuttle bus, T1 and T2 are close enough together to walk, but the shuttle is handy for commuter terminal access. There isn't a consolidated car rental facility, but off-site locations are much closer than rental facilities at LAX or LAS. Security is quick, but T1 in particular is poorly laid out. Screening area is crowded, seating is limited, boarding areas and restrooms are small, and food options are lackluster (although improving). There is nothing of interest to occupy time while waiting for a delayed flight. Wi-Fi is free but arduous to use, plus it is capped at 30 minutes. Not very user friendly.",,"{'Experience At Airport': 'Arrival and Departure', 'Date Visit': 'December 2015', 'Type Of Traveller': 'Solo Leisure', 'Queuing Times': 3, 'Terminal Cleanliness': 3, 'Terminal Seating': 2, 'Terminal Signs': 4, 'Food Beverages': 3, 'Airport Shopping': 2, 'Wifi Connectivity': 2, 'Airport Staff': 4, 'Recommended': 'no'}"
2015-11-18,6,10,"""good variety of shops""",Assis Pontes,"We must have parked at the far end, though the airport is huge. Seats offer recharge facilities for mobile and laptop near boarding gates. Toilets are plenty and never too far. A good variety of shops. Wifi was disappointing. Able to move in and out of the airport quickly.",yes,"{'Experience At Airport': 'Arrival and Departure', 'Date Visit': 'October 2015', 'Type Of Traveller': 'Solo Leisure', 'Queuing Times': 3, 'Terminal Cleanliness': 3, 'Terminal Seating': 4, 'Terminal Signs': 4, 'Food Beverages': 3, 'Airport Shopping': 4, 'Wifi Connectivity': 1, 'Airport Staff': 3, 'Recommended': 'yes'}"
2015-10-31,7,10,"""didn't appear to be the case""",Anurag Dave,"Arrived in San Diego Airport from Phoenix. As you land into San Diego Airport, the aircraft flies low near Downtown San Diego. You see also the ocean, as well as boats in the area. In my case, I also saw a vacation Cruise Ship, as well as US Navy vessels in the area. If you are flying into San Diego Airport, try to get window seats. It is totally worth it. While I was waiting outside the terminal to get picked up by family, I noticed that the departing passengers were also being dropped off at the same place where arriving passengers were being picked up. At most U.S airports, departing and arriving car traffic is kept separate, but that didn't appear to be the case in San Diego.",yes,"{'Experience At Airport': 'Arrival Only', 'Date Visit': 'October 2015', 'Type Of Traveller': 'Solo Leisure', 'Queuing Times': 3, 'Terminal Cleanliness': 3, 'Terminal Seating': 3, 'Terminal Signs': 3, 'Food Beverages': 3, 'Airport Shopping': 3, 'Wifi Connectivity': 3, 'Airport Staff': 3, 'Recommended': 'yes'}"
2015-06-24,10,10,San Diego Airport customer review,Anatoli Naoumov,"Went through security in under 10 minutes. Many outlets to charge my phone. Variety of food to take on board. Clean, well ventilated. Plenty of seats.",yes,"{'Experience At Airport': 'Departure Only', 'Date Visit': 'June 2015', 'Type Of Traveller': 'Business', 'Queuing Times': 5, 'Terminal Cleanliness': 5, 'Terminal Seating': 5, 'Food Beverages': 5, 'Recommended': 'yes'}"
2015-06-17,1,10,San Diego Airport customer review,Breanna Norton,I have never had an issue before but I am beyond upset. I got to the airport 2 hours early and check in took me the whole time making me miss my flight. I was in line to check in and was told to go in another line that took forever then finally got up front after finding out I missed my check in time after I kept asking to go to the front to avoid missing having the staff tell me no because I'll make but turns out I didn't make it me now on standby for a flight that's full. Their staff are not helpful one bit.,,"{'Experience At Airport': 'Departure Only', 'Date Visit': 'June 2015', 'Type Of Traveller': 'Solo Leisure', 'Queuing Times': 2, 'Terminal Cleanliness': 4, 'Terminal Seating': 4, 'Food Beverages': 3, 'Airport Shopping': 3, 'Wifi Connectivity': 3, 'Recommended': 'no'}"
2015-06-15,5,10,San Diego Airport customer review,K Niquette,"Utilized San Diego International Airport for a connecting flight. To put it simply, the Southwest Airlines terminal at this airport is far too small to accommodate the amount of traffic that it is currently going through it. It's standing room only more often than not at many of the gates and seating is insufficient. Also, it was very confusing to hear flight information with all the announcements being made over one another. Furthermore, there is only one bathroom facility to service 10 gates. One positive thing about this terminal is the food choices one is offered. Overall, an unpleasant experience at the airport here in San Diego, and one that can be greatly improved for the future.",,"{'Experience At Airport': 'Arrival and Departure', 'Date Visit': 'June 2015', 'Type Of Traveller': 'Family Leisure', 'Queuing Times': 2, 'Terminal Cleanliness': 3, 'Terminal Seating': 1, 'Food Beverages': 5, 'Wifi Connectivity': 2, 'Recommended': 'no'}"
