datePublished,ratingValue,bestRating,header,author,reviewBody,recommended,stats
2024-09-10,3,10,"""always disappointing""",Mike Roberts,"Not Verified | I've traveled extensively in my lifetime, to Airports all over the world. SD Lindberg Field is always disappointing. I flew out mid-morning on a Wednesday to Atlanta (ATL). Seating at our assigned gate was full / not adequate, so we sat at an empty gate nearby. ATL, I feel, is what every big city wishes there airport to be. Large, clean and efficient for people, planes and cars. ATL has a great ground transportation system in place and a Rental Car center, which is next level, with easy freeway access. My flight back to SD arrived early, but we spent the time gained sitting on the tarmac waiting for a gate. Once off the plane, I visited a small, crowded restroom across from my arrival gate, which obviously hadn't been cleaned for a while. It smelled like an outhouse. Baggage claim took longer as they had two flights using on one baggage carousel. The ride back to our car at an area parking business was problematic (another issue) due to short staffing. Also of note, riding in the overcrowded van, was how poorly maintained the roads, into and out of the airport, are. I know airport construction has been going on forever, but the roads around the airport need to be repaved. Good first impressions are important. If SD truly wants to be a world-class destination, it has to quit trying to make a small, single runway airport do the job and build a new, modern air (and ground) transportation center. You cannot shoe horn a large, efficient airport into the space Lindberg Field occupies. Sadly, in today's dollars, I don't see that happening. I'll look to use John Wayne Orange County or Ontario next time.",,"{'Experience At Airport': 'Arrival and Departure', 'Date Visit': 'September 2024', 'Type Of Traveller': 'Couple Leisure', 'Queuing Times': 2, 'Terminal Cleanliness': 2, 'Terminal Seating': 2, 'Terminal Signs': 2, 'Food Beverages': 0, 'Recommended': 'no'}"
2024-07-15,2,10,"""airport is a huge disappointment""",Julie Klinger,"Not Verified | This airport is terrible. There is absolutely no seating available! People have to sit on the floor and in areas that cause traffic concerns. There are so many people in the terminals that moving through the crowd is slow and frustrating. Only 1 bathroom in terminal area….massive line and paper product shortages. Only 1 bar/restaurant available and it is absolutely packed with mediocre service and food! For a city this beautiful and popular the airport is a huge disappointment and aggravating. Again, absolutely no seating! What is the maximum capacity in this place because I am sure we have passed an appropriate number causing concerns about safety and any type of positive costumer service type experience!!! Terrible! Do something about it!",,"{'Experience At Airport': 'Arrival and Departure', 'Date Visit': 'July 2024', 'Type Of Traveller': 'Family Leisure', 'Queuing Times': 2, 'Terminal Cleanliness': 2, 'Terminal Seating': 1, 'Terminal Signs': 1, 'Food Beverages': 2, 'Airport Shopping': 2, 'Wifi Connectivity': 3, 'Airport Staff': 2, 'Recommended': 'no'}"
2024-07-09,2,10,"""worst airport I have experienced""",L Maltin,✅ Trip Verified |  I am a local. Easily the worst airport I have experienced in a long time. Always under construction. Short staffed. Incompetent baggage handling.. Flight arrived nearly on time at 10:55pm. Kept us on the tarmac for 45 min waiting for a gate when the plane occupying our gate was having mech issues and there were open gates available. Did not announce baggage carousel for 30 min. Even turned off the carousel location board for a while since it was midnight. Welcome to beautiful San Diego where we have zero clue about efficiency,,"{'Experience At Airport': 'Arrival and Departure', 'Date Visit': 'July 2024', 'Type Of Traveller': 'Family Leisure', 'Queuing Times': 2, 'Terminal Cleanliness': 3, 'Terminal Signs': 1, 'Food Beverages': 0, 'Recommended': 'no'}"
2024-05-22,3,10,"""needs expanding for sure""",C Jackson,✅ Trip Verified |  This place is so tiny it’s a fire trap! Way too many people for either terminal. Bathrooms are also small. It needs expanding for sure. Plus the carpet at security was so gross.,,"{'Experience At Airport': 'Arrival and Departure', 'Date Visit': 'May 2024', 'Type Of Traveller': 'Solo Leisure', 'Queuing Times': 3, 'Terminal Cleanliness': 1, 'Terminal Seating': 1, 'Terminal Signs': 5, 'Food Beverages': 3, 'Airport Shopping': 1, 'Airport Staff': 2, 'Recommended': 'no'}"
2024-03-04,1,10,"""so small and crowded""",Nelson Garcia,"Not Verified |  Connected thru SAN on my way to HNL. The terminal is so small and crowded that one has to exit to baggage claim and reenter thru TSA check in order to change gates! Once I made it to the gate area, it looked like a refugee crisis. Each gate only had 30 seats and there were 6 gates arrange in a circle around a restaurant. I stood for an hour of my 3 hour layover. I would recommend not reentering thru TSA until the last minute. I thought LGA and PHL were bad, this is worse.",,"{'Experience At Airport': 'Transit', 'Date Visit': 'March 2024', 'Type Of Traveller': 'Business', 'Queuing Times': 1, 'Terminal Cleanliness': 1, 'Terminal Seating': 1, 'Terminal Signs': 1, 'Food Beverages': 1, 'Wifi Connectivity': 2, 'Recommended': 'no'}"
2024-02-27,1,10,"""Avoid this airport at all costs""",Michelle Furis,"Not Verified | Worst terminal (Terminal 1) ever! It’s so tiny. Seems like too many people for one area. No seats and people coughing on each other. We were early thinking I could get a coffee and relax and wait. It’s a small circle. I feel like Thor in Thore Ragnarok, just walking in circles thinking you are going somewhere! This place sucks! Avoid this airport at all costs!",,"{'Experience At Airport': 'Departure Only', 'Date Visit': 'February 2024', 'Type Of Traveller': 'Couple Leisure', 'Queuing Times': 1, 'Terminal Cleanliness': 1, 'Terminal Seating': 1, 'Terminal Signs': 2, 'Food Beverages': 1, 'Airport Shopping': 1, 'Airport Staff': 1, 'Recommended': 'no'}"
2024-02-08,2,10,"""avoid this airport at all cost""",E Venton,"✅ Trip Verified |  Had to make a connection here. Got off the plane. Had wheelchair assist. Went to Einstein Brothers picked up a drink take my meds for the next flight and a bagel. Then find out we are changing terminals and have to go through security again so purchasing an expensive airport drink only to throw it away 10 minutes later. Every major airport I have traveled through has secured connections from one terminal to another. This is totally crazy for an airport that has this mini flights. Had to turn around in the other terminal and buy another expensive airport. Drink not mentioning wasting time going through security for the second time which I had done 7 1/2 hours earlier in Honolulu. Overall, if you're making a connection, avoid this airport at all cost.",,"{'Experience At Airport': 'Arrival and Departure', 'Date Visit': 'February 2024', 'Type Of Traveller': 'Solo Leisure', 'Queuing Times': 1, 'Terminal Cleanliness': 3, 'Terminal Signs': 1, 'Food Beverages': 1, 'Airport Shopping': 1, 'Airport Staff': 3, 'Recommended': 'no'}"
2024-01-03,1,10,"""worst I've ever been to""",Sara Mesler,"✅ Trip Verified | First of all, this airport was absolutely packed to the gills and filthy, it was holiday travel weekend and expected to be busy. We arrived from a 5 hour flight from Hawaii with TSA precheck, already gone through the checks in Hawaii, so we had snacks and waters, not knowing we would have to exit the terminal and go back through TSA. As we approach, we are told we do have to go back through, so we queue up, and realize these people are literally stopping every single person: families with kids and tubs of vasoline, families with candles and things they purchased, myself with an unopened bottle of water I purchased in the airport after going through TSA. We all just had them throw our stuff out. The hubs are set up so that it's just a big circle with gates and one bathroom for men and one for women, so once again we queue up to go into another filthy area that clearly had not time available to clean because it was so busy. Then we couldn't find seats to wait for our flight out because there was already so little space, until the last flight left. This was the worst airport in our travel, and probably the worst one I've ever been to. La Guardia seemed like a country club in comparison.",,"{'Experience At Airport': 'Arrival and Departure', 'Date Visit': 'December 2023', 'Type Of Traveller': 'Family Leisure', 'Queuing Times': 1, 'Terminal Cleanliness': 1, 'Terminal Seating': 1, 'Terminal Signs': 1, 'Food Beverages': 5, 'Airport Shopping': 5, 'Wifi Connectivity': 5, 'Airport Staff': 5, 'Recommended': 'no'}"
2023-04-29,1,10,"""Terminal overcrowded""",Teresa Heckley,"Not Verified |  Terminal overcrowded without any major disruptions of flights to cause the overcrowding. No place to sit. Food options for travelers requiring gluten free non-existent. This is the worst airport I have experienced in the United States, Canada and Europe. Would not recommend anyone to route via San Diego unless they had no other option.",,"{'Experience At Airport': 'Departure Only', 'Date Visit': 'April 2023', 'Type Of Traveller': 'Couple Leisure', 'Queuing Times': 1, 'Terminal Cleanliness': 1, 'Terminal Seating': 1, 'Terminal Signs': 1, 'Food Beverages': 1, 'Airport Shopping': 1, 'Wifi Connectivity': 1, 'Airport Staff': 1, 'Recommended': 'no'}"
2023-02-25,3,10,"""The worst airport I have ever been to""",Margaret Trainor,"Not Verified |  The worst airport I have ever been to. Flew Southwest to and from New Orleans. Landing in San Diego with no problem but leaving to go back home is a nightmare. The terminal is so small there are no seats much less any place to sit and eat. Only 1 shop and 1 bar/restaurant which is very very small. They really need to do something about this. Also if you have pre TSA forget it. The line was longer that regular TSA and you still have to take your shoes and off, belts, computer out of the bag and jackets. So it basically the same process and regular TSA!",,"{'Experience At Airport': 'Arrival and Departure', 'Date Visit': 'February 2023', 'Type Of Traveller': 'Family Leisure', 'Queuing Times': 1, 'Terminal Cleanliness': 1, 'Terminal Seating': 1, 'Terminal Signs': 3, 'Food Beverages': 1, 'Airport Shopping': 1, 'Wifi Connectivity': 3, 'Airport Staff': 1, 'Recommended': 'no'}"
2022-12-19,1,10,"""Worst bathrooms ever""",Marvin Smilden,Not Verified |  Worst bathrooms ever. Urine on the floor from the time you walk in till the time you leave. Your feet stick to the floor. I watched the janitor park his cart in the bathroom then walk out. He then sat in a chair at the gate for over one hour. He then went and got his car from the restroom and left again. Never cleaning anything in the bathroom. Totally disgusting. You don't want me to post a picture of this.,,"{'Experience At Airport': 'Arrival and Departure', 'Date Visit': 'December 2022', 'Type Of Traveller': 'Couple Leisure', 'Queuing Times': 1, 'Terminal Cleanliness': 1, 'Terminal Seating': 2, 'Terminal Signs': 3, 'Food Beverages': 1, 'Airport Shopping': 2, 'Airport Staff': 1, 'Recommended': 'no'}"
2022-12-02,1,10,"""One of the worst airport experiences""",Laura Tidwell,"Not Verified |  San Diego is the second largest city in California and has a very undersized Southwest terminals. Once through security, the gate areas are so full of waiting passengers you can barely navigate through the crowds. If you want to sit down and order food - forget it. Interested in a drink at the bar - good luck finding a wedge in the crowd to order something. And then enjoy your beverage leaned up against a wall since there is significant lack of seating. If you are Southwest passenger making a connection, be prepared to enjoy TSA security twice. The airport does not have a way for passengers who have already passed through security to get to another terminal. Passengers making a connecting flight in another terminal are forced to exit the secure area, requiring them to go back through security. This is frustrating and a waste of time. Several other passengers and I were forced to throw things away that could not go through security that we had purchased at our previous airport, on the secure side. And, as a frequent traveler, with TSA pre-check, I have never been asked to take my laptop out of my bag when going through security. There is no separate security line for TSA pre-check, and it buys you nothing in SAN. One of the worst airport experiences ever. Avoid if you can.",,"{'Experience At Airport': 'Arrival and Departure', 'Date Visit': 'December 2022', 'Type Of Traveller': 'Business', 'Queuing Times': 3, 'Terminal Cleanliness': 3, 'Terminal Seating': 1, 'Terminal Signs': 4, 'Food Beverages': 1, 'Airport Staff': 4, 'Recommended': 'no'}"
2022-10-30,3,10,"""I had no choice so I had to pay, but this is a new low""",Lorri Cahill,"Not Verified |  First off the TSA personnel need to be on the same page. The belongings staff said cell phones did not need to be in the scanner bin. Then I got in line for the body scan and the man said I could not have my phone in the body scan. So I had to get out of body scan line and put my phone in a bin to be scanned. Dumb! The airplane was air conditioned to frigid. Why? Also, I paid $35 for a bloody mary and mimosa, which was bad enough, but included in the cost was recruitment and retention of future employees. I had no choice so I had to pay, but this is a new low. Shame on you.",,"{'Experience At Airport': 'Departure Only', 'Date Visit': 'October 2022', 'Type Of Traveller': 'Couple Leisure', 'Queuing Times': 3, 'Terminal Cleanliness': 3, 'Terminal Seating': 5, 'Terminal Signs': 3, 'Food Beverages': 1, 'Recommended': 'no'}"
2022-10-08,1,10,"""Unhygienic and disgusting""",David Holden,"Not Verified |  Arrived from San Jose at Gate 12 on the afternoon of Oct 2, 2022 and had to catch the connecting flight at Gate 10, which means exiting and reentering security. There were only two lines open, priority and the rest of us. The line was moving extremely slow and then to top that off a leak of sewer water from the ladies restroom to the right started moving toward the line. There were a couple of contract employees just standing there for about 20 minutes as the sewer water moving into the non-moving line. Finally some TSA guy comes out and moves some of barriers around to avoid having people stand and lug their bags through the sewer water. He calls on the radio on how many lanes are open (one) and asks to open another one. I suggest to him that someone shut the WATER off in the bathroom. He says that's maintenance's responsibility. 25 minutes later we get to the lane and there is another barking TSA employee (only thing they do) who yells at me for putting my glasses back in my pocket after the X-ray before he tells me to. He also barks at people for not taking their shoes off, and I mention that we've been standing in sewer water for the last 45 minutes, so maybe that's why people are hesitant to take their shoes off when now the floor leading up to the X-ray has water tracked from people standing in that water. The TSA employee is taken aback that I criticized him and I notice a sign saying you can get fined for hurting their feelings. Unhygienic and disgusting.",,"{'Experience At Airport': 'Transit', 'Date Visit': 'October 2022', 'Type Of Traveller': 'Couple Leisure', 'Queuing Times': 2, 'Terminal Cleanliness': 1, 'Terminal Seating': 1, 'Terminal Signs': 3, 'Food Beverages': 0, 'Airport Staff': 1, 'Recommended': 'no'}"
2022-08-04,5,10,"""the Southwest terminal is extremely crowded""",Dan Landis,"Not Verified |  We were flying on Southwest from Denver to San Francisco with a stopover in San Diego (transfer planes). Two complaints - the Southwest terminal is extremely crowded and it is difficult to manoeuvre through the crowds due to terminal shape. Also, I had to go through security 2x once in Denver and once in San Diego. There should be a seamless transfer system when going from one domestic flight to another - instead one has to spend an extra 20 minutes going through another security line - it seems like a waste. On the plus, SAN has a beautiful location right by the harbor and downtown and you can see aircraft carriers while taking off.",yes,"{'Experience At Airport': 'Transit', 'Date Visit': 'August 2022', 'Type Of Traveller': 'Couple Leisure', 'Queuing Times': 3, 'Terminal Cleanliness': 3, 'Terminal Seating': 2, 'Terminal Signs': 3, 'Food Beverages': 3, 'Airport Shopping': 3, 'Airport Staff': 3, 'Recommended': 'yes'}"
2022-07-15,3,10,"""shuttle service is slow, crowded and runs on no particular time schedule""",Bob McNatt,"Not Verified |  The good: Lindberg Field is centrally located, clean and well maintained. The bad: since consolidating all the car rental companies in a ""rental center"" building at the south end of the runways, things have gone to hell. The shuttle service is slow, crowded and runs on no particular time schedule. There seems to be no coordination of arrivals and departures. Lines are always long. Sometimes no buses will appear for 15-20 minutes and then several may arrive all at once. The shuttle route both directions involves driving on Harbor Blvd., which at rush hours is stop & go. Allow at least an hour each way to travel 2 or 3 miles from the terminal to the ""rental center.""",,"{'Experience At Airport': 'Arrival and Departure', 'Date Visit': 'July 2022', 'Type Of Traveller': 'Family Leisure', 'Queuing Times': 1, 'Terminal Cleanliness': 4, 'Terminal Seating': 5, 'Terminal Signs': 2, 'Food Beverages': 3, 'Airport Shopping': 3, 'Wifi Connectivity': 3, 'Airport Staff': 3, 'Recommended': 'no'}"
2022-04-22,10,10,"""What a pleasant experience""",V Bradsher,Not Verified |  What a pleasant experience. Facility is so bright and clean. Lots of food and shop variety. People are so welcoming and helpful. Small airport with giant positive impressions.,yes,"{'Experience At Airport': 'Arrival and Departure', 'Date Visit': 'April 2022', 'Type Of Traveller': 'Couple Leisure', 'Queuing Times': 5, 'Terminal Cleanliness': 5, 'Terminal Seating': 5, 'Terminal Signs': 5, 'Food Beverages': 5, 'Airport Shopping': 5, 'Wifi Connectivity': 5, 'Airport Staff': 5, 'Recommended': 'yes'}"
2022-03-23,1,10,"""it was cramped, slow and no place to sit""",G Jackson,"✅ Trip Verified | Where to begin. Terminals carrier signs were wrong. Jetblue was not at terminal 2. TSA had only one line open and it was cramped, slow and no place to sit for more than one person at a time. Departures upstairs, loved carrying my bags upstairs. Bathrooms (men's) - small stalls with no room for bags, no hooks to hang anything, as I believe CA is in a drought I found it shameful that the automatic flush valve went off no fewer than six times while I was in there. You do know that the sensors are adjustable? Gate Seating - I was leaving from gate 12 and there was seating for about half (or less) of the passengers waiting to board. Food Availability - 1 restaurant with only 3 or 4 options for lunch at the gate area. I think the people who operate this airport should stop by Salt Lake City International for an idea of how an airport should look and operate. Just a suggestion.",,"{'Experience At Airport': 'Arrival and Departure', 'Date Visit': 'March 2022', 'Type Of Traveller': 'Business', 'Queuing Times': 1, 'Terminal Cleanliness': 2, 'Terminal Seating': 1, 'Terminal Signs': 1, 'Food Beverages': 1, 'Airport Shopping': 1, 'Wifi Connectivity': 1, 'Airport Staff': 1, 'Recommended': 'no'}"
2022-02-15,1,10,"""Dirty, hell hole, trash everywhere""",George Degon,"✅ Trip Verified |  Great flight into San Diego, had 4 hour lay over in Southwest Terminal 1. Dirty, hell hole, trash everywhere, garbage cans over flowing, dirtiest terminal I have ever been in, one place for food. One bathroom, smelled horrible half toilets covered with black bags, could not use, paper towels were gone or dispenser broke.",,"{'Experience At Airport': 'Arrival and Departure', 'Date Visit': 'February 2022', 'Type Of Traveller': 'Business', 'Queuing Times': 2, 'Terminal Cleanliness': 1, 'Terminal Seating': 1, 'Terminal Signs': 5, 'Food Beverages': 1, 'Airport Shopping': 1, 'Airport Staff': 1, 'Recommended': 'no'}"
2021-11-13,1,10,"""TSA was absolutely horrendous""",C Morrison,"✅ Trip Verified | TSA was absolutely horrendous, I’ve never experienced such condescending attitudes towards people. I get you hate your job but do not take it out on others.",,"{'Experience At Airport': 'Departure Only', 'Date Visit': 'November 2021', 'Type Of Traveller': 'Couple Leisure', 'Queuing Times': 3, 'Terminal Cleanliness': 3, 'Terminal Seating': 4, 'Terminal Signs': 5, 'Food Beverages': 4, 'Airport Shopping': 4, 'Wifi Connectivity': 4, 'Airport Staff': 1, 'Recommended': 'no'}"
2021-10-26,1,10,"""Terrible customer service!""",M Harper,"✅ Trip Verified | We returned our rental car at the rental car facility located inconveniently a good distance from the airport. Then you have to take a shuttle bus to the airport with a driver that hates her job and the patrons she is supposed to be serving. Once we were on the bus another couple were running to try to catch the bus! I told the driver before she pulled away but she gave it the accelerator and said, 'Let them catch the next bus!' We had plenty of room and they were obviously in a hurry trying to catch the bus. She didn’t care! I will say the driver that picked us up was very friendly and helpful. We had a 6.15 am flight so we got to rental car return at 4.05 am. The driver dropped us all off at baggage claim! Are you kidding me! Baggage claim for people leaving the rental car station and going to the airport don’t want to go to baggage claim! Who is the genius that came up with this plan? Not anyone who cares about airport patrons! The driver gives no directions about which way to go to ticketing and there are zero signs! I turn to ask the driver for assistance and she takes off! We take the stairs closest to us. When we get to the top they tell us to go back down the stairs and go right to the next stairway! We are elderly and I am disabled from injuries while serving in the military so this was not easy for us! Why can’t you drop departing passengers off at the departure gates! Why can’t you put up signage directing passengers where to go? Why can’t your drivers help passengers with directions? Terrible customer service!",,"{'Experience At Airport': 'Arrival and Departure', 'Date Visit': 'October 2021', 'Type Of Traveller': 'Couple Leisure', 'Queuing Times': 1, 'Terminal Cleanliness': 2, 'Terminal Seating': 1, 'Terminal Signs': 1, 'Food Beverages': 2, 'Airport Shopping': 2, 'Wifi Connectivity': 1, 'Airport Staff': 1, 'Recommended': 'no'}"
2021-07-22,3,10,"""There are no places to eat""",Steve M Miles,Not Verified |  There are no places to eat. Food staff at Qdoba were rude and closed in front of me. The airport is pretty full and they need the revenue I bet. People are wandering around to find food. Sad. Let’s get back open. Staff issues are old excuses. TSA precheck was slow and I was only one there. 6 people doing nothing but talking. They had to rescreen my bag twice as they were not able to use the new equipment. Sad.,,"{'Experience At Airport': 'Departure Only', 'Date Visit': 'July 2021', 'Type Of Traveller': 'Business', 'Queuing Times': 1, 'Terminal Cleanliness': 3, 'Terminal Seating': 3, 'Terminal Signs': 3, 'Food Beverages': 1, 'Airport Shopping': 2, 'Wifi Connectivity': 3, 'Airport Staff': 1, 'Recommended': 'no'}"
2021-02-22,10,10,"""he made my day which says a lot""",Lauren Swaim,"✅ Trip Verified | The bartender at the bar close to gate 26 was the best. I travel a lot and he made my day which says a lot. Super nice, personal, and went above and beyond to make stop/layover a good one. Most people never get reviews so I wanted to make sure he got some credit for being a good human and employee. Thank you!",yes,"{'Experience At Airport': 'Departure Only', 'Date Visit': 'February 2021', 'Type Of Traveller': 'Solo Leisure', 'Queuing Times': 5, 'Terminal Cleanliness': 5, 'Terminal Seating': 5, 'Terminal Signs': 5, 'Food Beverages': 5, 'Airport Shopping': 5, 'Wifi Connectivity': 5, 'Airport Staff': 5, 'Recommended': 'yes'}"
2020-02-15,1,10,"""Ridiculously crowded""",Tom Mulroney,"Not Verified |  Hated this airport. I will avoid Southwest connections at this airport in the future. Had to go through security again after landing to get to my connecting flight. Ridiculously crowded, minimal seating, ancient-looking, gloomy, low-ceilinged dinosaur of a terminal. This terminal (Southwest gates 3-20) and any others like it should be torn down and replaced.",,"{'Experience At Airport': 'Arrival and Departure', 'Date Visit': 'February 2020', 'Type Of Traveller': 'Business', 'Queuing Times': 1, 'Terminal Cleanliness': 1, 'Terminal Seating': 1, 'Terminal Signs': 2, 'Food Beverages': 1, 'Recommended': 'no'}"
2020-02-14,1,10,"""This is a total joke""",Anthony Carion,"Not Verified |  Connecting flight had to go through entire security screening process again. This is a total joke, if the airport is going to expand Gates then they need to do a better job to about this as it is a waste of money and frustrates travelers.",,"{'Experience At Airport': 'Departure Only', 'Date Visit': 'February 2020', 'Type Of Traveller': 'Business', 'Queuing Times': 1, 'Terminal Cleanliness': 1, 'Terminal Seating': 1, 'Terminal Signs': 1, 'Food Beverages': 1, 'Airport Shopping': 1, 'Wifi Connectivity': 1, 'Airport Staff': 1, 'Recommended': 'no'}"
