datePublished,ratingValue,bestRating,header,author,reviewBody,recommended,stats
2019-12-31,4,10,"""no sign showing the way""",Clark Whelton,"Not Verified | We had an early morning flight on Alaska Airlines, leaving San Diego at 6:45 a.m. When we got off the bus from the Car Rental Center and entered Terminal Two, there was no sign showing the way to the Alaska counter. We had no idea which way to go, and there was no one to ask. We went left, up the escalator, and ended up at the Delta counter. Alaska, it turned out, was at the opposite end of the terminal. We are senior citizens, with luggage, and we had to reverse course and go all the way back to the other end. Is there some reason why the airport can't put signs at the entrance, pointing the way to the various airline counters?",,"{'Experience At Airport': 'Departure Only', 'Date Visit': 'December 2019', 'Type Of Traveller': 'Couple Leisure', 'Queuing Times': 3, 'Terminal Cleanliness': 2, 'Terminal Seating': 1, 'Terminal Signs': 1, 'Food Beverages': 1, 'Airport Shopping': 1, 'Wifi Connectivity': 3, 'Airport Staff': 1, 'Recommended': 'no'}"
2019-12-18,2,10,"""Beware if planning to catch connection and need to overnight""",Celeste Casello,"Not Verified |  Beware if planning to catch connection and need to overnight. So disgusted with San Diego airport. My young son and I had a late night flight and planned to rest at the airport until our early a.m. flight. Security woke us up and kicked us out at 2 am claiming they aren't a 24 hour airport. We are welcome to be on the cold, cement floor at baggage claim and have to be rechecked through security in the a.m. Are you kidding me? I've stayed overnight in airports throughout the states to catch connecting flights. They said the airlines should have told me this. Thanks for the hospitality for weary travelers. All airports should have areas where travelers can rest warmly and somewhat confortably. People can get stranded or not have the time or money to get a room and get back early, utterly ridiculous. Plus, on the other side of security you're somewhat safe, any unticketed person can sleep out here. Unless the security loudly zooming on motorized standup bikes makes things better. Can't believe how annoyed I am while they blast Christmas music and intermittent announcements bouncing off the cold tiles. (Inside the airport they didn't have the announcements).",,"{'Experience At Airport': 'Arrival and Departure', 'Date Visit': 'December 2019', 'Type Of Traveller': 'Family Leisure', 'Queuing Times': 3, 'Terminal Cleanliness': 4, 'Terminal Seating': 3, 'Terminal Signs': 3, 'Food Beverages': 0, 'Airport Staff': 2, 'Recommended': 'no'}"
2019-10-03,1,10,"""poor design and workflow""",B Hill,"✅ Trip Verified | When is the San Diego Airport going to come into the 21st century? One airline three different terminals and 3 different checkpoints. Land in terminal 1, get off the plane and have to go through security to get to the terminal 2 and or 3. This airport doesn’t even have a expedited lane for transferring or connecting passenger through security. Every transferring or connecting passenger has to do a complete TSA screen before they can get to there next flight. How inconvenient is this for families with children, the elderly in wheelchairs and walkers, and for passengers who have close connections. I am all about security, keeping us safe. But let’s be honest, this isn’t about safety, it is about poor design and workflow. I personally have missed a flight do to this set up, where in any other airport this wouldn’t of been a issue. As much as I love San Diego your airport is poorly designed and completely frustrating for travelers.",,"{'Experience At Airport': 'Arrival and Departure', 'Date Visit': 'October 2019', 'Type Of Traveller': 'Business', 'Queuing Times': 1, 'Terminal Cleanliness': 3, 'Terminal Signs': 1, 'Food Beverages': 0, 'Recommended': 'no'}"
2019-08-12,2,10,"""the absolute worst airport""",S Garlen,"✅ Trip Verified |  Departed from terminal 1 on August 11, 2019. There is absolutely no where to sit. It took 25 minutes standing in line to get a cup of coffee. As a frequent traveler, San Diego Lindbergh Field is the absolute worst airport I have flown in or out of. Come one San Diego, it is time to expand so people at least have somewhere to sit while waiting for their flight. What a joke.",,"{'Experience At Airport': 'Departure Only', 'Date Visit': 'August 2019', 'Type Of Traveller': 'Couple Leisure', 'Queuing Times': 1, 'Terminal Cleanliness': 2, 'Terminal Seating': 1, 'Terminal Signs': 2, 'Food Beverages': 1, 'Airport Shopping': 1, 'Wifi Connectivity': 1, 'Airport Staff': 2, 'Recommended': 'no'}"
2019-06-26,2,10,"""crowded, loud and no seating""",B Jackie,"✅ Trip Verified | Worst airport ever, terminal 1 has 1 restaurant, terminal 2 has 2 dozen. If your stuck in terminal 2 don’t come hungry as there is not enough seats to eat! Since there is very little seating for those waiting to board everyone sits at the restaurant and stays there! It’s crowded, loud and no seating, terrible service! Why have such a huge terminal in 2 and nothing in 1, bad job on the part of the airport to not make the terminals equal.",,"{'Experience At Airport': 'Arrival and Departure', 'Date Visit': 'June 2019', 'Type Of Traveller': 'Family Leisure', 'Queuing Times': 2, 'Terminal Cleanliness': 1, 'Terminal Seating': 1, 'Terminal Signs': 2, 'Food Beverages': 1, 'Airport Shopping': 1, 'Wifi Connectivity': 4, 'Airport Staff': 1, 'Recommended': 'no'}"
2019-04-10,2,10,"""Few seats available""",P Lewis,"✅ Trip Verified | Seating (standing) situation is terrible. Few seats available, dirty, crowded. Restaurants and bars crowded and inaccessible. If you're travelling more than two in a group you'll likely not find space together.",,"{'Experience At Airport': 'Departure Only', 'Date Visit': 'April 2019', 'Type Of Traveller': 'Family Leisure', 'Queuing Times': 3, 'Terminal Cleanliness': 1, 'Terminal Seating': 1, 'Terminal Signs': 3, 'Food Beverages': 2, 'Recommended': 'no'}"
2019-02-18,2,10,"""Long queues at immigration""",M Saunders,"✅ Trip Verified | The new international arrivals facility is terrible. Significantly more walking required, up and down escalators, huge amounts of rope barriers. You now clear immigration after collecting bags, mitigating any advantages of arriving in First or Business (at least on BA). Long queues at immigration. What used to take 30 minutes now takes 90 minutes. Such a waste of money and bad planning on the part of the airport. And for some reason you have to show an airport employee your passport to get into the immigration queue - creating another bottleneck. And after clearing immigration and customs you are then dumped out into a little arrivals annex far from the rest of the airport and normal terminal services - requiring a 10 min walk to the taxi or uber areas. SAN has gone from one of the best international arrival ports to one of the worst.",,"{'Experience At Airport': 'Arrival and Departure', 'Date Visit': 'February 2019', 'Type Of Traveller': 'Business', 'Queuing Times': 1, 'Terminal Cleanliness': 3, 'Terminal Seating': 1, 'Terminal Signs': 3, 'Food Beverages': 0, 'Wifi Connectivity': 5, 'Airport Staff': 1, 'Recommended': 'no'}"
2019-01-26,3,10,"""terminals are far too small""
",N Kemp,"✅ Trip Verified | San Diego International Airport is a perfect example of infrastructure which hasn’t kept up with community growth. The terminals are far too small for the volume of flyers passing through it, and it’s setup is a logistical nightmare. I arrived at Terminal 1 this afternoon and flew out of Gate 2. First problem I noticed was that one can only access certain gates through certain security checkpoints. Gates 1, 2, and 2A are located behind their own security checkpoint which doesn’t have TSA Pre-Check. I am a business flyer and carry an extensive amount of electronics in my baggage, all of which had to come out (in their own, separate bins) to go through the X-Ray. Also had to remove my liquids which took forever. The security line moved extremely slow due to the lack of separated TSA Pre-Check, so arrive early. Once through security, you are guided into an extremely overcrowded waiting area with very limited vendors (similar to MCI, you have to go outside of security to get something to eat). Seating is very limited and the room itself is very dirty, and the boarding posts have zero room to move around. Overall, a very unpleasant experience today.",,"{'Experience At Airport': 'Arrival and Departure', 'Date Visit': 'January 2019', 'Type Of Traveller': 'Business', 'Queuing Times': 1, 'Terminal Cleanliness': 1, 'Terminal Seating': 2, 'Terminal Signs': 2, 'Food Beverages': 1, 'Airport Shopping': 1, 'Wifi Connectivity': 3, 'Airport Staff': 3, 'Recommended': 'no'}"
2018-11-29,1,10,"""Zero seating for the restaurants""",C Jeff ,"Not Verified |  Worst connection in America. From Gate 2 to Gate 3 in Terminal 1, you have to exit security and re-enter to make your connection. Just had the pleasure of doing that with 3 adults, an infant and a hungry toddler. Bonus? Zero seating for the restaurants - had to eat in the terminal waiting area. There is standing counters, but they won't work with children. The terminal Wifi doesn't work, so I get to purchase in-flight Wifi to write this review. Worst designed terminal I've seen in 20 years of flying. Designed for pre-security era. Please tear the whole thing down and rebuild.",,"{'Experience At Airport': 'Transit', 'Date Visit': 'November 2018', 'Type Of Traveller': 'Family Leisure', 'Queuing Times': 1, 'Terminal Cleanliness': 1, 'Terminal Seating': 1, 'Terminal Signs': 4, 'Food Beverages': 2, 'Airport Shopping': 1, 'Wifi Connectivity': 1, 'Airport Staff': 1, 'Recommended': 'no'}"
2018-11-08,1,10,"""completely disorganized, crowded, dirty""",M Era,"Not Verified |  
Super poor airport, wish I could avoid using this mess! Something like a completely disorganized, crowded, dirty market place. Over priced food stalls with poor quality food and service. However, the staff were friendly and helpful. Thanks for them.",,"{'Experience At Airport': 'Arrival and Departure', 'Date Visit': 'November 2018', 'Type Of Traveller': 'Business', 'Queuing Times': 2, 'Terminal Cleanliness': 1, 'Terminal Seating': 1, 'Terminal Signs': 1, 'Food Beverages': 1, 'Airport Shopping': 1, 'Wifi Connectivity': 3, 'Airport Staff': 3, 'Recommended': 'no'}"
2018-10-31,1,10,"""security the worst seen anywhere""",E Mahar,"Not Verified | I travel several times a month out of Newark (which is stated to be one of the worst in the country but I've never had an issue) and the security experience at San Diego was the worst I've seen anywhere. I was 2 hours early for a domestic flight and the security line was so slow that I only made it to my gate just in time for them to finish boarding. Although the staff was pleasant they were inefficient (eg, multiple staff standing around just watching a partner do something) and slow (eg, I had to stand in the scanner for 3 min, just waiting, until they finally scanned me; the bag review process was longer than other airports; employees walked and talked slowly rather than efficiently and also they were condescending asked spoke as if the passengers were 2 year olds). They have not upgraded to the latest screening procedures or machines so that took longer as well, with people being forced to do things other airports no longer require. Also when the 1st Class or TSA Pre lines were empty they were not increasing efficiency by pulling people in from Economy as they do at other airports.",,"{'Experience At Airport': 'Arrival and Departure', 'Date Visit': 'October 2018', 'Type Of Traveller': 'Business', 'Queuing Times': 1, 'Terminal Cleanliness': 2, 'Terminal Signs': 3, 'Food Beverages': 0, 'Airport Staff': 2, 'Recommended': 'no'}"
2018-09-25,1,10,"""act more like intimidating prison guards""",W Andrews,"✅ Trip Verified | San Diego “International” Airport’s Immigration Officers and Customs practices are, with very few exceptions, the worst, small-minded, parochial group of bullies I have ever experienced in all my years of international traveling. They have no idea (and they obviously don’t care) that passengers who enter using “Global Entry” have already gone through extensive background checks, finger-printing and biometric security clearances. The whole point of using Global Entry is to already answer such questions as “do you have anything to declare” via the automated kiosks and to confirm one is a trusted traveler. Yet without exception, San Diego Immigration Officers demand one hand over one’s passport and Global Entry receipt, they take an interrogative attitude, study the passport at their leisure and demand to know if one “bought anything or has anything to declare”! The whole point of answering the questions at the kiosk is so there is no need to be interviewed by an Immigration Officer! Every airport in America has fast track lanes where Global Entry passengers automatically walk right through, immigration and customs officials simply take the Global Entry receipt, no stopping, no demanding one hand over one’s passport, no questions asked. Clearly, San Diego immigration Officers do not want to accept the “fast track” part of Global Entry as a way to justify their existence to heavy-handedly screen passengers arriving on what is a minute number of daily international arrivals. Almost without exception, they act more like intimidating prison guards and management obviously allows them to act like this with impunity. This practice is unwarranted, unacceptable and completely defeats the entire purpose of the Global Entry vetting process. Another completely overreaching, baseless practice San Diego “International” Arrivals “Customs” requires is for passengers to queue up after they have passed through immigration and collected their luggage and have all their luggage x-rayed again before they can exit the airport! No other airport x-rays luggage after one arrives at ones destination! This is such typical San Diego small-minded, provincial mentality. As if pre-flight x-ray screening of luggage from international flights is less rigorous than pre-flight x-ray screening of luggage on domestic flights? How arrogant and uninformed. San Diego wants so badly to grow its international flight business, but it will never be an international airport with the immigration and customs practices they are using. With the above practices, it will remain a back-water, regional little airport staffed by amateurs who relish the idea that they are in positions of power and want to bully people. It is far better to fly out of LAX, SFO or Phoenix where the international immigration and customs teams understand their jobs.",,"{'Experience At Airport': 'Arrival Only', 'Date Visit': 'August 2018', 'Type Of Traveller': 'Solo Leisure', 'Queuing Times': 1, 'Terminal Cleanliness': 3, 'Terminal Seating': 1, 'Terminal Signs': 1, 'Food Beverages': 1, 'Airport Shopping': 1, 'Airport Staff': 1, 'Recommended': 'no'}"
2018-09-18,1,10,"""it was so unorganized""",R Kemp,✅ Trip Verified | We flew into SD airport via a connection. We got off the plane and we were forced to go though TSA again as there gates are connected. I’ve never experienced this at any other airport. They were calling our names since our plane was boarded and it took forever to get through. Southwest luckily waited for us. Because of this disaster we weren’t able to stop and use a restroom or get something to eat before our next five our flight. And to top it off we had to throw away the drinks we bought at the first airport after security since we had to go through again at SD airport. We also flew out of this airport in June and it was so unorganized and we almost missed our flight then too. I’ll avoid this airport at all costs.,,"{'Experience At Airport': 'Arrival and Departure', 'Date Visit': 'September 2018', 'Type Of Traveller': 'Couple Leisure', 'Queuing Times': 1, 'Terminal Cleanliness': 3, 'Terminal Signs': 3, 'Food Beverages': 0, 'Airport Staff': 1, 'Recommended': 'no'}"
2018-09-01,1,10,"""very few seats available""",D Genualdi,"Not Verified |  Without a doubt, this is the worst airport I have ever used. Me and my husband departed from Tampa and had to use San Diego Airport to transfer to Boise, ID. We got off our plane and immediately I noticed how crowded this very small terminal was and very few seats available. Most people had to stand in the aisles. I looked at our boarding pass for the next flight and couldn’t find the gate. They do not post any directional signs which is ridiculous. We found a TSA agent for some help and we were informed that it was in another building and would have to be screened again. Couldn’t believe it! Even though we just got off a flight, we had to empty everything on the X-ray belt, including my snacks in my purse. The TSA agents were still pretty nice though so I can’t complain about them. After that fiasco, we wanted to sit down and have something to eat before our next flight but forget about that. They have only a couple of restaurants and all of the space was taken. We will avoid this Airport in the future at all costs.",,"{'Experience At Airport': 'Transit', 'Date Visit': 'August 2018', 'Type Of Traveller': 'Couple Leisure', 'Queuing Times': 2, 'Terminal Cleanliness': 1, 'Terminal Seating': 1, 'Terminal Signs': 1, 'Food Beverages': 1, 'Airport Shopping': 2, 'Wifi Connectivity': 1, 'Airport Staff': 3, 'Recommended': 'no'}"
2018-05-05,1,10,"""Awful airport""",C Maher,"❎ Not Verified |  Awful airport. One bathroom for an entire terminal? There were lines out the door for both the men's and the women's rooms. One place to eat with no seating and less than 10 items on the menu. No place to sit at the gate. They ask you arrive over 2 hours early for your flight and then offer you no where to sit. I have been to over a dozen different airports and this is by far the worse I have ever been to. The only saving grace is the workers are nice, but when you have no where to sit and can barely move through the terminal, this hardly matters.",,"{'Experience At Airport': 'Departure Only', 'Date Visit': 'May 2018', 'Type Of Traveller': 'Couple Leisure', 'Queuing Times': 1, 'Terminal Cleanliness': 2, 'Terminal Seating': 1, 'Terminal Signs': 3, 'Food Beverages': 1, 'Airport Shopping': 1, 'Wifi Connectivity': 1, 'Airport Staff': 4, 'Recommended': 'no'}"
2018-04-27,1,10,"""Terminal one is the worst""",K King,"✅ Trip Verified | Terminal one is the worst terminal in the country! It is completely overcrowded with poor restaurants, no Starbucks and one set of bathrooms. It is terrible. I cannot believe the fire marshal can be ok with this. The line for the women's bathroom was 40 people deep! The Counter is ok but overall this terminal rates a 1 out of a scale from 1 to 10.",,"{'Experience At Airport': 'Arrival and Departure', 'Date Visit': 'April 2018', 'Type Of Traveller': 'Business', 'Queuing Times': 3, 'Terminal Cleanliness': 2, 'Terminal Seating': 1, 'Terminal Signs': 5, 'Food Beverages': 1, 'Airport Shopping': 1, 'Wifi Connectivity': 4, 'Airport Staff': 5, 'Recommended': 'no'}"
2018-04-08,3,10,"""airport is always disorganized""",Jennifer Jones,❎ Not Verified |  It is absolutely ridiculous that someone transferring has to go through security a second time. This airport is always disorganized and has rude workers. And no help is offered for instructions on where to go. There is absolutely no reason to make Gates of connecting flights so far away.,,"{'Experience At Airport': 'Arrival and Departure', 'Date Visit': 'April 2018', 'Type Of Traveller': 'Couple Leisure', 'Queuing Times': 2, 'Terminal Cleanliness': 2, 'Terminal Seating': 1, 'Terminal Signs': 2, 'Food Beverages': 1, 'Airport Shopping': 1, 'Airport Staff': 1, 'Recommended': 'no'}"
2018-03-27,4,10,"""There needs to be regulations""",K Clarke,"❎ Not Verified |  Dropping my daughter off this morning to go back to college after spring break, a Southwest flight back to UCLA. I pulled up to let her out of the car with her bags curbside with her father and sister to check in. I gave my daughter a hug and began to walk back to my car to go around to the parking area when 2 security guards came up the walk way staring at my car, then the second I get into my seat one security guard began to flash his lights into my car signaling me to leave, “No waiting he says"" as if my car was parked there. I drove away as my husband and daughter were walking up to the car, I had to come all the way back around to pick my husband and daughter up because I didn’t want to be harassed by them. It’s happened before. There needs to be regulations on them. If you can’t drop off your child without getting harassed by security that’s just sad.",,"{'Experience At Airport': 'Transit', 'Date Visit': 'March 2018', 'Type Of Traveller': 'Business', 'Queuing Times': 4, 'Terminal Cleanliness': 4, 'Terminal Seating': 4, 'Terminal Signs': 4, 'Food Beverages': 4, 'Airport Shopping': 5, 'Wifi Connectivity': 2, 'Airport Staff': 1, 'Recommended': 'no'}"
2018-03-19,1,10,"""Just no customer service""",Elizabeth Hidalgo ,"❎ Not Verified |  My son is in the military and was flying to San Francisco then to Korea. We really didn't know where to go. So we tried to check in outside, the gentleman outside was rude. Told us to go inside to the United counter but with an attitude because we didn't know. Then the lady inside told us to stand in another line. We waited there, same lady had to come and help us, but because the other lady was taking to long too check in the customer in front of us. Just no customer service. Was very sad. No smile, no nothing.",yes,"{'Experience At Airport': 'Departure Only', 'Date Visit': 'March 2018', 'Type Of Traveller': 'Solo Leisure', 'Queuing Times': 4, 'Terminal Cleanliness': 4, 'Terminal Signs': 4, 'Food Beverages': 0, 'Recommended': 'yes'}"
2018-01-22,3,10,"""Very poor management and procedures""
",C Saunders,"✅ Trip Verified | Security checkpoint was ridiculous. Worst I have seen in some time as a frequent traveller. One TSA officer checking ID for everyone including TSA pre. Everyone channeled into one line for x-ray and baggage, with TSA pre still needing to take everything out. What's the point? Very poor management and procedures.",,"{'Experience At Airport': 'Departure Only', 'Date Visit': 'January 2018', 'Type Of Traveller': 'Business', 'Queuing Times': 1, 'Terminal Cleanliness': 3, 'Terminal Seating': 4, 'Terminal Signs': 5, 'Food Beverages': 4, 'Airport Shopping': 4, 'Wifi Connectivity': 4, 'Airport Staff': 4, 'Recommended': 'no'}"
2018-01-13,1,10,"""It was chaos""",S Nelson,"✅ Trip Verified | The change recently to move Uber downstairs on the ISLAND vs where it used to be upstairs at departures is a horrible decision. Myself and 100, it seemed, of my closest Uber friends waited in what seemed like the worst possible location for Uber. It was chaos. The one attendant trying to tell everyone to move was useless and made things worse frankly. Move Uber back, we all know SAN gets tons of money from us/them. The current location seems like an thoughtless decision by someone who has never been to either location. Change it back!",yes,"{'Experience At Airport': 'Arrival Only', 'Date Visit': 'January 2018', 'Type Of Traveller': 'Business', 'Queuing Times': 1, 'Terminal Cleanliness': 4, 'Terminal Seating': 4, 'Terminal Signs': 1, 'Food Beverages': 4, 'Airport Shopping': 3, 'Wifi Connectivity': 2, 'Airport Staff': 1, 'Recommended': 'yes'}"
