datePublished,ratingValue,travellerType,seatType,route,seatComfort,foodBeverage,cabinService,inflightEntertainment,wifiConnectivity,groundService,valueForMoney,commentHeader,tripVerified,reviewContent,sentiment
2024-08-26,0.3,Couple Leisure,Economy Class,Cancun to Edmonton via Seattle,1.0,2.0,4.0,4.0,4.0,1.0,2,luggage was lost/delayed,False,"  The service on the flights is great. Free movies and texting. Pay for full wifi. The flight crew we're very friendly. However, our luggage was lost/delayed during our 11.25 hour overnight layover in Seattle. The Seattle-Tacoma Airport had issues with their sorting systems, but with so much time between flights and it being an overnight layover, the lost/delayed luggage seems rather unacceptable. Compensation was not offered upon arrival at our final destination until I asked about it. The airline sent an email telling us about the issues at the Seattle airport, 6 hours after we had already checked our bags and were enroute to Seattle. Extremely disappointed in the handling of our belongings which included gifts purchased while on vacation and medications.",-1
2024-08-19,0.1,Couple Leisure,Economy Class,Orlando to Seattle,,,,,,1.0,1,The worst experience,True,"   The worst experience I’ve ever had with an airline. We were set to fly out at 9am and we got notified around 4am our flight was canceled, not delayed, fully canceled. We immediately called customer support and it was a 4 hour wait. We got a call back around 11am and they said there are no other flights going out and they were not sure when another one would go out to Seattle. We tried later in the evening to check if any flights were available and there were a few but all $500+ per ticket (triple what we paid) and had a full day layover. We would waste half our trip trying to just catch a flight out. We had no other option but to cancel the entire trip and try to get refunds. Within their contract they are responsible to put us on the next outgoing flight and they failed to do so. Support was not any help and often rude about the situation. We’re still waiting on our refund from the airline and still trying to get a refund from our hotel we booked too.",-1
2024-08-19,0.1,Solo Leisure,Economy Class,San Diego to New York,1.0,,1.0,1.0,4.0,1.0,1,“crews are unhelpful”,True," I had a bad experience on the airplane. The seat is uncomfortable it can’t be adjusted, lavatory is dirty and stinky. The crews are unhelpful, comparing to other airlines, this airline is not worth paying at all.",-1
2024-08-02,0.1,Couple Leisure,Economy Class,San Francisco to Cabo,1.0,1.0,1.0,1.0,1.0,1.0,1,Worst experience ever,False,"   Worst experience ever accompanied by the highest negligence. Tried to take a weekend vacation and it was absolutely destroyed by this company. They put the wrong gate and destination name was reversed to what was on the board. I was sent to the other side of the airport to a gate they didn’t use that took a half hour dragging luggage, then running back with it after it was determined that they printed the wrong gate on the ticket. Name on the ticket for the destination was San Lucas Cabo while on the board was Los Cabo as you can imagine not under C nor S. Missed the flight and their customer service rep couldn’t help herself but to continue raising her voice although I reminded numerous times to lower it and keep it leveled with mine, after all she wasn’t the one that missed her flight and had to run around the airport. Charged me to rebook the flight the next day, wouldn’t cover or compensate hotel nor car rides for being stuck in a different city. Then found out that they had misspelled my name on the rebooked ticket that took over an hour on the phone to fix. But the fun didn’t stop there, while I had paid for premium that included checking bags, they didn’t have the same level the next day but while not willing to refund the difference even, charged a me for checking in the bag. Still not done with their shenanigans, the next day, after we waited in line to go through security, once we made it there, the flight they had assigned to my wife’s passport was different than the one showing on the app so couldn’t go through, had to get out of the line and go wait on the checking bag line to get it fixed then go back to the security line to go through. Proof of the ticket and events were provided to their customer service and a week after supposed review, they admitted the fault and their offer was $250 credit towards the next flight with them, my tickets were over $2,000 for both of us. You couldn’t pay me enough to fly with this company. If this is the last choice to fly, I’m staying home.",-1
2024-07-21,0.1,Family Leisure,Economy Class,San Diego to Seattle,3.0,,1.0,,,3.0,1,never fly this airline again,False,   I had a horrible experience with this airline. The seats were pretty standard and the legroom was very tight. The were not that friendly either. I would never fly this airline again,-1
2024-07-08,0.1,Solo Leisure,Economy Class,Minneapolis to Seattle,3.0,,4.0,,,1.0,1,TRIPLE charged me for my suitcase,True," One of the airline employees at check-in was rude and TRIPLE charged me for my suitcase. She made 2 of the charges under bogus flight codes so Alaska Airlines employees “can’t find” the charges to cancel them. They blame my bank and take no responsibility for their own incompetent employees. So basically, I was overcharged $200 (billed $300 for 1 bag which should’ve been $100). If you must fly Alaska, be prepared for huge unnecessary bills and rude employees.",-1
2024-07-01,0.4,Couple Leisure,Economy Class,Nashville to Portland,3.0,2.0,2.0,2.0,2.0,2.0,3,"used to be much better"" ",False,"   My wife just returned from a conference in Nashville using Alaska Airlines #1269. Alaska used to be a much better airline as far as service, cleanliness and simple amenities. Her flight had a filthy bathroom (sometmes that happens) and one that had not been cleaned well for a LONG time. When you enter the bathroom and there is mold around the switches and sliders and mold on some of the contact surfaces you know that this plane had not a had a decent cleaning for many days or months. We used to prefer Alaska but lately we look for JetBlue, Delta and SW itineraries first.",-1
2024-06-24,0.1,Couple Leisure,First Class,Portland to Los Angeles,1.0,1.0,1.0,1.0,1.0,1.0,1,avoid this airline at all costs,True,"  We experienced 2 delays with the total just under 3 hours. We weren’t notified a single time. Denied lounge access as they had changed their policy after we had already booked our first class tickets with the intention of using the lounge. No meal vouchers offered during prolonged delay. Once on board our seats were dirty and not sanitised according to covid standards. Seats were covered in crumbs from past passenger, menus were torn and covered in food. Staff could not confirm if our special order meals were dairy free even though we had specially selected them for allergy reason. There was no access to entertainment and this could not be troubleshot. Our bags were not placed as priority so we were even later for the commitment we were attending. Customer service were very unhelpful and unsympathetic. They offered us a future discount code but we are not from America so it is of no use to us. We would not use this. I offered to be reimbursed with partnership flight miles to which they declined. Do your future self a favour and avoid this airline at all costs.",-1
2024-06-11,0.3,Solo Leisure,Economy Class,Anchorage to Sacramento,5.0,1.0,3.0,,,1.0,1,“customer service refused to hear me out”,True," As a handicapped mobility challenged paraplegic veteran I most recently was charged $150 extra for a luggage charge on one bag that carried my prosthetic mechanical leg braces, and catheters and misc. Other medical equipment I require. I was told there is no waiver for medical items and the customer service refused to hear me out. I was willing to open the bag and show them but to no avail and I was charged. I'm sick to my stomach thinking about it as I'm prepared to finish this trip on Alaska Airlines.",-1
2024-06-07,0.1,Solo Leisure,Economy Class,Los Angeles to Washington,1.0,,1.0,,,1.0,1,Do not trust Alaska Airlines,False,"   I traveled with Alaska Airlines on 06/27/2023 from Los Angeles to Washington. I had a terrible in flight experience as well as afterwards when trying to relay my concerns with the airline about my experience. In flight, they did not honor my first class ticket because first class was full. They also destroyed my luggage. I tried to negotiate with them for the damages for almost a year. Eventually I had to take them to court and I got judgement against them for the damages. Do not trust Alaska Airlines.",-1
2024-06-03,0.1,Solo Leisure,Economy Class,Dallas Ft Worth to Seattle,,,,,,1.0,2,customer service was horrible,False,   Worst airline ever!? They even have Spirit beat by a long shot. This was my first time flying them. Never again! Someone else booked my ticket and accidentally booked 6am instead of 9am. I have to work the night before and don't get off till 7am. Tried to call the airline to get a simple time change and was willing to pay any difference and they absolutely refused. The customer service was horrible. No people skills. I don't know why anyone would give this airline their money. I understand no refunds,-1
2024-06-01,0.1,Couple Leisure,Economy Class,San Diego to Fresno,1.0,,1.0,,,1.0,1,terrible experience every time,True,"  I have a terrible experience every time I use Alaska. Last summer I flew home from Vegas and for whatever reason, the flight was delayed after we all boarded. So we sat on the tarmac for a freaking hour in the Vegas heat. Then I got my luggage from baggage claim and it was damaged. A big hole in the side of my Samsonite luggage. When I try to report it, they wasn’t a receipt for what I paid. What person has a two year old receipt? Are you kidding me. Got delayed three times on my way to San Diego, and  I’m delayed again trying to get home. I am so over this airline. I only use them because I get free miles, but I’d much rather pay for something reliable. Never again",-1
2024-05-25,0.1,Solo Leisure,Economy Class,Bellingham to Minneapolis via Seattle,4.0,,2.0,,,4.0,1,no refund of anything,True,"  I put a sign on one of my carry-on bags, warning about a (fictitious) anti-theft device with an alarm inside of it, just to discourage bag-snatchers. TSA didn’t have any problem with the sign being on my bag, nor with what it said. Airport security at both BLI and SEATAC didn’t have any problem with it. No one at all on the first flight from Bellingham to Seattle (also Alaska Airlines) had any problem with it. And no one at the boarding gate in SEATAC had any problem with it. Then, when I got on the plane, as I was getting to my seat (at the back of the plane), a flight attendant asked me about it. I told them, then took the sign off of my bag and put it away - just in case - stored said bag in the overhead compartment, and took my seat. Two other attendants then came and asked me about the now removed sign, one at a time, and I repeated my explanation to each of them. A fourth attendant then came, and asked me to bring my bags “up front to discuss them” . This was a lie, as, when I reached the front, they walked me off of the plane, and told me that several passengers were “uncomfortable” with the sign. They then re-booked me, without my input, to a much later flight, which would cause me to miss the wedding I was supposed to give the toast at. After talking with Guest Services, I decided to head back home to Bellingham so that I could at least give the toast over FaceTime. However, doing so required the approval of two different supervisors in Guest Services at SEATAC to make happen, because the Customer Service rep (in Phoenix) said that they could neither change anything about the bookings nor refund anyof the round-trip ticket because of the first re-booking - despite the fact that said re-booking was done without my input. Regarding the two supervisors, the first confirmed that no noise-making capable devices are allowed on the plane, and the second said that signs such as mine that “might make some people uncomfortable” are not allowed either. Not that you’ll find either of those statements on the airline’s website, of course - I checked. And given that nobody on the first flight even mentioned it to me, I have my doubts about whether or not this was “official” Alaska Airlines policy. Long story short, don’t fly Alaska. They (apparently) reserve the right to selectively impose new rules based solely on people’s feelings, even if it disenfranchises their paying customers - and some of them will even lie to do so. Just to be clear, at NO point did anyone say anything about any Federal or State laws, nor was security ever involved, so I’m pretty sure what happened was all on Alaska. Including the fact that I’m getting nothing back from them - no refund of anything, nor even a voucher, not that I’d use the latter - in exchange for having my flight yanked out from under me.",-1
2024-05-23,0.1,Family Leisure,Economy Class,Orange County to San Francisco,1.0,1.0,1.0,1.0,1.0,1.0,1,a very upsetting experience,True,"  My family and I recently had a very upsetting experience with Alaska Airlines. Our Alaska Airlines flight was cancelled (no reason for the cancelation was given; it certainly was not weather-related) which caused us to miss our connecting international flight. No other flights were available that day, so we would reach our final destination 24 hours late. Consequently, we not only missed one full day of vacation, but we also incurred significant costs as we had to book a hotel room at the airport as well as another hotel room at the airport of our destination since we missed the ferry to get to our vacation rental. Not to mention that we lost out on our car and room reservations we already had and which we could now not utilize. Even though we, and especially our little son, were very sad and disappointed to miss one full day of our vacation, we stayed very patient. I am a frequent traveler and understand that these things can happen. When however, on the way back our Alaska Airlines flight was cancelled again, our patience ran thin. No other Alaska Airlines flight for the same day was available, so they had to reroute us to another airport which meant the additional expense for a long Uber ride plus a longer way home from the airport. When this flight was then delayed for more than three hours – we would now be home at three in the morning – I decided to go to the Alaska Airlines Lounge to ask for support. My son was exhausted and I wanted to see if we could sit down in the lounge for the long wait time, since it was freezing cold in the terminal. We didn’t even ask for food or beverages, just a place to sit more comfortably and warm, until our flight would leave. When the lady at the front desk of the Alaska Airlines Lounge refused any help and informed me that I would still have to pay a $30 fee per person, I was literally in tears – she showed no compassion at all! I asked if we could at least borrow a couple of blankets to get warm in the terminal, this was denied as well. Due to these two cancelled flights, we incurred additional costs close to $1,000 (for several hotel rooms, transfer costs, supplies, etc.), we lost one day of vacation on the way out and arrived home much, much later than planned. During this whole experience, Alaska Airlines did not provide any sort of support or compensation. I will never use their so-called “services” again and I advise strongly against flying with this airline, they do not show any consideration for their customers, not even children.",-1
2024-05-19,1.0,Solo Leisure,Economy Class,Seattle to Columbus,5.0,5.0,5.0,5.0,5.0,5.0,5,blown away by the service,False, Absolutely blown away by the service that I received - if you're looking to possibly fly with him or have options I would highly suggest booking them. I've flown many airlines and this is the first one that actually treated you like a customer down to earth employees and their flight attendants are actually extremely warm and welcoming,1
2024-05-16,0.3,Business,Economy Class,Seattle to Austin,3.0,2.0,2.0,3.0,3.0,3.0,3,lackluster at best,True,"  The flight attendants on my flight were lackluster at best. I was skipped over not once, but both times they passed by to provide snacks and drinks. Both times they blamed not being able to hear. This was my first time on Alaska Airlines and I'll have to be hard pressed to give them another try. Less than impressive experience for an already bad circumstance. I do not recommend them. Be ready to speak up and have the aisle seat folks ready to advocate for you. The attendants will ignore you.",-1
2024-04-10,0.3,Business,First Class,Juneau to Anchorage,3.0,1.0,1.0,1.0,1.0,3.0,1,Just really going downhill,False,"   First class services are stopping. No water, no glass, coffee cups, no snack basket, 1 drink if there is time in the 1.5 hour flight. Just really going downhill. They will lose customers with this cheap tactic.",-1
2024-03-05,0.2,Couple Leisure,Premium Economy,Fort Lauderdale to Portland,3.0,3.0,3.0,2.0,1.0,1.0,1,“I use this airline sparingly”,True,"  I had a bad experience on my return trip from Ft Lauderdale to Portland. The weather at FLL was rainy, but not terrible. Planes were departing and arriving. After pulling back from the gate we sat motionless for 15 minutes or so. The pilot came on to tell us we had a shortage of fuel, and this was due to the weather and it's impact to availability of fuel. We sat for another 30-45 minutes. During this time the pilot said due to the fuel shortage we would stop in Kansas City on our way to Seattle. After about an hour on the ground in FLL he came on again to apologize for the paperwork being very slow, some corrections that needed to be made to the new flight plans. The delays caused us to be 4 hours late in arriving in Seattle. Here's the problem with Alaska - 1. They lied to us. They don't prioritize honesty with their customers. The fuel shortage scenario he tried to explain was weak at best. It was raining = not enough fuel? Alaska sent me an email apologizing for the stop in KC, but said it was unavoidable due to stronger than expected headwinds. What really happened? Lot of us lost time and $ due to this. The official determination was wind, so no reimbursements for hotels or added costs to rebook. 2. they had a service failure followed by inability to make a service recovery. They were not prepared to handle the onslaught of people who needed help. A desk was there, we were not told where, we had to find it. 4 agents were there; they needed 10 to quickly deal with the problems. Seattle is their headquarters! They had 6 hours to prepare! I use this airline sparingly and will continue to do so. I have 1.8MM miles on Delta. I'm with them because they don't let stuff like this happen. They are professional, honest with their customers, and I've never been lied to.",-1
2024-02-09,0.2,Solo Leisure,Business Class,Seattle to Albuquerque,2.0,2.0,4.0,1.0,1.0,3.0,1,I will be avoiding Alaska Airlines,True,  Literally the only airline that won't let you in their lounge if you have a business class ticket. Even if you have a first class ticket you have to pay extra. Ridiculous. I will be avoiding Alaska Airlines at all.,-1
2024-02-02,0.1,Business,Economy Class,Portland to Las Vegas,3.0,,3.0,,,1.0,2,flight was delayed both ways,True," I had round trip tickets from Portland to Vegas, my flight was delayed both ways. Flight to Vegas was delayed 4 hours. My flight to Portland was delayed an hour so the crew could sleep. I understand sleep but you would have thought they could have posted the delay the night prior so the passengers could sleep as well but nope. Ridiculous!",-1
2024-01-06,1.0,Business,Economy Class,Spokane to Boise,5.0,,5.0,,5.0,5.0,5,first class customer service,False," On a business trip to Spokane, Washington, my return trip to Boise, Idaho was scheduled to leave at 12:30 in the afternoon. I arrived at the airport quite early and noticed they had an early flight at 9:00am. I asked the gate agent if I could switch my flight to the earlier one. The flight was light so they let me switch, at no cost, and they upgraded my economy seat to a first class seat, at no cost. This is what I call first class customer service. Good show Alaska Airlines!",1
2023-12-29,0.1,Couple Leisure,Economy Class,Pasco to Las Vegas via Seattle,1.0,,1.0,,,1.0,1,deeply unsatisfactory,False," Poor customer service and deceiving practices I recently had an extremely disappointing experience with Alaska Airlines' phone customer service. The representatives seemed uninterested in assisting, frequently hanging up the call or leaving me on indefinite hold. This neglect is unacceptable, particularly when travelers are seeking crucial information. Furthermore, there were misleading communications about flight delays. I was informed that my flight couldn't depart due to weather issues, yet there were no apparent weather problems. It's troubling to suspect that this may be a tactic to mask the mechanical issues with their older aircraft fleet. The apparent strategy of avoiding compensation by falsely attributing delays to weather is deceptive and unacceptable. Customers deserve honesty and transparency, especially when it concerns their travel plans. I strongly advise travelers to reconsider flying with Alaska Airlines. Their lack of responsible customer service and questionable operational practices warrant scrutiny. In summary, my experience with Alaska Airlines was deeply unsatisfactory, marked by poor communication and suspect practices. I urge potential passengers to be cautious and consider other airlines for their travel needs.",-1
2023-11-26,1.0,Solo Leisure,Economy Class,Miami to Portland,5.0,5.0,5.0,5.0,5.0,5.0,5,Everything was just fabulous,False, First time flying Alaska such a excellent experience! Everything was just fabulous. Happy to visit Oregon for the first time to celebrate my birthday 11/26.,1
2023-11-18,0.1,Family Leisure,Economy Class,Seattle to Nashville,,,,,,1.0,1,Messed up airline,False,"  Attempted to send my dog to Nashville, Alaska has canceled the flight twice, now they say I will need to spend another $200 on vet because the health certificate is only valid for 10 days. I will unfortunately be required to dyebib small claims to recover all of these vet costs that were required for the flights that were canceled. Do not rely on these idiots. The lady behind the counter just sat there grinning at me and refusing to speak to me. Messed up staff. Messed up airline. Avoid.",-1
2023-11-07,1.0,Family Leisure,Economy Class,Portland to Anchorage,5.0,5.0,5.0,5.0,5.0,5.0,5,"agents who obviously care so much"" ",True,   Alaska Airlines has shown up for us in so many different ways on so many occasions that I felt I really just had to share how grateful I am to have such a quality airline up here. Thank you to the agents who obviously care so much.,1
2023-11-06,0.1,Couple Leisure,Economy Class,Seattle to San Francisco,2.0,1.0,1.0,,,1.0,1,“communication was sorely lacking”,True," I recently flew with Alaska Airlines from Seattle to San Francisco and was dismayed by a 3-hour delay. Not only did this disruption cause significant inconvenience, but the communication from the airline was also sorely lacking, leaving passengers confused and frustrated. As a result of this experience, I'll try avoiding my future flights bookings from Alaska Airlines. If you want to have a reliable flight then I would recommend avoiding Alaska Airlines.",-1
2023-10-30,0.3,Solo Leisure,Economy Class,Newark to Los Angeles,4.0,1.0,3.0,1.0,4.0,1.0,2,Never encountered ruder gate workers,False,"  Never encountered ruder gate workers. They spoke to every customer like they were annoying children. I asked a question regarding my seat, I was asked to come back in an hour. When I returned an hour later the lady started to help me and the guy next to her screamed that he had already told me once to come back later. Which I had done. Uncomfortable and unnecessary. It’s not hard to talk to people nicely and give clear instructions. Saving grace is in flight outlets, wifi and cabin crew. Food is terrible.",-1
2023-10-27,0.1,Family Leisure,Economy Class,Seattle to San Francisco,3.0,2.0,4.0,2.0,2.0,1.0,2,Our check-in bag was badly damaged,False,"  Our check-in bag was badly damaged. After documenting and filing a report, Alaska returned with an offer of $100. This is not enough to replace our current size bag let alone any hard case bag. I called them up and ask how am how suppose to replace my large hard luggage for $100, All they could say was that it was there policy that if you don't have a receipt of luggage purchase they only refund $100. Yet they couldn't show me where it says that on their policy. I was on another airline and they let me choose a replacement bag. I would really not recommend flying with them if you need to check your bag in!",-1
2023-10-23,0.4,Business,Business Class,Orlando to San Francisco,1.0,1.0,2.0,1.0,1.0,2.0,1,never book again with Alaska Airlines,True,"  No business lounge or pay for it. Seats are terrible, no leg room 6 hrs sitting in a glorified armchair. Terrible food will never book again with Alaska Airlines.",-1
