datePublished,ratingValue,travellerType,seatType,route,seatComfort,foodBeverage,cabinService,inflightEntertainment,wifiConnectivity,groundService,valueForMoney,commentHeader,tripVerified,reviewContent,sentiment
2022-04-06,0.1,Solo Leisure,Economy Class,Seattle to Phoenix,1.0,,1.0,,,1.0,1,full fare paying customer lower than an upgrade,True,"  I buy a seat in First Class, 2F, on Alaska Airlines for my wife to travel back and forth between Seattle and Phoenix so she can escort her 90 year grandmother. When she goes to board the plane they moved her from row 2 to row 20 in coach. Why? Because a seat in row 1 broke. What you say, that was not her seat, your right. They moved the person from row 1 to row 2 and moved my wife to row 20. Her reservation was not an upgrade from my MVP Gold 75K account, it was a full fare cash purchase. Apparently, per the gate agent, they rank first class customers and she was the lowest ranked customer so she gets coach. Really, there was no one in the other 15 first class seats that was an upgrade. No one purchased a seat after hers was purchased nearly eight weeks ago. You are going to tell me there was no last minute seat purchases or 48 hour upgrades. Ranking a full fare paying customer lower than an upgrade? Over the years the treatment from Alaska Airlines has deteriorated more and more. My mileage account is over 20 years old, Gold or higher for five years, over a millions miles in our combined accounts. I remember what a treat it was to fly Alaska versus United or American, that does not seem to be the case anymore. All my friends tell me I should move over to Delta now that they have made Seattle a hub, maybe they’re right. Might be time to try Delta for the next few years! What does Alaska Airlines say, sorry.",-1
2022-04-05,0.8,Solo Leisure,First Class,San Francisco to New York,5.0,5.0,5.0,5.0,5.0,4.0,4,a great flight with Alaska,True,"  Alaska's new lounge in SFO was great. Boarding commenced early and I flew on one of Alaska's beautiful ""more to love"" special livery A321s. Seat was very comfortable and A321 Neo is a great aircraft to travel : less engine noise, better cabin pressure etc. Our purser Becky was one of the best I've met in the skies: passionate and always attentive and always remembering the need of her guests. Wifi was a bit expensive, but worth the price, with streaming videos possible at 38000 feet. IFE was delivered through the onboard network and free messaging was available, which many passengers took the advantage of. Overall a great flight with Alaska.",1
2022-04-05,0.7,Solo Leisure,First Class,New York to San Francisco,5.0,5.0,5.0,,1.0,3.0,4,purser in charge was super attentive,True,"  I flew from New York to San Francisco to conclude my spring break trip. Terminal 7 at JFK should be demolished: outdated, and unpleasant. No expedited security lines were available for first class passengers. The lounge was nice, staff was attentive and it was a welcoming environment. Our flight started boarding early and it was a nice new 737 Max 9 flying us across the country for the 6 hour flight. The captain was informative, letting the passengers know that they had problem get the wifi working and apologized several times for it, which the purser did as well, later on in the flight. Flight deck crew also informed us estimated take off time when we were in line, and every time there were turbulences they would make a quick announcement asking the passengers to wear their seat belts. The purser in charge was also the first class dedicated FA and he was super attentive, went by numerous times to check on us to see if there were any requests, and even gave me his stash when we were short on sanitizing wipes onboard. Food was perfect onboard, especially the dessert, and the flight concluded with a 30 minute early arrival at SFO.",1
2022-04-04,0.1,Couple Leisure,Economy Class,New York to Seattle,,,,,,1.0,2,they were super unfriendly,True,"  My Alaska Airlines flight was cancelled due to a pilot strike and the notifying email I received the night before framed the whole thing as a ‘change in my itinerary’ and that they would ‘help me by providing me with a new flight 24 hours later’. I went to the airport anyway, in hopes I would be able to get on an earlier flight, but they were super unfriendly and declined me any help, despite tickets still being available for the earlier flights. Alaska Airlines is purely profit driven and does not care for its consumers, nor workers apparently. This whole ordeal cost me more than $1000, because all my plans and hotels that day fell through, and they did not compensate in any way. I could not recommend this airline less.",-1
2022-04-04,0.4,Business,Economy Class,Seattle to Raleigh Durham,2.0,2.0,2.0,3.0,3.0,1.0,1,Alaska has not been proactive,True,"  Lost bags cancelled flights, delayed departures and now a strike. As demand has increased Alaska has not been proactive. Pay your pilots, hire more staff and remember your customers have other options. Gold member for 20 years and I'm now moving to Delta. Their skymile program is every bit as good and service is currently superior.",-1
2022-04-03,0.1,Family Leisure,Economy Class,Oakland to Dallas,,,,,,,1,Worst cancelation policy,False,"  Worst cancelation policy ever. My flights is in 5 months, I booked it less than 48 hours ago and found out the flight time needed to be changed. With Alaska this is not possible. No customer support, hold time states 4-5 hours to talk with someone. Fighting the change on my CC since i have no other way to resolve. I would have gladly changed to the earlier flight but instead have to go through this nonsense. I will never again give them business",-1
2022-04-01,0.1,Couple Leisure,Economy Class,Los Angeles to San Francisco,,,,,,1.0,1,I will never fly Alaska again,True,"  This morning my parked car was hit and we ended up missing our flight from LAX to SFO. I called Alaska to notify them we would probably miss our flight and couldn’t get through to an actual human. We arrived at the airport to speak with the front desk and they couldn’t find our original reservation, it took the woman 40 minutes to figure out our original flight details. Then the woman made a call and informed us she couldn’t put us on the next flight or any flight. That we had to book a new reservation. I originally paid $107 for a round trip flight and she wanted me to pay $240 for a one way ticket from LA to SF. $240 per person for a one way flight to travel 380 miles. We didn’t have the money for that. I will never fly Alaska again.",-1
2022-03-24,0.1,Couple Leisure,Economy Class,San Francisco to Las Vegas via Seattle,1.0,,1.0,,,1.0,1,The worst experience ever,True,"  The worst experience ever. Our direct flight had been cancelled and alternative flight was booked with over night stay, had to call customer service to get a better flight, didn’t have any suitable options. The best one was to fly from San Francisco and have a change in Seattle to go to Las Vegas. At Seattle had to wait for 30min for one of the crew members as she was running late, unacceptable! Ruined our first day plans in Las Vegas.",-1
2022-03-23,0.9,Solo Leisure,Economy Class,Portland Oregon to Salt Lake City,3.0,4.0,5.0,,,4.0,4,I'm really grateful to them,True," I see a lot of bad reviews but I can say that I made it about 10 minutes after boarding, and the staff was nice enough to print my boarding pass at the gate instead of giving me a run around so I could make it onto my flight! They understood I'm human and in a rush so I'm really grateful to them. They dimmed the lights since it was early morning and the attendants made sure to keep their volume down and came by to collect trash twice. I saw nothing wrong with Alaska Airlines.",1
2022-03-15,0.1,Family Leisure,Economy Class,Anchorage to Seattle,1.0,1.0,1.0,1.0,1.0,1.0,1,seats most uncomfortable,False," Anchorage to Seattle. Our last flights to and from Anchorage were horrible. I have never flown Alaska Airlines and never will again. The staff was rude, the seats were the smallest and most uncomfortable ever. We travel often and this is by far the worst airline I have ever been on.",-1
2022-03-10,0.2,Couple Leisure,Economy Class,Tampa to San Francisco,2.0,1.0,2.0,2.0,2.0,1.0,1,Don’t waste your time,True,"  Alaska Airlines is bottom tier for flying. I have been flying back and forth from TPA/SFO frequently the last two years and this company just takes the cake for the worst! I paid extra for a direct flight for it to be changed to the most inconvenient times to cater to their needs with no concern or condolence to myself and my family. When you pay extra for a direct you would expect it to be direct not a 10 hour flight stopping at Seattle to then go to SFO. We now come in a day late and leave a day late leading to me missing work and they simply “couldn’t do anything for me”. This company is strictly about the money and doesn’t care if you’re satisfied, I’m writing this review for others. Don’t waste your time.",-1
2022-03-03,0.1,Couple Leisure,Premium Economy,San Diego to Cabo,2.0,2.0,1.0,3.0,1.0,1.0,2,dissatisfied with the treatment by them,True,  This is the most disappointing flight I have ever flown. I’ve always thought Alaska was decent with customer service but not after this flight. I was asked twice to put my mask on and both times I was greeted by utter anger and disgust. I’ve complied both times because I understand the rules. The problem wasn’t that I had to comply. The problem was that the way they go about accomplishing this is not even remotely nice or courteous in the slightest. For this reason I’m writing this review and I have to say not all flight attendants on the flight were bad or behaved wrongly. Just the two that were looking for someone to argue with. I’m not even a contentious person by nature! Very dissatisfied with the treatment by them to others on the plane as well.,-1
2022-02-25,0.3,Solo Leisure,Business Class,Portland to Seattle,3.0,,4.0,,,2.0,2,massively disappointing the past year,True,"  Alaska has been massively disappointing the past year, I have been re-routed, lost baggage and once even had to exchange seats with a woman so I could sit with my 10 year old child. I run my business through their credit card and even as an ""elite MVP"" I still get horrible service. I would suggest Delta if you are a frequent flyer. I have never had issues with this airline and they have great customer service.",-1
2022-02-21,0.2,Family Leisure,Economy Class,Boston to Pasco via Seattle,3.0,,3.0,,,1.0,1,Worst service delay,True,  Worst service delay due to technical reasons. Wait for 12 hours with a 3 years old. Autistic. Baggage get lost. Going back and for to airport. And I don’t find any help. 2 days waiting for my luggage. And no answers.,-1
2022-02-20,0.1,Solo Leisure,Economy Class,Phoenix to Anchorage,,,,,,,1,This flight never happened,False,"  This flight never happened. I was on my way to Alaska from phoenix for a funeral. After being texted about a delay which would make me miss my connecting flight to Anchorage form Seattle, I called customer service. they found a flight that left at 7:54 pm (current time 6pm) I was still at work but was able to get off work early to make this flight. Customer service mistakenly told me terminal 4 when it was actually terminal 3. by the time I found my way to the check in area I was 9 minutes late to check in. Mind you the flight still had over 40 minutes before it took off, they refused to do anything to help me. After refunding my, only the airline miles part of my ticket they said they could have re booked me if I hadn't gotten a refund. Mind you they said there were no flights and nothing they could do before I asked for the refund. I got home and checked every other airline and there was nothing available of course. This morning I called customer service to make sure they refunded the cash portion of my trip and they hadn't. I finally got all but the travel insurance refunded. I wouldn't recommend  trusting Alaska airlines with anything important.",-1
2022-02-15,0.2,Couple Leisure,Economy Class,Anchorage to Seattle,,,,,,,1,Horrible horrible service,True,  I purchased a ticket last year then had to stay home due to a death. I was only given the option of a wallet refund and did not read the fine print. My $900 has expired and these were cash funds. This is horrible and in my mind theft. If it was some sort of credit I’d understand but this was cash. I then sat on hold for 2 hours with no answer. Horrible horrible service.,-1
2022-02-14,0.1,Family Leisure,Economy Class,Seattle to Atlanta,3.0,,3.0,,,2.0,2,couldn’t believe how slow the line was,False,"  Back in September 2021, my wife and I bought a round trip flight to Seattle, WA from Atlanta, GA with our 1 year-old son for Christmas with my family. Our flight details got changed a few times, but it wasn’t a big deal. Our experience at the Atlanta airport was smooth and virtually frustration-free. After we boarded our plane for Seattle, we had to wait about an hour to take off, but it wasn’t a big deal. Our stay in Washington was great, but it was record-cold and we had 10 inches of snow come down. The night before our flight, we tried to change our tickets because we knew we wouldn’t be able to make it to the airport with the snow and black ice. We tried changing them online, but it wouldn’t let us confirm our change of flight. We had Saver tickets, so normally Alaska doesn’t allow those with Saver tickets to change their flights, but they had a flexible travel policy established for the holiday season. Apparently that doesn’t apply to Saver tickets? It was incredibly frustrating. We stayed up nearly all night trying to get a hold of a customer service agent to talk about our situation, but after being on hold for two hours the line automatically hung up on us. So we canceled the flight. What else were we supposed to do? We were given refunds, so we used the money towards tickets a week from our initial return date, but the tickets were twice the price as the originals. Turns out that Alaska canceled our flight only a few hours after we had canceled our tickets. We figured we could call Alaska after the holiday season and get a refund for the extra charge, considering the extenuating circumstances. Anyway, we scheduled our flight for the morning so that it wouldn’t interfere with our 1 year-old son’s bedtime. The day of the flight comes and our morning flight for 9:15am is canceled and we get stuck on a 3:35pm flight. With a 5 hour flight, and a 3 hour time difference, that would put us in Atlanta at 11:15pm or so. This was incredibly frustrating. We got to the airport about 2 hours before our flight was supposed to leave and went to go get our bags checked. We had checked them online, like the email told us to do, so we figured we could print our bag tags from one of the kiosks and be on our merry way. However, it turns out that if you check your bags from home, you can’t use the kiosks to print your tags and you must wait in line to see an agent who can help you check them. We only figured this out after 30 minutes of trying to print our tags at different kiosks and decided to flag down an agent who told us we had to wait in line. Which line? Well, they never told us, so that was fun to figure out. (Side note: Seattle airport is the hub for Alaska Airlines. You would think that it would be a smooth check-in process). We had to wait an hour in that line to get our bags checked. We figure at this point, we’re going to miss our flight because there’s no way we’re going to make it through security in 30 minutes. We couldn’t believe how slow the line was. It took each agent an unholy amount of time to check bags for a single person. It was ludicrous. Fortunately, they did let us skip a big portion of the security line because we had a baby and a stroller. We rush through security and get stopped because of the baby butt paste we had in our son’s diaper bag. Weirdly, this was the most pleasant part of the airport experience.",-1
2022-02-13,0.1,Business,Economy Class,,,,,1.0,1.0,,1,would not stand behind their sales,True,"  In January, 2022, I booked a flight on Alaska Airlines site, then booked a hotel on Alaska Airlines site. Alaska Airlines later cancelled the flight at the last minute resulting in me not being able to get to the hotel of my destination, I had to pay another hotel fee in a city I was re-routed to and Alaska would not refund me the missing hotel night because of their cancellation, citing it was the hotel policy. I found that to be unacceptably deceiving and dishonest. I did not have any interaction with the hotel, my transaction was with Alaska Airlines  I did not cancel Alaska nor the hotel, Alaska Airlines took both money from me then failed me on both fronts, yet it did not take any responsibility for the consequences, let me take the missing hotel financial loss, in addition to the total disruption of my schedule. The lesson learned is that Alaska Airlines would not stand behind their sales.",-1
2022-02-13,0.1,Solo Leisure,Economy Class,San Francisco to San Diego,,,,,,1.0,1,too late and the doors were closed,True,"  No gate info posted online or at airport (checked every 30 min all afternoon). Got through security with 1.5 hours to spare. No gate listed on displays. Continue checking phone and signs every 30 minutes. When it was only 30 minutes left until gate closing, I started checking every 10 minutes on my phone. With 10 minutes left, it finally showed the correct gate. I went directly to the gate which was less than 100 feet away from where I was. They said it was too late and the doors were closed, despite there being 10 minutes left until gate closing on boardIng pass. Extremely combative and rude: I had three agents arguing with me, one of them mocking me by speaking into a microphone and asking if I could hear it, and saying it was my fault for not going up to the gate and asking (when there was no gate given). Another told me it was impossible to seat me and the plane had already left, which was a clear lie (10 min before gate closed). A third said, “You just showed a screenshot of your boarding pass, do you have the app??” as if I were a liar and had faked my boarding pass. There were additional insane arguments, but I’ll spare you. I believe they gave my seat away because they had asked for volunteers to give up seats in a previous email, which I did NOT agree to.  Took no responsibility for the lack of gate information. No matter what the prices look like, it’s not worth dealing with these horrible people.",-1
2022-02-11,0.1,Family Leisure,Economy Class,Kona to Tampa via Seattle,1.0,1.0,1.0,1.0,1.0,1.0,1,getting treated like garbage,True,"  I was flying to make final arrangements for my mother's funeral. When my first flight landed it was on time but they would not allow us off the plane for over a half hour which caused me to miss my connecting flight. When I tried to get them to get me on a new flight the lady in Seattle told me she couldn't get me to Tampa until after my mothers funeral. I told her the circle and she got an attitude with me, rolled her eyes and said she didn't have any other flights. At that point luckily someone with an ounce of compassion came along and got me a flight getting me to Tampa 7 hours late (at 11:40pm) They switched me to United and said they'd have my bags switched too. Well when I arrive to Tampa no bags. I went to their office and it was dark, locked and I could see my bag inside. It has my outfit for the funeral and shoes. I tried to call and it was a 2 hour wait to get a call back by yet another rude representative. Never fly Alaska Airlines unless you enjoy getting treated like garbage",-1
2022-02-07,0.1,Family Leisure,Economy Class,San Luis Obispo to San Diego,2.0,,2.0,,,1.0,1,don't expect any support if you miss your flight,True," Worst flight experience of my life (and I travel for work!). I was traveling SBP-SLO with a flight at 10.45am. Since I had no checked bags (despite traveling with a 1-year-old!) and already had my seat and boarding pass on my phone I arrived at airport an hour ahead of time. Waited in a long security line. Once at front was told I had to go to the check-in counter to print my pass and the printer was broken so I had to wait for some time. Once printed I was told to go back through security. There was a very long line but I made it to the gate 15min ahead of departure time. However, no one was there and once someone was retrieved I was told the door was just closed and they would not reopen. There was only 1x flight on this route per day and the next flight was not until the same time next day. My complaints: No announcement about the flight was heard (or even made?) in the security area. No attempt at all was made to ensure those who had checked in at the airport made the flight (I was not the only one to miss the flight). No apology was made - I was told to either rent a car and drive to Santa Barbara or wait for a flight the next day, which they made sound like I should be thankful they booked for me. No acknowledgement of the airline being at fault for any of this or desire to improve. I called to request a full refund given that I had to rent a car to drive to San Diego that night. They told me I should have canceled the flight that they had rebooked for me 24hr in advance, you mean before the flight was even re-booked? And that booking was made under the pressure of the moment with a screaming 1-year old in my arms while I was trying to consider how to make work the next day? And responsibility ultimately lay with me. I had to be back home for work which is why I had to rent a car and drive, but more than that, this is a flight I was hoping to take monthly in the future. If traveling with Alaska arrive well ahead of time and even then don't expect any support if you miss your flight due to airport - or airline-related failures. I have never had such an unpleasant experience with any airline and I'm frankly shocked that zero effort was made to account for paying passengers who were checked-in at the airport before a flight even began boarding.",-1
2022-02-05,0.1,Solo Leisure,Economy Class,Idaho Falls to Seattle via Nashville,1.0,1.0,1.0,1.0,1.0,1.0,1,staff at their guest services were no help,True,  My flight due to inclement weather on 2/3/22. Got rescheduled to 2/4. Got put on a stand by list for an earlier flight for today 2/4. And my name got shifted to number to 22 compared to 21 previously. Number 1-21 Got to fly. Now I have missed a family death. Thanks Alaska. My first time flying with them results in my last. The staff at their guest services were no help. I was told to call customer care. I waited on hold for 3 hours only to be belittled by the representative because I didn't call the insurance company due to my issue. Even though every rep in the airport didn't mention that and said my issue needs to be resolved by customer care.,-1
2022-01-27,0.2,Family Leisure,Economy Class,Seattle to Honolulu,,,,,,,1,I am never booking Alaska Airlines,False, It’s been weeks and I still have not heard back from anyone! I have been attempting to call about my expired credits since before they even expired. $1374.40 is a lot of money to me and my family I have attempted several time before and after Dec.31. I was attempting to used my credits to book a trip to Hawaii for Valentines Day for my wedding Anniversary. I sat in queue for a callback yesterday and several other times during the month of December. For example I made my call at around 4 o’clock yesterday I wasn’t called back until 2 am. I was told in December if my need was not immediate then to call back do to inclement weather. After this experience I am never booking Alaska Airlines.,-1
2022-01-19,0.2,Couple Leisure,Economy Class,Portland to Sydney Australia,3.0,,1.0,,,1.0,1,don't give Alaska Airlines your money in any way,False,"  I've been an Alaska Airline member for twenty-three years. I signed up for their credit card with one thought in mind - getting to Australia first-class for a prolonged vacation. My wife and I booked cruise tickets for 2020. Six months beforehand, I tried to get tickets but there were no FC tickets available. I was told I waited too long. So, we delayed the trip (probably a good thing thinking about it) so as to get tickets the day they opened. Lo and behold, no first-class tickets on the very first day I could book travel. This time I was told that I was too early and that they could only release tickets that they were given by partner airlines (eg none). I complained and was politely told that they only had to honor the mile for tickets that were ""available"" which they defined as those given to them. Now, having waited for my grievance to be heard, there are no more coach tickets available. And only on the days that my wife and I want to fly and two days on either side (what a coincidence). What I've been able to glean from case law, the airlines can promise whatever they want and change the rules whenever they want (and the courts back them up). That is almost the textbook definition of bait and switch. Don't get reeled into this insanity, and don't give Alaska Airlines your money in any way.",-1
