datePublished,ratingValue,travellerType,seatType,route,seatComfort,foodBeverage,cabinService,inflightEntertainment,wifiConnectivity,groundService,valueForMoney,commentHeader,tripVerified,reviewContent,sentiment
2020-01-13,0.1,Family Leisure,Economy Class,Indianapolis to Spokane,,,,,,1.0,1,denied access to my flight,False,"  Indianapolis to Spokane. Was denied access to my flight because it was delayed and hour and 15 minutes and didn’t show up till an hour before my flight. Was told they were closed and they weren’t checking bags anymore. She then told me that when my flight is delayed I’m still expected to show up an hour before the time my flight was supposed to be there... so TWO hours before my flight, with two kids under the age of five? If that was their policy they should have texted me that too when they texted me saying my flight was delayed! Missed my flight and therefore missed a very important day of school but I guess it’s my fault for flying Alaska... never again!!!",-1
2020-01-05,0.3,Solo Leisure,Economy Class,Seattle to Omaha,2.0,,4.0,,,2.0,2,Flight delayed 3 times,True,"  Seattle to Omaha. Very disappointing. Flight delayed 3 times with no explanation given. Then, sat on the plane waiting for luggage to be loaded another 45min. Weather perfectly fine in both locations. Missing work because of these delays",-1
2020-01-05,0.7,Solo Leisure,Economy Class,Honolulu to Dallas/Fort Worth via Seattle,3.0,2.0,4.0,4.0,,4.0,4,one of the better US-based airlines,True," Honolulu to Dallas/Fort Worth via Seattle. While US-based airlines often lag behind their international counterparts in terms of providing modern amenities and efficient and pleasant customer service, it has been my experience that Alaska is one of the better US-based airlines. I've flown them over the last five years and always have had positive experiences. Their economy seats aren't exactly luxurious, but their planes have always been extremely clean. Their flights, sans their puddle-jumper ones, usually have a great assortment of on-flight entertainment. Staff, whether at check-in, the gate, or on the plane, are almost always pleasant, courteous, helpful, and professional. The only exception was the gruff and rather odd check-in agent in Honolulu (no surprise, it's a terrible airport with miserable staff) who was skeptical about accepting my checked bag because of something on my boarding pass that he couldn't really articulate, but, nevertheless, he demanded to see my driver's license. I have no idea what that was all about and what his problem was, since I entered my name, address and TSA Pre-Check details correctly when I booked the flight. Otherwise, the check-in processes, whether online or at the airport, are normally efficient. The one time I was delayed on Alaska, about three years ago, the staff handled passenger inquiries with class and professionalism - much more so than I would expect on airlines such as United, American, Spirit, and Southwest. Their prices are often competitive with the likes of United and Southwest, especially for West Coast flights. It's a shame that Alaska focuses primarily on the West Coast, plus Chicago, Dallas and New York, because, based on my experiences, they'd be a great travel host for foreigners touring the U.S. Just try to avoid the odd check-in dude in Honolulu.",1
2020-01-02,0.1,Family Leisure,Economy Class,Medford to Seattle,,,,,,1.0,1,They should be ashamed,False,"  Medford to Seattle. Never flew, they kept us waiting know full well we'd never fly out that night. When we asked for a refund and vouchers for a hotel and gas see as how we drove 2.5 hours to get to Medford we were given nothing. When I told them that wasn't acceptable they called the cops and called me threatening? It's now 12:06 in the morning and we have just now got a hotel. We are a family of 5, my girls being 3, 6 and 11 they left us stranded in their parking lot for hours. Alaska Airlines is garbage I paid well over $1000 for this trip to them alone and this is how we are treated. They should be ashamed of how they treated us.",-1
2019-12-30,0.2,Solo Leisure,Economy Class,Juneau to Las Vegas via Seattle,1.0,1.0,3.0,,,1.0,1,Very unprofessional,True,"  Juneau to Las Vegas via Seattle. Juneau needs Delta Air Lines again, or anything else. Very unprofessional. I am unsure if they checked the plane before leaving their last location, but somehow the engines were not working 100% when they were trying to leave Juneau, yet they did not check this before boarding everyone and making them wait 2 hours before letting them back off in Juneau. This has caused wasted time of my very short and expensive trip! Very unhappy.",-1
2019-12-30,0.1,Solo Leisure,Economy Class,Denver to Seattle,1.0,1.0,1.0,1.0,1.0,1.0,1,Basically buy another flight,True,"  Going to 49ers vs Seahawks in Seattle. NFL changes game from 2:25 afternoon to the Sunday night game. To change my flight because of this $193. The flight leaves and hour and 15 minutes late. One of the engines gets a 'fuel leak' and we stop in Boise. After waiting 3 hours we are told there are no flights going to Seattle, call reservations for help. Basically buy another flight tomorrow or go with someone else? So no its $193 to change the flight because NFL changed the time of the game, and then  you're stranded here all day, lose out on the hotel you booked in Seattle and go buy another flight? The attendants working the desks super rude, did nothing for me when I walked up for help/update.",-1
2019-12-28,0.4,Solo Leisure,Economy Class,Oklahoma City to Spokane via Seattle,4.0,3.0,4.0,,2.0,1.0,3,I don't recommend,True,"  Flight from Oklahoma City to Seattle was sub-par. Decent service but poor internet service. My nightmare came true after boarding my connecting flight to Pullman. After everyone had boarded, the captain came over the intercom to announce the flight was cancelled due to weather. So we deplaned, and were advised to go to the customer service desk near the gate. Low and behold, there was a long line. It took me roughly 90min to get to the front of the line. During that 90min wait, I was automatically rebooked to the same flight the next day, which I was not about to risk another cancellation. When it was my turn to get helped, the agent said there was no other alternative. He ""claimed"" all nonstop flights to Spokane were overbooked, Spokane via Portland and/or Boise were sold out. I did a search on the Alaska Air app and saw he wasn't telling the truth. I saw there was room in economy on a Seattle-Portland-Spokane flight, and he wouldn't rebook me to those flights because it was ""inaccurate"". He told me to take my current rebooking or leave it in the rudest tone. They wouldn't even accommodate a hotel reservation, and expected me to wait in the airport for over 24hrs to board the flight I was rebooked on again. I wasn't about to do that, so I reserved a room at a nearby hotel. I didn't leave the airport until almost 2am at this point on Xmas Eve. At the hotel, I was given the number for customer care by a very nice woman. I called, requested a call back due to extended wait times. I was called back, and the agent was very helpful. I told him what I've experienced, how aggravated I was and how the agent at the airport couldn't rebook me because of inaccuracy. Surprisingly, he was very sympathetic about how I didn't want to risk getting on the same flight and have it cancelled again. He went above and beyond by getting me on a seat on a late morning Spokane flight in first class. I was thankful for his generosity. I still have a flight from Pullman to Oklahoma City via Seattle I need to take after New Years. However, regardless of what I experience during that trip (hopefully nothing like what I experienced on the way to Pullman), I'm very certain I will never fly Alaska again after what I experienced. I don't recommend anyone fly this airline until they get their act together.",-1
2019-12-27,0.4,Family Leisure,Economy Class,Los Cabos to San Diego,1.0,1.0,1.0,1.0,1.0,1.0,1,will not be flying again with you,True," Los Cabos to San Diego. My wife and children (7, 9 and 12 years old) and I have been at the airport since checking in at 12pm. Told by the airline rep that the flight is delayed from 3.40pm to 4.40 pm. It’s 5.09pm and no one had the courtesy to advise us and the other passengers that the flight was delayed until 8.20 pm that is, in excess of 5 hours. Only found that out through the internet. Went to speak to the airline rep to be told it is what it is! Love to spend my last day of holidays sitting at an airport in Mexico not knowing what the heck is going on with 3 restless, tired and hungry children. Thank you Alaska Airlines I will definitely will not be flying again with you and recommend you to my acquaintances.",-1
2019-12-25,1.0,Couple Leisure,Economy Class,Phoenix to Everett via Santa Ana,5.0,,5.0,,,5.0,5,impressed with their customer service,True,  Phoenix to Everett via Santa Ana. I had to rebook with Alaska Airlines because of a delay of another airlines. Because of this my luggage was lost. I dealt with Alaska Airlines at each stop. I am writing this because each associate went above and beyond to help me locate my luggage. Three people were in contact making sure I was helped. They located my luggage and had it delivered to me within two days of my flight. I am so impressed with their customer service. Thank you to all of you who helped me.,1
2019-12-25,0.9,Family Leisure,First Class,Los Angeles to San Francisco,5.0,4.0,5.0,,,4.0,5,a very pleasant experience,True,"  Los Angeles to San Francisco. Overall, a very pleasant experience on Alaska on this short flight between LAX and SFO. Excellent service at LAX check-in, as well as in the Alaska lounge at LAX, and once on board the plane. I usually hate US domestic flights, but this one was really a pleasure from start to finish. Well done, Alaska!",1
2019-12-24,0.1,Family Leisure,Economy Class,Lihue to Medford via Portland,3.0,3.0,5.0,2.0,1.0,4.0,1,airline is extremely disorganized,True,"  Lihue to Medford via Portland. 30 hours and counting still not sure if we are going to make it home. In Lihue, Kauai our plane needed a fuel filter. We sat with two children (3 and 6 y.o) for a 4 hour delay. Boarded the plane then the only tug broke down after hooking up to our plane. Sat for another hour. These delays caused us to miss our connections. We were told our hotel vouchers would be awaiting us in Portland. After landing at 115 a.m the Alaska desks were a ghost town. We finally found someone to help at baggage desk. We were booked on the 7 am flight next day, given cab vouchers, and a hotel room. The cab vouchers were for a company that does not run 3 am, we had to uber. Before we left another employee calls us back to the desk to inform us the 7am flight had been canceled due to lack of a crew so our only option was 4PM or 630p.m! Mind you we did not have access to our clothes or toiletries. I am now sitting at the airport in Portland awaiting the 4 pm flight.. We have just been informed that they don't have a pilot to fly our plane.  We are now scheduled to hopefully leave at 545. The staff has been very nice and have attempted to make things right and I have tried to keep my patience. It just seems as though this airline is extremely disorganized.",-1
2019-12-23,0.1,Solo Leisure,Economy Class,Portland to Medford,1.0,1.0,1.0,1.0,1.0,1.0,1,customer service is poor,True,"  Portland to Medford. The worst airline ever. If your looking for them to change your flight time 2 to 3 time then definitely book with them. The customer service is poor and could care less about its customers. And trying to get a refund or any compensation for the poor service is next to impossible. Unless you consider a meal voucher, (which is 12 dollers and not food or alcohol) as good compensation then your better taking your money elsewhere.",-1
2019-12-22,0.1,Family Leisure,Economy Class,Kauai to Seattle,1.0,1.0,1.0,1.0,1.0,1.0,1,fly with someone else next time,False,  Kauai to Seattle. First off they delayed our flight until 3am. We couldn’t do that because we have a 1.5 year old child. When we finally got on a flight the next day they were delayed again for 3 hours. After we got to Seattle we sat on the tarmac for 2 hours waiting to get to a terminal. They kept telling us we were going up there but we never moved... all the while everyone on the plane was breathing in gas fumes from the other planes. The last thing you want to do is sit on a flight for over 2 hours after a 6 hour flight! I say fly with someone else next time!,-1
2019-12-22,0.1,Solo Leisure,Economy Class,Los Angeles to Seattle,2.0,3.0,1.0,2.0,4.0,1.0,1,excuses upon excuses,True,"  We landed and then sat on the taxiway with no word from the cockpit except for ""folks this should only take 5 minutes to wait for the gate to clear."" Cut to over an hour later and we're still just sitting here. My friends who took a separate Alaska flight from the same terminal at LAX which departed after our flight had already taken off have been sitting in the terminal waiting with their checked bags already collected. All we're getting is excuses upon excuses for why they cant simply bring us a jetbridge or deplane in another fashion. Nobody wants to take an responsibility and its frankly disgusting. Whoever was in charge of scheduling Alaska flights through Seattle on 12/20/19 deserves to be fired, absolutely unacceptable, I'll fly delta next time as i am watching several of their planes lands and taxi to the gate with no issue.",-1
2019-12-22,0.1,Family Leisure,Economy Class,Los Angeles to Seattle,1.0,3.0,3.0,4.0,4.0,1.0,1,have lost all patience with this airlines,True," Los Angeles to Seattle. The flight was totally normal all the way to Seattle. Once we touched down the flight attendant explained that we needed to taxi for 5 mins before heading to our gate. It has now been 2 hours! I’m still on the plane moving ever slightly around the airport with no explanation of why it’s taking so long. I’m extremely tired and exhausted and have lost all patience with this airlines. Would not recommend Alaska Airlines to anybody because it truly sucks. To be totally honest, after you have read this review I probably will still be on the Tarmac!",-1
2019-12-22,0.2,Family Leisure,Economy Class,Portland to Lihue Kauai,1.0,1.0,2.0,1.0,1.0,1.0,2,on the tarmac for over an hour,False, Portland to Lihue Kauai. Been stuck on the tarmac for over an hour with little to no communication after a 6 and half hour flight while other airlines are able to get to a different gate. It is apparent that there is no plan B or backup plan to get customers on their way! I will never fly Alaska Airlines again.,-1
2019-12-18,1.0,Couple Leisure,Economy Class,Portland to Tucson,5.0,4.0,5.0,,5.0,5.0,5,Super comfortable flight,True," Portland to Tucson. Super comfortable flight with great seats. Excellent flight crew. One of the flight attendants was so good at her job, if she was in the ad no one would believe it. The pilots landed the plane as smoothly as it could be done - amazing!",1
2019-12-18,0.4,Business,Economy Class,Boston to Seattle,2.0,1.0,1.0,1.0,1.0,3.0,1,carrier has slipped dramatically,True,"  Boston to Seattle. Alaska Airlines used to be my favorite domestic USA/Canada carrier (although would choose most foreign carriers over north american if possible). Unfortunately, the carrier has slipped dramatically. The seats were uncomfortable and tiny, they've switched to tablet rental with minimal pocket space on the seat backs, it was cramped and uncomfortable. On a 6-hour flight, the flight attendants only seemed to be there to make more money selling mediocre food, drinks, and tablet rental (except for the constant water hand-outs to prevent people from dying from dehydration). They kept kicking me and bumping in to me, the toilets were a mess ... sad to see this formerly decent carrier slip into Spirit/Frontier land. The only bright side was the large amount of overhead bin space. In my mind this is the only thing that Alaska beats Delta on now, in most other aspects Alaska has become sub-standard",-1
2019-12-15,1.0,Family Leisure,Economy Class,Eugene to Maui,5.0,5.0,5.0,,5.0,5.0,5,flight crew was amazing!,False,"  I was given for( my 85th birthday a trip with 9 family members )a trip to Maui. Hawaii Flew from Eugene Oregon to Seatle then from there to Hawaii! I want to say it was so pleasant and the flight crew was amazing! They wished me a Happy Birthday and gave me a key nice bag with some treats and Wrote a very special birthday note Signed by the ""Your Alaska Crew"" Tonya, Christianna and Angie were the sweetest gals and made my trip special!!!! My daughter took care of all the tickets and details so I am not sure which flight. we Left Eugene Oregon at 5:15 am or thereabout on the 4th and went to Seattle for the next flight! not sure which flight but hope you can investigate and give this crew My best for a Happy Holiday and Thanks for making my trip special.",1
2019-12-14,0.8,Business,First Class,Los Angeles to San Francisco,4.0,3.0,4.0,3.0,4.0,4.0,4,Good and warm service,True,"  Los Angeles to San Francisco. 1.5 H flight from LAX to SFO with A320. Business class seats looks new and clean. Free WIFI for Text only and some snacks, one Air crew only for the business class but it fine. Good and warm service",1
2019-12-12,0.4,Business,First Class,San Francisco to New York JFK,2.0,2.0,1.0,5.0,,5.0,2,it's just getting worse,False,"  Alaska's first class service is just not ready for coast to coast travel. They have no coat storage. Seats are not very comfortable and don't recline much for first. It then took about 2 hours for the meal service to make it to us with only 1 stressed flight attendant serving and preparing the meals and drinks. Alaska's transcontinental service and seats were basically designed for short hauls. I have had great service and seats on United, JetBlue and others. I have tried Alaska now twice since the merger with Virgin America, and it's just getting worse.",-1
2019-12-12,0.1,Business,Economy Class,Fort Lauderdale to Anchorage via Seattle,1.0,1.0,1.0,1.0,1.0,1.0,1,Horrible service as usual,True," Fort Lauderdale to Anchorage via Seattle. Horrible service as usual. I fly back and forth to Florida and this time was forced to use Alaska Airlines. Before I start with the issue let me speak about their planes and service in general. Seats that don’t recline more than 1 inch, horrible staff, no screens on the seats like every other airline (they make you rent a tablet). The food is horrible and the bathrooms are small. We were late leaving the gate in Fort Lauderdale only by 5 minutes. Upon arriving in Seattle they had a plane blocking our gate so it took 30 minutes before we could dock the plane. I had to rush off the plane and I only made my gate with one minute to spare before they shut the doors on me. When I called to lodge a complaint they said there’s nothing they can do unless they made me miss it which I would have had I not ran like crazy. This is unacceptable. They blamed the 5 minute tardiness out of Fort Lauderdale, not the fact that they had one of their other aircraft blocking the gate. So basically. If you fly with these people you may not make it ever, and they do not care.",-1
2019-12-08,0.7,Solo Leisure,Premium Economy,Anchorage to Tampa via Seattle,4.0,4.0,5.0,4.0,5.0,2.0,3,not what I had hoped for,False,"  Recently flew from Anchorage to Tampa via Seattle. The flights were fine overall, great service, professional crews and the planes were in great shape. Overall a 9/10. The return flights were not what I had hoped for. No problem encountered with the actual flight crews but the ground staff, or lack thereof is another story. My flight out of Tampa was delayed by about 4 hours due to the original plane having to be replaced in Seattle due to mechanical issues, I understand this as it happens every once in awhile to all airlines. Needless to say this caused me to miss my connection in Seattle back up to Anchorage. There was no Alaska representative at our gate in Seattle when we landed and nobody staffing the Customer Service section. I ended up calling their customer service section and was impressed with how understanding the woman I spoke with was to my situation. She offered me a hotel but it was about 2am and my flight was to depart at 8am so I thanked her and said no. She offered to find me a flight on Delta but I declined the offer as well. My new flight did depart ontime and although I stayed up all night I was more than glad to arrive back home around 7 hours late. I had the time as I am retired but had I been working, it would have been a different story.",1
2019-12-05,0.1,Solo Leisure,Economy Class,San Diego to Seattle,1.0,1.0,1.0,1.0,1.0,1.0,1,Terrible customer service,False,"  San Diego to Seattle. Terrible customer service and awful management from the customer complaint team to the airline reservation team. Huge issues with traveling with an Esa dog and poor ability to communicate between departments. This airline used to be good and now it’s just absolutely cheap with some rude staff, and lacks the ability to come up with solutions.",-1
2019-12-04,0.1,Business,Economy Class,Los Angeles to Baltimore via New York,1.0,1.0,1.0,1.0,1.0,1.0,1,Customer service is horrible,False,  Los Angeles to Baltimore via New York. Alaska Airlines took over a wonderful airline called Virgin America and destroyed it! Customer service is horrible and rude they over charge at any instance. I had hopes they would follow in Virgin Americas footsteps but the opposite is true. I will never fly them again and will get rid of my Alaskan airlines credit card.,-1
2019-12-01,0.1,Family Leisure,Economy Class,San Francisco to Los Angeles,1.0,1.0,1.0,1.0,1.0,1.0,1,kept giving us false information,False,"  San Francisco to Los Angeles with Alaska Airlines. Worst airline crew, there was a delay due to weather and that is fine, but the delay was due to the crew not being prepared. The captain also kept giving us false information on the departure and arrival time, if you don't know the accurate numbers/time just say so, please dont lie to us. When someone says a of couple minutes it is not supposed to mean 40-50 mins.",-1
2019-11-28,0.5,Business,Economy Class,Anchorage to Missoula,1.0,1.0,1.0,5.0,4.0,1.0,1,my seat was downgraded,False,"  Anchorage to Missoula. What is up with this airline? Literally every time I fly there is an issue. I’ve flown 40k this year, and this time my seat was downgraded and the flight was delayed. Last time mine and my girlfriends seats were downgraded. The flight before my bag was lost. I am loyal to these guys, but they can’t ever get it together",-1
2019-11-27,0.4,Solo Leisure,Economy Class,Anchorage to Las Vegas via Portland,2.0,,4.0,,,3.0,4,never volunteer to check a carryon,False,"  After a fiasco with an original flight that was missed due to a traffic accident that closed the road, I was able to book a later flight to Las Vegas. In Anchorage they asked for volunteers to check their carryons to reduce the weight. Since I was grateful that Alaska Airlines was able to get me another flight that day, I gave them mine. Figured it was the least I could do. Didn't expect too much difficulty. Agent said the bag would go all the way to Vegas. It didn't. Got to baggage claim there and found out it only made it to Portland. The agent said they would most likely put it on the earliest flight from PDX, around 8am the next day, and they would bring it to the front desk of the hotel. They didn't. They put it on a flight to Seattle instead. So, I'm in this hotel, my toiletries et al are in Seattle and I don't know that I'll get the bag before I fly back the next day so I had to replace the items at the shop in the hotel. They charge $5 just for a bottle of water! But I had no choice. So, my budget for a 3 day trip was blown in 1 hour. I did get my bag after 1pm that day. But I will never volunteer to check a carryon with Alaska Airlines. I can't afford it. 5",1
2019-11-09,0.1,Solo Leisure,Economy Class,Los Angeles to Edmonton via Seattle,3.0,2.0,4.0,2.0,1.0,1.0,2,So many people missed the flight,False," Los Angeles to Edmonton via Seattle. Figure out your logistics. Having a plane land 10 minutes after boarding call on the next connecting flight is the stupidest thing I’ve ever witnessed during a flight. I had to run as fast as I could to go three terminals over in Seattle to make it. So many people missed the flight that the weight distribution had to be recalculated and signed off prior to taking off. If enough time was given for these patrons to make the flight, we would have been less delayed. Also, I booked a one-way flight but ended up on one with a transfer. It was communicated that my flight would land in Edmonton at 9:40 which ended up being the time to board the next flight. All in all, this was the worst experience I’ve had flying considering other delays I’ve had to deal with had valid reasoning for them. I sifted through one of the magazines during the wait and noticed an article on military working for the armed forces and Alaskan at the same time. I’m hoping they’re volunteering or supplementing their livable wage and that Alaskan is paying them enough. You would need to pay a premium to deal with the angry customers having terrible experiences on the services offered.",-1
