datePublished,ratingValue,travellerType,seatType,route,seatComfort,foodBeverage,cabinService,inflightEntertainment,wifiConnectivity,groundService,valueForMoney,commentHeader,tripVerified,reviewContent,sentiment
2018-11-22,0.2,Solo Leisure,Economy Class,Seattle to Phoenix,1.0,,3.0,,3.0,1.0,1,disgraceful to treat customers this way,True,"  We boarded at N Gate 12A. One of the people I was sitting near found out that there would not be a boarding ramp that connected to the building for us to get on the plane. The agent at the desk told us that we had to walk down 2 flights of stairs, across the tarmac, and then up a winding ramp to get into the plane. Several of us agreed we couldn't do that, mainly the two flights of steps. I ordered a wheel chair to take me down the elevator to the lower level, across the tarmac, and up the ramp into the plane. Some of the rest of them just walked along with me and went down the elevator, too. N gate 12A had hardly any places for people to sit and wait, and people were sitting on the floor all around that gate. That plane was either a 737-800 or -900, and I think they should have been able to have it come in to a gate where there was a boarding ramp. The young man right ahead of me was in a wheel chair, also. He decided to walk up the ramp after we got out to the tarmac. He had feet that turned outwards, and he had a terrible time walking up that ramp into the plane, especially because it was a winding ramp. He was right ahead of me, and I watched him walking. What an experience. It looked like Gate N12A used to be N12, but the airlines had chopped it up into 3 pieces so they could have 12A, 12B, AND 12C. Hard to believe such a fancy airport has nowhere for people to sit while they wait 2 hours for a light. The old lady who was already sitting in a wheelchair was one of the few who had a seat. I think it's disgraceful to treat customers this way. I will have to think long and hard about flying Alaska Airlines again.",-1
2018-11-18,0.4,Family Leisure,Economy Class,Honolulu to San Jose,2.0,3.0,4.0,3.0,3.0,1.0,3,do not care about your belongings,True,  Honolulu to San Jose. I bought a new piece of luggage on my vacation and when I picked up my luggage the wheel was ripped off. Called to make a claim and they said sorry we don't cover wheels. Another lady got her luggage back and it was all  dented in. Do not fly Alaskan Airlines they do not care about your belongings.,-1
2018-11-18,0.2,Couple Leisure,Economy Class,Salt Lake City to San Diego,2.0,1.0,1.0,1.0,1.0,1.0,4,never fails to disappoint!,True,"  Salt Lake City to San Diego. Alaska never fails to disappoint! Only took the flight because it was free (used miles to buy). My wife is in a wheelchair, and the only thing Alaska cares about is trying to get an extra couple of $$ out of you. I have a Frequent Flyer number, so I get checked bags, yet they still want to charge. I offer for them to check my carry on, but they want to charge me until I get to the gate then they ask for people to volunteer to check their bags. (frustrating) I have learned not to use their Wheel chairs, because they leave you in the handicap seat at the gate and take the wheelchair. Which makes it hard to get your wife to the bathroom when you have a 2 hour wait. They won't upgrade people with medical conditions, first responders, teachers etc. to roomier seats even if they go empty. WHY??? All they care about is money not people. Other than that the flight itself was fine. I set a laugh how one row makes the difference between getting a hard stale cookie, and a bag of chocolate covered pretzels. Sorry I have medical bills to pay. If you have a medical condition I would recommend flying elsewhere",-1
2018-11-17,0.7,Solo Leisure,Economy Class,Boston to Seattle,5.0,3.0,5.0,3.0,,5.0,4,definitely above average,True," Boston to Seattle. Overall an above average experience, but a bit to be desired on the competitive trans-continental route. The gate area used at Boston Logan for Alaska is quite lacking, with only one little area with especially overpriced food and old-looking carpeting. Onboard, legroom is beautiful, with plenty of room as one who is 5'10 or about 177 cm. Seat width on 737s is typically an issue, but I actually found it to be quite doable on this long haul. Now, what I alluded to regarding competition is JetBlue, who provides free WiFi and seatback entertainment, with plentiful snacks and drinks. For this route, JetBlue and Alaska were the exact same price, and I decided to try Alaska to try something new. Alaska skimped on the drinks, charges a whopping $45 for wifi (except iMessage, WhatsApp, and Facebook messenger, which can be used free of charge), and offers on-device entertainment through an app, or a tablet for $10. I purchased the fruit and cheese platter for $8.50, which was fine except for the slightly browned apples. I ended up being double charged and am still awaiting my callback regarding my dispute, after four days now. The plane was brand new, just two years old, and the gate staff and flight attendants were particularly kind and helpful. Another huge plus is an outlet and USB port which is on the seatback, actually, making very easy access, as opposed to between the seats near the floor. Alaska Airlines is definitely above average, but certainly there are better options, such as JetBlue, on the market.",1
2018-11-14,0.2,Couple Leisure,Economy Class,Seattle to Maui,1.0,1.0,3.0,4.0,4.0,1.0,2,The old bait and switch,True,"  Seattle to Maui. I have flown Alaska for years. Was a former Gold member. Anyway, booked a Maui vacation 9 months in advance, had confirmed selected seats only to be informed we had been moved to the last row where the seats don't recline for a long flight. The old bait and switch. Not an Alaska Airline fan anymore.",-1
2018-11-13,0.1,Solo Leisure,Economy Class,Newark to Los Angeles,1.0,,1.0,,,1.0,1,never use Alaska Airlines again,False,"  Newark to Los Angeles. I will never use Alaska Airlines again due to the poor customer service I just received. I’m disputing a claim because I was charged erroneously for more than 1 bag for a flight I took in October where the agents at the desk took separate payments for myself and my friend who traveled together. There's allegedly no record of her paying for her own bag (i find that hard to believe) and they charged me twice. The customer service agent at Alaska Air didn’t want to help me unless I could produce a receipt, which my friend doesn’t have because this is now over a month later and she probably threw it out. So I’m being penalized for their oversight, and my bank is siding with the airline. This is the worst customer service on an airline I’ve ever had. Not to mention you get absolutely nothing when you fly anymore, the planes are getting smaller and flights keep increasing. All I’m asking is to be refunded for 1 bag - you’d think I was asking for a kidney donation. It makes no sense, if I was paying for her bag, why was I not charged on the way back? This has ruined my entire day for the way I was treated.",-1
2018-11-13,0.9,Couple Leisure,Economy Class,Denver to Vancouver,3.0,,5.0,,,3.0,3,provided excellent service,True,"  Denver to Vancouver. Just want to commend an employee who provided excellent service, the likes of which I haven’t seen for a while. There was a mom sitting in front of us with two children, one of whom wasn’t behaving well. He had some kind of device playing a game that was really annoying for the rest of us and the stewardes politely but firmly said he couldn’t remain with the sound on but she would get some headphones. The plane wasn’t completely full and once we had taken off, the stewardess gave a few passengers the option to switch into other seats to make this flight a little more comfortable. She did it in a well managed way. The stewardess then brought the child in front who was still having problems something to amuse him and a treat. He still wasn’t behaving well for his stressed mother so the stewardess took him for a walk around the plane to give the mom a bit of a break. She brought him back and continued with her work but then she returned again later, knowing the mother was still in a mini crisis. She took the time to sit with this mom and talk with her, understanding the difficulties she was having and giving her the comfort she needed. Both my husband and I were so impressed with her compassion and attentiveness and we are sure she made a huge difference to this mom. Top marks.",1
2018-11-12,0.2,Solo Leisure,Economy Class,Ft Lauderdale to Los Angeles,4.0,1.0,1.0,3.0,,1.0,1,terrible flight experience,True,"  Ft Lauderdale to Los Angeles. This was the most terrible flight experience ever because of one flight attendant. She was rude, unprofessional, unreasonable and ill-mannered. Her attitude doesn't belong to any job with customer service involved. It started with me not feeling well at the take off, so I had to first use my ""little red bag"" for that purpose & then two more bags of people traveling next to me. As soon as seat belts lights were off, I got up & proceeded to the bathroom to wash myself off. I kindly asked the male attendant, who was there, for extra bags, since I was feeling ashamed to ask people at front or rear rows for their bags. The attendant apologized to me but admitted they were completely out of bags! I went back and had to ask complete strangers in the back of my seat row to borrow their bags. I was then throwing up for another 30 minutes or so in fear that I will use all other bags and run completely out of it. My neighbor then brought me some napkins, so I was very grateful. I also used all water I had left in my bottle. I got up again & went to the bathroom. When I came out the attendant's cart with drinks was literally at my 19th row but they were still servicing people ahead of my row, so if they would move just one row back I would take my seat, but the flight attendant refused when I asked her to allow me to sit. I had to go back to the bathroom area to wait while I was so dehydrated that I could't even stand without leaning up against the wall. The FA passed by me few times taking more drinks (small wine bottles) with her. One time I stopped her asking for a cup of water. She said she can't stop the service because it wasn't her fault that I missed my time in my row. I pointed at the bottle of water standing near her working station, but she said its was her partner's bottle that he was using. It was obvious that the bottle was unopened and full. I explained her that I was feeling really sick, but she pretended not to hear me, and went back to serve others.",-1
2018-11-07,0.1,Solo Leisure,Economy Class,Los Angeles to New York,1.0,1.0,1.0,1.0,1.0,1.0,1,luggage totally damaged,True,"  
Los Angeles to New York. Terrible airlines. I received my luggage totally damaged. It took me months of fighting with airline and hours of calling to get my money back! They would never reply or call to solve the problem. The operators and managers have no respect to the costumers and dont want to take responsibilities! Will never use Alaska Airlines again!",-1
2018-11-01,0.3,Business,Economy Class,Portland to Redmond,1.0,,1.0,,,3.0,4,incredibly rude and unacceptable,False,"  I have always enjoyed using Alaska Airlines. But, last night was different. I was on a short, late flight out of Portland into Redmond, OR. The plane was not full, in fact there were several empty rows. I had a long day of classes in Los Angeles, and flights home to Central Oregon. After the airline attendant had finished her duties of counting the passengers, and getting ready for the flight (the aircraft had not started moving yet-still sitting waiting) I kindly asked if I could move to the seat behind me. I really wanted a relaxing flight home. She said, ""it is a short flight, just stay where you are"". This was incredibly rude and unacceptable to me as a mileage member with Alaska. After I had nicely asked, there were others that moved without asking. I was respectful, and she was not. I would like somekind of explanation of why I was treated this way.",-1
2018-10-29,0.1,Couple Leisure,First Class,Seattle to Austin,1.0,1.0,1.0,1.0,1.0,1.0,1,put me in the back of the plane,True,"  Seattle to Austin. I booked a first class ticket as you can see. A completely different first class seat is broken but for some reason they took my seat away, put me in the back of the plane and gave this person my first class seat.",-1
2018-10-28,0.1,Solo Leisure,Economy Class,Seattle to Los Angeles,,,,,,1.0,1,extremely unacceptable,True,"  Seattle to Los Angeles. 4 days ago I called to purchase ticket, which could only be done via phone. During the process at some point the Alaska Airlines agent booked two other flights costing me over $2,600 using my credit card they also sent me their customers personal & flight information to me via email! The day the mistake happened (Tuesday) I was told my refund would be made within 3 days. I called Alaska Airlines today (day 4) and I'm getting the runaround with different numbers to call at a certain time. This is extremely unacceptable that I had to pay somebody else's flight, and even more not having my refund yet it is not $100 mistake it a greater than that.",-1
2018-10-17,1.0,Family Leisure,Economy Class,Portland to Las Vegas,5.0,5.0,5.0,5.0,5.0,5.0,5,"great, friendly, caring",False,"  Portland to Las Vegas. I've flown quite a bit but this was the first flight ever for my grand daughter, who was turning 7 that day. She was fine until we boarded the plane and then it hit her and she was terrified. The flight staff immediately upon hearing it was her birthday offered to take her to meet the captain while people was still boarding, she went in but was too shy to allow a picture but he gave her her wings regardless. Then we sat in our seats, it was myself, my daughter in law and my grand daughter. By this time my grand daughter is full terrified mode, the flight attendant came up and was so kind and reassuring to her and made her feel at ease. Once we were up in the air, she brought her over a little snack pack and a soda and came over to check on quite frequently. Soon she decided flying wasn't too bad and actually liked it. She even wanted to take a picture with the FA but it was a full flight and she was very busy and we never got the chance. More than one crew member stopped to check on my grand daughter always making sure she was okay and wishing her a happy birthday. So my review of Alaska was they are great, friendly, caring and I for one will be a return flyer with them. Oh and Alaska now offers free movies and headsets! Way to go Alaska!",1
2018-10-16,0.1,Family Leisure,Economy Class,Newark to Seattle,1.0,1.0,1.0,1.0,1.0,1.0,1,horrible in every way,True,"  Newark to Seattle. I used to think United was the worst airline as far as customer service, efficiency and overall experience but after this trip, I now think Alaska is the worst. Our experience has been horrible in every way. Flight and boarding gate crew have been slow, rude and unhelpful. Our flight gate has changed both on our arrival flight and departure. Our departure flight was delayed but not for weather or even maintenance - just overall inefficiency. On our departure flight, they were out of several of the food and beverage options. I plan to cancel my mileage credit card and avoid this airline in future.",-1
2018-10-14,0.1,Couple Leisure,Economy Class,San Francisco to New York,1.0,1.0,1.0,1.0,1.0,1.0,1,I do not recommend the airline,True,"  San Francisco to New York. I paid as much money as anybody else, however my seat at the very back of the plane was not reclining on an overnight flight. The little comfort I could have had was not given to me. The stewardess told me there is nothing she can do. I do not recommend the airline.",-1
2018-10-14,0.1,Couple Leisure,Business Class,Los Angeles to Ft Lauderdale,1.0,1.0,1.0,1.0,1.0,1.0,1,a second class citizen,True,"  Los Angeles to Ft Lauderdale. If you have never heard of the saying ""second class citizen"" then fly this airline. If you are not in First class then you are a second class citizen. I would have purchased a first class ticket but there were none available. This plane only had 12 first class seats. TV did not work for most of the 5.5 Hr flight. Have to pay for internet.",-1
2018-10-06,0.2,Solo Leisure,Economy Class,Medford to Seattle,2.0,,3.0,,,1.0,1,I was bumped to a 9pm flight,False,  Medford to Seattle. I made a reservation few weeks ago to leave Medford at 9:30 am to get at 11 am into Seattle which is a decent time to get Seattle. Got an email 2 days prior departure telling me that I was bumped to a 9 pm flight arriving at 10:30 pm Time to get luggage it will be 11 pm and getting a UBer I am looking at midnight in Seattle. Tried to change flight for next day but only flight available are 5:20 am meaning I have to be at airport at 4:20 am. Decided to keep my flight at 9:00 pm which now is Delayed to at least 9:30 pm or more I am in limbo.,-1
2018-09-30,1.0,Solo Leisure,Economy Class,Portland to Los Angeles,5.0,5.0,5.0,5.0,5.0,5.0,5,what real customer service looks like,True," Portland to Los Angeles. I accidentally booked my flight for the day before I wanted to leave for my trip. I didn't realize until I got to the airport and went to check in. Luckily, an attendant at the counter was there to help! She calmly clicked away on her keyboard and within a few seconds, told me she had switched me to the flight for that day! This is what real customer service looks like!",1
2018-09-29,0.1,Business,Economy Class,San Jose to Burbank,3.0,,3.0,,,1.0,1,dismal and unprofessional,True,"  Truly dismal and unprofessional event. At gate 5.30am for advertised 5.55am boarding and 6.35am departure. Delayed, first by 15 minutes, then a further 15 minutes. Helpful gate agent took time to explain a/c had suffered bird strike on last leg of previous evening, but crew hadn't reported it. Morning crew had observed bird debris on walkaround, and needed a licenced engineer to inspect and sign off as airworthy. He was due before 7. He didn't show. Boarding changed to 7.30am. That came and went. No there was no Alaska engineer available so a 3rd party was coming. He arrived but wasn't licensed for the E175! Promises of 8am departure came and went. Several discussions were had with gate staff who promised the flight wouldn't be cancelled. At 8.20, after all my alternatives had departed, the flight was cancelled. Yes, the refund was set up instantly, but my careful prepared business meeting got burned, all down to a total lack of responsibility and process by the previous evening's crew.  Anyone except Alaska next time, which is a shame. In all my years of travel, this is my first 1 rating, and that's for processing the refund.",-1
2018-09-19,1.0,Solo Leisure,First Class,Las Vegas to Los Angeles,5.0,5.0,5.0,4.0,4.0,5.0,5,Excellent first class,True, Las Vegas to Los Angeles. Excellent first class seats on this A320. Only two rows of first class but the seats are wonderful for U.S. domestic First. The Alaska Airlines staff were wonderful and the overall experience could not have been topped. All of the seat functions worked and the plane is very comfortable.,1
2018-09-17,0.7,Business,Economy Class,San Diego to Kahului,3.0,,4.0,,,4.0,5,pretty good experience,True, Overall a pretty good experience. I was able to change seating with a simple phone call just after booking. The plane left on time. The flight crew seemed well trained. It seems to be a discount airline and they charge for check in bags and any food. But the price was good and I was not expecting a lot.,1
2018-09-11,0.2,Family Leisure,Economy Class,Seattle to Reno,2.0,1.0,1.0,,,2.0,2,steward was very rude,False,"  Seattle to Reno. The flight itself was smooth. The steward was very rude. They wouldn't serve soda, even though the cart was full. They said the flight was too short to serve drinks, but served water, juice and you could buy alcohol. That makes zero sense that the flight was too short to serve drinks, (soda only), but they served drinks. That being said, my flight home, which was the same distance, served drinks including soda. Still scratching my head on that one. Anyhow, we were shortly going to start the descend into Seattle so I started to get up to use the bathroom and the FA very rudely told me to sit back down, I could not use the bathroom. It was another 10 minutes from the time he told me I couldn't use the bathroom until the fasten seat belt sign came on. Then he came by and got in my face and again, rudely told me to put my seat back up. I didn't even realize my seat was back because the person behind me kept pulling my seat and apparently it reclined it and I didn't notice it. He could have politely asked me. I was never rude to him although maybe I should have been. Even the people around me kept saying ""what is this guys problem"". I have never been on a flight with such horrible behavior from a steward. My flight home was great until I retrieved my luggage. My zippers were ripped off my bag and someone had gone through my bag. I thought if TSA searches your bag, they have to put a note in your bag that they have done so. I have had this happen before; there was no note that TSA searched my bag so if this is protocol, then Alaska should be keeping an eye on their employees. I feel very violated. It's probably a good thing I didn't have anything worth stealing in there.",-1
2018-09-08,0.9,Solo Leisure,Economy Class,San Diego to Seattle,4.0,4.0,4.0,4.0,3.0,5.0,5,very friendly and welcoming,True," I had such a great experience with Alaska Airlines. We missed our flight by only 5 minutes and they were super accommodating and understanding and were able to get me on the next flight out to Seattle, WA from San Diego within the next two hours. They were very friendly and welcoming. Will definitely be booking with them again.",1
2018-09-07,0.6,Solo Leisure,First Class,Vancouver to Fairbanks via Seattle,4.0,3.0,5.0,3.0,,4.0,4,"FAs available, friendly and attentive",True,"  Vancouver to Fairbanks via Seattle. First Class. Alaskan First is better than other’s premium economy and European domestic business, very similar to Qantas domestic business. FAs available, friendly and attentive at all times. Contrary to impression given by their website and check-in staff, I was denied lounge access at YVR. Although the flight to Seattle is timetabled for an hour, because, so we were told, we were in the air for only half an hour there was no in-flight catering at all. Why should that mean no welcome drink? Ground congestion at YVR delayed us and we only just made the connection at Seattle. Ground congestion there was extreme, nearly an hour from push back to take-off. This meant that we did not get lunch until nearly 4 pm. Catering when it finally arrived was good, though. My bag did not make the connection and was eventually delivered to me at 11.30 pm at my Fairbanks hotel. As a result, I received an e-mail apology and offer of a discount on a future flight, more than you get from some carriers.",1
2018-09-02,0.1,Solo Leisure,Economy Class,Los Angeles to Newark,,,,,,1.0,1,I am 5 hours delayed,True,"  Los Angeles to Newark. This airline moved me to a way later flight for my connecting flight to Newark without my knowledge and despite my on time arrival to the gate. Now, I am 5 hours delayed.  The transfer from LA terminals was not easy as well. Unacceptable decisions by the ticketing office. Unbelievable.",-1
2018-08-30,0.1,Couple Leisure,Economy Class,Anchorage to Dallas,2.0,1.0,2.0,,,1.0,1,customer service is non-existent,True," After vacationing in Alaska we used Alaska Airlines - needless to say we won't make that mistake again. We landed in Seattle and had about a 2 hour layover. We grabbed a bite to eat and headed for our gate only to find no one there. We asked if there had been a gate change and found out that yes it was changed. The agent was about as personable as a badger. We had to jump on the train and get to another concourse and fortunately made it there in time. The ticket agent at this gate, who had her hair piled on her head that looked like a birds nest was about as pleasant as the previous agent. We finally got onboard and sat there for the next two hours. The plane had sustained a bird strike which required a one hour maintenance review. The next hour was spent waiting for them to fuel the plane which was not taking fuel. After a two hour delay we finally took off. Upon our arrival in Dallas we went to collect our luggage. It used to be brown, clean and very nice. That is no longer the case. Least I mention that I am also missing a shoe which leads me to believe that baggage handlers went thru my luggage. Needless to say I was furious and was told that no one was available to take our claim at that hour of night. We incurred further expenses because we had to book a hotel as we had been up since 2 am, it was then 9 pm and we still had to make a 3 hour drive to get home. I also had to pay my dog sitter an additional day. I have filed a complaint within Alaska Airlines policy of making said complaint within a 24 hour window. Thus far all I have gotten back from them is an email acknowledging the complaint and that it will take them approximately 30 days to respond. Their customer service is non-existent! They don't care about their passengers or their belongings - they care about how many nickels and dimes they can squeeze out of you. They ruined our vacation!",-1
